Content,Organization Names
"['Prime Minister Narendra Modi held bilateral meetings with three ASEAN leaders, including his Vietnamese counterpart Nguyen Xuan Phuc and Myanmar\'s State Counsellor Aung San Suu Kyi, and discussed key bilateral and regional issues.After the meeting between Modi and the Myanmarese leader, external affairs ministry spokesman Raveesh Kumar tweeted, ""The two leaders had a productive discussion on intensifying bilateral cooperation, including follow up on key decisions taken during PM\'s visit to Myanmar in September 2017.""Today\'s meeting came nearly a month after India and Myanmar inked an agreement on restoration of normalcy and the development of the Rakhine State, from where thousands of Rohingya Muslims recently fled following incidents of violence against the community.Signed during Foreign Secretary S Jaishankar\'s visit to Myanmar, the pact was the first government to government agreement by Myanmar with a cooperation partner focused on socio-economic development and livelihood initiatives in the Rakhine State.related newsNews in Pics: Your daily dose of pictures from around the worldPadmaavat controversy LIVE: 18 arrested in Gurugram school bus attack caseGovernment to provide jobs to those with learning disabilitiesThe prime minister also met his Vietnamese counterpart Nguyen Xuan Phuc and discussed boosting of ties in key areas of trade, investment and defence among others.""Long standing traditional and strategic partnership! The prime minister met with Vietnamese PM Nguyen Phuc. Discussed cooperation in trade and investment, defence, maritime and other areas. Agreements were signed in areas of Information and Broadcasting and Space cooperation,"" Kumar said.An MoU between India\'s Ministry of Information and Broadcasting and Ministry of Information and Communications of Vietnam was also signed.The agreement was inked to enhance cooperation in the field of information and broadcasting based on the principles of equality and reciprocity.An implementation arrangement was also made between ISRO and Vietnam\'s National Remote Sensing Department for establishing tracking and data reception station and data processing facility in Vietnam under the ASEAN-India Space Cooperation.""This would define the framework and conditions of cooperation for establishment of facility to provide Indian remote sensing satellite data over ASEAN region to enable remote sensing applications, which include natural resources management, ocean development and disaster management by ASEAN member states,"" an external affairs ministry release said.Later, Modi also met Philippines President Rodrigo Duterte.""Adding momentum to the close relationship! PM @narendramodi met with President of Philippines, Rodrigo Duterte. Trade and investment, defence & security, education and people-to-people cooperation were discussed. An agreement to facilitate investment was signed,"" Kumar tweeted with photos of the meeting.After Modi-Duterte meeting, a pact between Invest India and the Board of Investments of the Philippines was inked, the release said.This MoU aims to facilitate direct investment between our two countries by providing practical investment information to enterprises, promote direct investment opportunities, and support the companies pursuing those opportunities to contribute positively towards economic growth, it said.The highest-level of participation at the India-ASEAN Commemorative Summit, to mark the 25 years of Indo-ASEAN ties, comes in the backdrop of increasing Chinese economic and military assertiveness in the region.Some experts feel that the meet can be an opportunity for India to present itself as a powerful ally to these countries in the strategic areas of trade and connectivity.The Association of Southeast Asian Nations (ASEAN) comprises Thailand, Vietnam, Indonesia, Malaysia, the Philippines, Singapore, Myanmar (Burma), Cambodia, Laos and Brunei.All the 10 ASEAN leaders will also be the chief guests at the Republic Day parade.']","ASEAN, State, Counsellor, Aung, San, Suu, Kyi, Rakhine, State, Rohingya, Muslims, Foreign, Rakhine, worldPadmaavat, disabilitiesThe, MoU, Ministry, Ministry, Communications, ISRO, National, Remote, ASEAN, ASEAN, Board, Philippines, MoU, ASEAN, Philippines, ASEAN, Republic"
"['The Trump administration slapped sanctions today on North Korean financial and business networks in China and Russia as it pushed to cut off revenues for the increasingly isolated nation\'s nuclear and missile programs.The Treasury Department\'s Office of Foreign Assets Control also targeted five North Korean shipping companies and six of its vessels. That\'s part of an intensified effort by Washington to interdict ships that help the North evade sanctions.The sanctions have been tightened significantly in the past year as Kim Jong Un\'s government accelerates toward perfecting a nuclear weapon that can threaten the US mainland.While Beijing and Moscow have supported UN restrictions, they bristle at Washington imposing unilateral sanctions to bolster the pressure campaign.related newsAlibaba, US grocer Kroger had early business development talks: SourceDonald Trump takes his \'America First\' policies to Davos \'globalists\'Qualcomm signs $2 billion sales MOUs with Lenovo, Xiaomi, vivo and OPPOThe intensification of the US-led campaign is a counterpoint to a thaw in relations between North and South Korea revolving around the North\'s participation in next month\'s Winter Olympics being hosted by the South.That has eased tensions on the divided peninsula, but the North shows no sign it\'s willing to negotiate over its nuclear program.""The US government is targeting illicit actors in China, Russia, and elsewhere who are working on behalf of North Korean financial networks, and calling for their expulsion from the territories where they reside,"" Treasury Secretary Steve Mnuchin said in a statement. Americans are barred from dealing with those who are designated.Among those blacklisted were 10 representatives in China and Russia of the Korea Ryonbong General Corporation, which is already designated by the United States and the United Nations and is said to support the North\'s defense industry.The Treasury Department said the company\'s procurements also probably support North Korea\'s chemical weapons program.Half of the individuals are located in the Chinese cities of Dandong, Ji\'an, Linjiang and Tumen near the China-North Korea border. Others are based in Russia and Abkhazia, a breakaway province of Georgia.They include, Kim Ho Kyu, said to be a Ryonbong representative and North Korean vice consul in Nakhodka, Russia.The Treasury Department also designated five individuals it said were linked to North Korean financial networks, and pointedly highlighted that several of them held accounts at Chinese banks.North Korea conducts most of its trade through its northern neighbor China, and is believed to rely on banks and companies in that country to connect with the international financial system.The department added to its blacklist two China-based companies, Beijing Chengxing Trading Co Ltd and Dandong Jinxiang Trade Co., Ltd. It said that between 2013 and 2017, the two companies cumulatively exported over USD 68 million worth of goods to North Korea and imported more than USD 19 million of goods from North Korea.Also designated were North Korea\'s ministry responsible for crude oil and Hana Electronics JVC, one of North Korea\'s only electronics companies.']","Treasury, Foreign, Assets, Control, MOUs, OPPOThe, Treasury, Korea, Ryonbong, United, Nations, Treasury, Department, Treasury, Department, USD"
"['In an order which may not go down well with companies producing goods of common use, the Maharashtra government announced a ban on sale of tobacco at shops that sell chocolates, chips and other edible items, a top FDA official said.The move is aimed at ensuring youngsters do not get addicted to tobacco products, a top Food and Drug Administration (FDA) official said.""Children tend to get influenced a lot by the presence of tobacco and other items while they are out shopping for food items like chocolates and chips,"" Pallavi Darade, Commissioner, Maharashtra Food and Drug Administration, told reporters here.She said the move followed a directive from the Centre.related newsNews in Pics: Your daily dose of pictures from around the worldPadmaavat controversy LIVE: 18 arrested in Gurugram school bus attack caseGovernment to provide jobs to those with learning disabilitiesThe Union government had directed state governments to enforce a ban on sale of tobacco at outlets which also sell Fast Moving Consumer Goods (items of general public consumption).Maharashtra, which came out with a notification on January 9, became the first state to enforce the ban, the officer claimed.Several shops sell tobacco and related products as also other FMCG items.Darade, however, did not say how many shops could be affected by the ban.Shops and establishments caught selling both tobacco and FMCG items would face penal action, including cancellation of their licence, up to six months imprisonment, and a fine.The FDA has also extended the ban on scented supari (areca nut) by six months till July 2018, she said.Darade said, at a meeting with Maharashtra\'s Minister of State for Home, Ranjit Patil, she sought cancellation of registration of vehicles caught ferrying the banned items and cancellation of drivers\' licences under the Motor Vehicles Act. She did not elaborate on whether her proposal was accepted.The state has also planned disposal of over 5,500 cases under the Prevention of Food Adulteration Act through local-level courts in February, she said. Some of these cases are 20 years old.Maharashtra will be the third state after Kerala and Gujarat to dispose of cases under the old act, she said.Noting that only nine lakh vendors serving food items were registered in the state, Darade appealed to them to get registered with the FDA on their own, failing which action would be taken against them.The administration is undertaking a ""street-wise"" drive to check compliance and will act tough against those who are not registered, she said, adding that street-side food vendors also have to register.Darade said more people were needed to enforce the laws concerned and the FDA has sought approval for creating 1,000 additional posts for that.The FDA has also undertaken a drive against milk adulteration across the state and sent 742 samples to laboratories for testing, she said.']","FDA, Food, FDA, Commissioner, worldPadmaavat, disabilitiesThe, Union, FMCG, FMCG, FDA, Motor, Vehicles, Act, Food, Adulteration, FDA, FDA, FDA"
"['China\'s commerce ministry said on Thursday co-operation is the only ""correct direction"" for the China-U.S. trade relationship, amid growing trade frictions between the world\'s two biggest economies.Commerce ministry spokesman Gao Feng made the comments during a regular weekly briefing in Beijing.U.S. Commerce Secretary Wilbur Ross said on Wednesday the United States is not starting a trade war but trying to level the playing field of global commerce and fend off Chinese protectionism, including a ""direct threat"" in high-tech goods.']",Commerce
"['Britain\'s planned departure from the European Union is ""a mistake, not a disaster"", former premier David Cameron said during a conversation caught on camera in Davos today.Cameron stepped back from frontline British politics in the wake of the historic 2016 referendum, but was caught airing his views on Brexit at Switzerland\'s gathering of the world\'s business elite.""It\'s frustrating. As I keep saying, it\'s a mistake, not a disaster,"" he told Indian billionaire businessman Lakshmi Mittal on the sidelines of the economic summit.""It\'s turned out less badly than we first thought. But it\'s still going to be difficult,"" he added, in a conversation filmed by Britain\'s Channel 5 News.Cameron orchestrated the vote on June 23, 2016, in which the country chose to leave the EU, despite himself backing the campaign to remain in the bloc.He stepped down as prime minister the morning after the referendum, leaving his successor Theresa May to enter fraught EU negotiations with a cabinet divided on Brexit lines.Britain has said it will leave the union on March 29, 2019, and after reaching an initial agreement on exit terms is due to enter further talks on its future relationship with Brussels later this year.']","European, Union, Switzerland\, Channel"
"[""Prime Minister Narendra Modi and Bollywood superstar Shah Rukh Khan were among the top three personalities who were mentioned on social media platforms from Davos on the first two days of the World Economic Forum meeting, an international analytics firm said today.The top spot has been garnered by US President Donald Trump, who would address the World Economic Forum on Friday.Hashtag #IndiaMeansBusiness is the only non-Davos or non-WEF hashtags appearing in the top five, according to international social media analytics firm Talkwalker.#IndiaMeansBusiness with 34,802 impressions is placed fourth in the top five Davos hashtags.related newsNews in Pics: Your daily dose of pictures from around the worldPadmaavat controversy LIVE: 18 arrested in Gurugram school bus attack caseDonald Trump takes his 'America First' policies to Davos 'globalists'The others being #WEF18 (131,575), #Davos (116,630), #WESF2018 (38,802) and #Davos2018 (23,051).Modi is the first Indian Prime Minister to address the World Economic Forum meeting in Davos in nearly two decades.On January 23, Modi, the day he addressed the WEF, was the second most leading personalities when it came to social media mentions.Modi was mentioned about 9,100 times, as against Trump's more than 18,000 times.Shah Rukh Khan came third with he being mentioned 7,500 times mostly for being receiving award for human rights awareness.On January 24, Trump continued to on top of the personalities chart with 22,700 mentions on social media platforms.With 2,290 mentions, mostly for his positive reaction to Modi address, Shah Rukh Khan came a distant second.Modi was mentioned 2,168 times in social media platforms from Davos.He gained the third spot, according to Talkwalker.Melania Trump and Canadian Prime Minister Justine Trudeau occupied the fourth and fifth spots respectively.""]","US, IndiaMeansBusiness, newsNews, worldPadmaavat, caseDonald, Trump, WESF2018, WEF"
"['On January 24, 2018 Deutsche Securities Mauritius sold 54,55,856 shares ofCyientat Rs 630.35 on the NSE.However, Goldman Sachs India Fund bought 16,50,000 shares at Rs 630.On Wednesday, Cyient ended at Rs 640.80, down Rs 21.80, or 3.29 percent on the NSE.The share touched its 52-week high Rs 686 and 52-week low Rs 440.20 on 23 January, 2018 and 01 February, 2017, respectively.Currently, it is trading 6.59 percent below its 52-week high and 45.57 percent above its 52-week low.']","Deutsche, Securities, Goldman, Sachs, India, Fund"
"['On January 24, 2018 Acadian Emerging Markets Small-Cap Equity Fund LLC sold 24,86,657 shares ofHousing Development and Infrastructure(HDIL) at Rs 59.97 on the NSE.On Wednesday, Housing Development and Infrastructure was quoting at Rs 59.35, down Rs 1.65, or 2.70 percent on the NSE.The share touched its 52-week high Rs 101.80 and 52-week low Rs 47.00 on 16 May, 2017 and 09 August, 2017, respectively.Currently, it is trading 41.7 percent below its 52-week high and 26.28 percent above its 52-week low.']","Development, HDIL, Housing, Development"
"['On January 24, 2018 India Whizdom Fund sold 5,00,000 shares ofIndoco Remediesat Rs 280.01 on the BSE and sold 5,88,800 shares at Rs 280 on theNSE.On Wednesday, Indoco Remedies ended at Rs 298.90, up Rs 6.05, or 2.07 percent on the NSE.It has touched a 52-week high of Rs 317.40.']","Remediesat, BSE"
"['U.S. President Donald Trump said on Wednesday that his long-awaited plan to help rebuild the nation\'s infrastructure would result in about $1.7 trillion in overall investment over the next 10 years, a larger figure than he previously announced.The plan, which will be detailed in part at next week\'s State of the Union address, will actually probably end up being about $1.7 trillion, Trump told a gathering of mayors at the White House. Trump previously valued the plan, which is expected to feature a mix of federal and local investment, at $1 trillion.The administration is expected to ask Congress for $200 billion in federal spending on infrastructure aimed at encouraging more than $1 trillion in state, local and private financing to build and repair the nation\'s bridges, highways, waterworks and other infrastructure.Republican Senator John Thune, who chairs the Commerce Committee, told Reuters in an interview on Tuesday that the big challenge ""would be how do you pay for it and the (Trump administration is) talking about spending cuts, which are unspecified.""related newsAlibaba, US grocer Kroger had early business development talks: SourceDonald Trump takes his \'America First\' policies to Davos \'globalists\'Qualcomm signs $2 billion sales MOUs with Lenovo, Xiaomi, vivo and OPPOThune said it was probably going to be ""tough"" to get Democrats to support a deal without the federal government raising additional revenue for improvements.He said in order to get a bill approved this year, it would need to be moving through both the House of Representatives and Senate by late spring or early summer. Trump will need to make a big push to win approval, Thune added.Reuters reported last week that the plan involved $100 billion in cost-sharing payments for projects and $50 billion for rural projects, with the remaining $50 billion largely split among ""transformative"" projects such as high-speed trains, and funds for federal transportation lending projects.A leaked document released this week, which an administration official confirmed was ""largely accurate,"" shows that the administration plans to reduce the cost-sharing for projects to no more than 20 percent of the costs from the traditional 80 percent federal share. That would result in a higher overall infrastructure boost if states agree to shoulder more of the costs.Democrats have criticized that proposal and argued the Trump administration should back more direct federal spending.The bill will also aim to streamline environmental reviews and it make it easier to build highways and other projects and allow for greater tolling on roadways.']","Union, Congress, Commerce, Committee, Reuters, newsAlibaba, MOUs, OPPOThune, Democrats, House, Representatives, Senate, Trump"
"['Apple Inc\'s move on Wednesday to give iPhone owners information about the health of their batteries reverses the company\'s longstanding refusal to make such information available directly on iPhones and iPads, even though battery health has long been easy to check on Apple\'s Mac computers.Apple said an update to its iOS operating system will show the phone\'s battery health and recommend whether the battery needs to be replaced. It will also let users turn off a controversial piece of software that slows the phone\'s performance in some situations when the battery is flagging.Apple acknowledged in December that its software sometimes deliberately slows phones with weak batteries. Apple apologised and lowered the price of battery replacements in its stores from $79 to $29 for affected phones.Critics say Apple has obfuscated the fact that a worn-out battery not only fails to hold a charge, it also degrades the phone\'s performance. The company\'s lack of transparency on the issue has pushed people to buy a new phone rather than a new battery, these people say.related newsAlibaba, US grocer Kroger had early business development talks: SourceDonald Trump takes his \'America First\' policies to Davos \'globalists\'Qualcomm signs $2 billion sales MOUs with Lenovo, Xiaomi, vivo and OPPO""The battery wears out,"" said Kyle Wiens, chief executive of iFixit, which publishes repair guides for iPhones and sells replacement parts. ""They have been pretending like the battery doesn\'t wear out. They\'ve made billions of dollars on that pretense.""Apple has always banned battery-health apps from the App Store for security reasons. While a few developers had found ways around the restrictions, their apps stopped showing a key piece of information - the ""charge cycle count,"" or how many times the battery has been drained and recharged - after a 2016 software update.Rogerio Hirooka of Lirum Labs said his company\'s app lost charge cycle counts in 2016 but can still provide information on charge capacity, which can be used to determine whether the battery is at the end of its life. He said a routine bug-fix for the app was rejected by Apple in December, just before Apple acknowledged the battery-slowing issue.Apple rejected his app because it provides ""potentially inaccurate diagnostic functionality"" that could ""mislead or confuse your users,"" according to documents from the app review process seen by Reuters. Apple explains that ""there is no publicly available infrastructure to support iOS diagnostic analysis,"" according to the documents.Apple declined to comment on why battery diagnosis is available on the Mac but not on the iPhone, or why it rejected the update to Hirooka\'s app.""That fact that they tell you (battery health) on the Mac but it\'s a forbidden secret on the iPhone is crazy,"" Wiens said.All lithium ion batteries degrade over time. Until the software update announced Wednesday becomes available - and Apple has not given a specific date - the only way to check an iPhone battery is to take the device to an Apple Store or hook the phone up to a Mac computer running special third-party software.Repair advocates have long criticized Apple and other technology companies for making batteries hard for users to access and replace. Apple has been lobbying against ""right to repair"" laws in several U.S. states that would require it to sell parts to independent repair shops.']","iPhone, iPhones, iPads, Mac, iOS, MOUs, OPPO, iFixit, iPhones, App, Store, Reuters, iOS, iPhone, iPhone, iPhone, Mac"
"['Oil prices on Thursday hit their highest since December, 2014, pushed up after U.S. crude inventories posted a 10th straight week of declines and as the dollar continued to weaken.Brent crude futures , the international benchmark for oil prices, opened at $70.95 a barrel on Thursday, their highest level since early December, 2014. They had edged down to $70.86 by 0105 GMT, which was still up 33 cents, or 0.5 percent, from their last close.U.S. West Texas Intermediate (WTI) crude futures climbed to $66.22 per barrel in early trading, also the highest level since early December, 2014. They had dipped back to $66.07 a barrel by 0104 GMT, still up 46 cents, or 0.7 percent, from their last settlement.Both crude benchmarks are up by almost 60 percent since the middle of last year.related newsBrent oil hits $71 for 1st time since 2014 as dollar drops, US stocks declineGold hits 1-1/2-year high as dollar slumps to three-year lowOil producing countries must maintain price balance: Dharmendra PradhanPrice support has also been coming from supply restrictions led by a group of producers around the Organization of the Petroleum Exporting Countries (OPEC) and Russia, which started last year and are set to last throughout 2018.""The Saudi\'s and Russians continue to work together to talk the oil market higher and last night, the countries\' two oil ministers said they were working together on other longer-term projects as well,"" said Greg McKenna, chief market strategist at futures brokerage AxiTrader.""That, and the USD fall, along with another inventory draw combined to drive (crude) up,"" he added.U.S. crude inventories fell 1.1 million barrels in the week to Jan. 19, to 411.58 million barrels, the Energy Information Administration (EIA) said on Wednesday.That\'s the lowest seasonal level since 2015 and below the U.S. five-year average around 420 million barrels.In foreign exchange markets, the U.S. dollar hit its lowest level since December, 2014 against a basket of other leading currencies .A weakening dollar often results in financial traders taking investment out of currency markets and into commodity futures like crude.Analysts said that rising oil prices would likely start to have an inflationary effect.""Higher oil prices will eventually be reflected in higher consumer prices as the costs of transport of most goods will rise,"" said William O\'Loughlin, investment analyst at Australia\'s Rivkin Securities.Looming over the generally bullish oil market has been U.S. oil production, which is edging ever more closely towards 10 million barrels per day (bpd), hitting 9.88 million bpd last week.U.S. output has grown by more than 17 percent since mid-2016, and is now on par with that of top exporter Saudi Arabia.Only Russia produces more, averaging 10.98 million bpd in 2017.']","WTI, newsBrent, Organization, Petroleum, Exporting, Countries, OPEC, AxiTrader, USD, Energy, Information, Administration, EIA, Australia\"
