Content,Organization Names
"['North Korea sent a rare announcement addressed to ""all Koreans at home and abroad"" on Thursday, saying they should make a ""breakthrough"" for unification without the help of other countries, its state media said.It said all Koreans should ""promote contact, travel, cooperation between North and South Korea"" while adding Pyongyang will ""smash"" all challenges against reunification of the Korean peninsula.The announcement, issued after a joint meeting of government and political parties, added Koreans should wage an energetic drive to defuse the acute military tension and create a peaceful climate on the Korean peninsula.Military tension on the Korean peninsula was a ""fundamental obstacle"" for the improvement of inter-Korean relations and unification, the North\'s official news agency said.It added joint military drills with ""outside forces"" has shown to be unhelpful for the development of relations between North and South Korea.North Korea did not provide details why the meeting had been held but the statement said it was aimed to support leader Kim Jong Un\'s remarks regarding unification from his New Year\'s address. It said this year is meaningful for both North and South Korea as it is the 70th anniversary of the founding of North Korea while South Korea will be hosting the Winter Olympics next month.']","Winter, Olympics"
"['Mohan Shenoi of Kotak Mahindra Bank said, ""The US dollar continues to weaken further with dollar index at 3-year lows. The key trigger for weakness is a statement from the US Treasury secretary that a weaker dollar helps US exports.""""Oil prices above USD 70/bbl is a concern but has not impacted Indian equity markets and rupee so far. We expect the USD-INR to trade in a range of 63.40-63.70 for the day.""""Indian bonds trade on a weaker note due to rising crude oil prices and higher US Treasury yields. Further trigger will come from theUnion Budgetnext week.""""We expect the 10-year benchmark bond yield to trade in a range of 7.27-7.31 percent for the day,"" he added.']","US, Treasury, USD, US, Treasury, theUnion, Budgetnext"
"['Expressing strong support to China on its Belt and Road Initiative, Pakistan Prime Minister Shahid Khaqan Abbasi today said it is much more than just an infrastructure partnership and will go a long way in creating a shared future in a fractured world.Speaking at a panel discussion here at the World Economic Forum (WEF), Abbasi said, ""We strongly recognise the vision of China and President Xi Jinping"".China\'s massive Belt and Road Initiative (BRI) seeks to build rail, maritime and road links from Asia to Europe and Africa in a revival of ancient Silk Road trading routes.The issues related to BRI, earlier known as One Belt One Road (OBOR), have been a major bone of contention between India and China as one portion of the corridor passes through Pakistan-occupied Kashmir.related newsAlibaba, US grocer Kroger had early business development talks: SourceDonald Trump takes his \'America First\' policies to Davos \'globalists\'Qualcomm signs $2 billion sales MOUs with Lenovo, Xiaomi, vivo and OPPO""We\xa0believe the Belt and Road Initiative is perfectly in sync with the WEF theme of creating shared future in a fractured world. It is much more than just a partnership on infrastructure and it will cause significant improvement in lives of people from different countries,"" Abbasi said.He further said half of humanity lives in this region and this initiative will have a big impact towards a shared future in a fractured world.The BRI is a physical manifestation of the bond between countries that have existed through history and can result in freer movement of people, goods and ideas, and a greater culture of openness, Abbasi said.He also said the China-Pakistan Economic Corridor has started to show results with a big boost to manufacturing and exports.The key principles are financial stability and lessening of environmental impact and Pakistan being a more responsible global citizen, he said.Speaking in the same session, Asia Infrastructure Investment Bank President Jim Liqun also lauded the initiative and the benefits it would bring to the region.Liqun said financial sustainability is key to the long- term success of the initiative.""We should never do a project that would be a white elephant,"" he observed.Singapore\'s Minister in Prime Minister\'s Office Chan Chun Sing said the city-state is very happy to be part of the BRI and believes it will help in a big way in contributing to global growth.He said Singapore is closely working with the Chinese agencies for this project.US-based infra consultancy major Aecom\'s Chairman Michael Burke said BRI is the largest infrastructure project seen in our lifetime and will have a big impact on the GDP of the region with free movement of goods and other benefits.He said such a project cannot be completed by a single country or by just private or public sector and therefore Aecom expects to participate in it in a big way for many years to come.Russian Direct Investment Fund CEO Kirill Dmitriev said the fractured world is being discussed in Davos and the BRI initiative is one of the best ways to address this.']","Belt, WEF, Belt, BRI, BRI, OBOR, MOUs, OPPO, Belt, WEF, BRI, BRI, BRI, GDP, Aecom, BRI"
"['US President Donald Trump flew out today to the World Economic Forum in Davos, Switzerland, aiming to convince international leaders his ""America First"" agenda does not signal a withdrawal from the world stage.Trump, who was not accompanied by the First Lady, departed Joint Base Andrews shortly before 9 PM on a trip that will also see him hold talks with several world leaders.""Will soon be heading to Davos, Switzerland, to tell the world how great America is and is doing. Our economy is now booming and with all I am doing, will only get better...Our country is finally WINNING again!"" he tweeted shortly before getting on the helicopter that took him to the air base.Trump is set to speak Friday at annual gathering of the global pro-trade elite in a move that has raised eyebrows because of his protectionist ""America First"" policies.related newsAlibaba, US grocer Kroger had early business development talks: SourceDonald Trump takes his \'America First\' policies to Davos \'globalists\'Qualcomm signs $2 billion sales MOUs with Lenovo, Xiaomi, vivo and OPPO""We\'re going to the World Economic Forum to share President Trump\'s economic story and to tell the world that America is open for business,"" said Trump\'s chief economic adviser Gary Cohn.Trump, who has left the Paris climate change accords, abandoned the Trans-Pacific Partnership, threatened to scrap the North American Free Trade Agreement (NAFTA) and just imposed heavy duties on imported washing machines and solar panels, will have his work cut out convincing defenders of global free trade that he is on their side.His Treasury Secretary Steven Mnuchin\'s latest comments today -- that he favored a ""weaker dollar"" -- risked further alienating other nations because it deviates from a long- standing agreement to avoid weakening their currency for a competitive trade advantage.On the diplomatic front, Trump is scheduled to meet with Israeli Prime Minister Benjamin Netanyahu weeks after recognizing Jerusalem as Israel\'s capital, and British premier Theresa May, which comes as US-UK relations are unusually strained.']","America, First, Lady, America, newsAlibaba, MOUs, OPPO, American, Free, Trade, NAFTA, Treasury"
"['The number of Jawahar Navodaya Vidyalayas (JNVs) will see an increase in the 2018-19 fiscal and a provision will be made in the upcoming Budget, Human Resource Development Minister Prakash Javadekar said today.The Union minister said more announcements will be made in theBudget 2018with an aim to address the education divide in parts of the country.""The Modi government\'s effort is expansion of quality education. ... We have granted 65 Navodaya Vidyalayas (for this year) and in thebudget 2018, it will increase further,"" Javadekar told reporters here, informing that these Jawahar Navodaya Vidyalayas (JNVs) will be opened in new districts.JNVs are being set up under the central scheme since 1986 to bring out the best of the rural talent. So far, JNVs are established in more than 638 districts across the country.related newsNews in Pics: Your daily dose of pictures from around the worldPadmaavat controversy LIVE: 18 arrested in Gurugram school bus attack caseGovernment to provide jobs to those with learning disabilitiesFor the 2017-18 fiscal, Rs 2,700 crore budget allocation was provided for JNVs, which are run by an autonomous organisation called the Navodaya Vidyalayas Samiti (NVS).Stating that the government wants to improve access to quality education, Javadekar said it is because ""we have found out that in parts of the country there is either digital or education divide.""For instance, there are maximum colleges in Bengaluru, Karnataka and also in Tamil Nadu, but less in states like Jharkhand and Bihar.""Expect something good in the budget also because we want to expand quality education in all corners of the nation,"" Javadekar said.For the current fiscal, Rs 46,356.25 crore budget allocation was made for the Human Resources Development Ministry.India Union Budget 2018: What does Finance Minister Arun Jaitley have up his sleeve?Click here for top and latest Budget 2018 news, views and analyses.']","JNVs, Modi, Navodaya, Vidyalayas, JNVs, JNVs, worldPadmaavat, JNVs, Navodaya, Vidyalayas, Samiti, NVS, Human, Resources, Development"
"['Finance Minister Arun Jaitley may flag a raft of farm-centric measures inBudget 2018, including a state-subsidised income support scheme, an agriculture export plan and schemes for dairy and fishery, demonstrating the government\'s intent to walk the talk on rural distress ahead of next year\'s Lok Sabha elections.The government is also set to launch a ""Sweet Revolution"" to boost bee farming as part of the broader strategy to improve income from non-traditional agricultural sources.Jaitley may also flag the launch of a new agricultural exports policy, to lift farm income and deal with local gluts. These measures will be central to the government\'s plan to double farm incomes by 2022.Amid reports of simmering rural discontent, Finance Minister Arun Jaitley\'s fifth and last full budget in the NDA government\'s current term, will likely seek to decisively shift the policy focus towards \'farmers\' income\', as opposed to the decades-old output-focussed \'food policy\', sources told CNN-News18.Read MoreIndia Union Budget 2018: What does Finance Minister Arun Jaitley have up his sleeve?Click here for top and latest Budget 2018 news, views and analyses.']","Lok, Sabha, NDA, MoreIndia, Union"
