,Source,Category,Date,Author,Title,Tags,Subtitle,Content
0,bloombergquint,['global-economics'],"January 23 2018,  9:58AM",Jill Ward,U.K. Has Smallest December Deficit Since 2000 as VAT Hits Record,[],(Bloomberg) -- Britain recorded its smallest budget deficit for any December in 17 years as value-added tax receipts reached a record and the Treasury received a bumper credit from the European Union.,"['(Bloomberg) -- Britain recorded its smallest budget deficit for any December in 17 years as value-added tax receipts reached a record and the Treasury received a bumper credit from the European Union.', 'Net borrowing narrowed to 2.6 billion pounds ($3.6 billion), well below the median forecast of economists, from 5.1 billion pounds a year earlier, figures showed Tuesday. It left the shortfall in the first nine months of 2017-18 at 50 billion pounds, 12 percent lower than a year earlier.', 'The figures leave Chancellor of the Exchequer Philip Hammond on course to keep borrowing in 2017-18 to the 49.9 billion pounds forecast by his budget watchdog in November.', 'But deficits are predicted to persist well into the next decade as a result of Brexit and poor productivity. The challenge facing Hammond was highlighted on Monday when the International Monetary Fund issued a downbeat assessment of U.K. growth prospects.', 'In December, Britain received a 1.2 billion-pound credit from the EU relating to amendments to the 2017 budget. It was the largest such payment in at least 20 years and reflected “adjusted member states’ contributions to reflect updated economic forecasts,” the Office for National Statistics said.', 'VAT, a tax on sales, rose 4.9 percent from a year earlier to an all-time high of 12.3 billion pounds. The public finances were also aided by lower spending on welfare and departmental costs.', 'Hammond has benefited from resilient tax revenue but the outcome for the current year hinges on January, a month that usually generates a large surplus as self-assessed income-tax liabilities are settled. Revenue is set to be lower than in January 2017 due to distortions caused by a dividend tax-increase in April 2016.', 'The public finances are also under strain from rising debt costs as faster inflation makes index-linked bonds more expensive. Government interest payments rose 16 percent between April and December.', 'Tuesday’s figures cover the first full month since Hammond cut stamp duty for first-time homebuyers in an effort to help young people get onto the property ladder. Stamp-duty revenue fell 0.9 percent from a year earlier, though the ONS said it had no anecdotal evidence of the effect of the relief.', 'Hammond bowed to pressure to boost spending on health in his Autumn Budget but critics say much more is needed as the National Health Service struggles to contain awinter crisisthat’s led to cancelled operations and left patients waiting in ambulances.', 'His room for maneuver has been limited by the Office for Budget Responsibility, which sharply reduced its growth outlook in November. Britain will be still be borrowing 35 billion pounds by the end of the decade, instead of the surplus predicted before the June 2016 vote to leave the European Union.', '', '', '©2018 Bloomberg L.P.']"
0,bloombergquint,['technology'],"January 22 2018,  9:00PM",Kaye Wiggins,Google Faces England's First `Right to Be Forgotten' Trial,[],(Bloomberg) -- Google Inc. is set for its first battle in a London court over the so-called “right to be forgotten” in two cases that will test the boundaries between personal privacy and public interest.,"['(Bloomberg) -- Google Inc. is set for its first battle in a London court over the so-called “right to be forgotten” in two cases that will test the boundaries between personal privacy and public interest.', 'Two anonymous people, who describe themselves in court filings as businessmen,\xa0want the search engine to take down links to information about their old convictions.', 'One of the men had been found guilty of conspiracy to account falsely, and the other of conspiracy to intercept communications, Judge Matthew Nicklin said at a pre-trial hearing Thursday. Those convictions are old and are now covered by an English law -- designed to rehabilitate offenders -- that says they can effectively be ignored. With a few exceptions, they don’t have to be disclosed to potential employers.', '“This is the first time that the English court is going to decide the issue of the right to be forgotten,” Nicklin said.', 'The search-engine giant\xa0has already become embroiled inbattles at the European Union’s top courtover the right to be forgotten. The principle -- created by the EU’s highest court in a precedent-setting ruling in May 2014 -- allows people to ask for links to online information about them to be removed from search results if it’s outdated or irrelevant. The ruling is only valid in the 28-nation bloc, but Google has clashed with privacy regulators over attempts to apply it beyond the EU.', '“We work hard to comply with the right to be forgotten, but we take great care not to remove search results that are clearly in the public interest and will defend the public’s right to access lawful information,” a Google spokeswoman said.', 'Lawyers for the plaintiffs didn’t comment.', 'Nicklin said Thursday that while the two cases were not related, they raised the same legal issues. The first trial, in which the person challenging Google to remove information is known as NT1, will start on Feb. 27 and the second, in which the plaintiff is known as NT2, will start on March 13. Nicklin said the plaintiffs weren’t celebrities or politicians and have been “rehabilitated” since their convictions.', 'NT1 has been threatened in public places by people referring to the content that Google links to, “and seeking to extract money from him in consequence,” his court filings say. He “has been and continues to be treated as a pariah in his personal, business and social life and has been unable to form any new friendships or personal relationships,” they say.', 'NT2’s papers say some financial institutions are unwilling to deal with him “on private or commercial business” after looking him up on Google. The search engine results have attracted “adverse attention” to him and by association to members of his close family.', 'The case concerns an “area of the law in which two human rights come into conflict,” Nicklin said. “The right to be forgotten is a dimension of the right to privacy and it conflicts with the right of freedom of expression.”', 'He said a U.K. law from 1974 meant that, for all but the most serious offenses, people with convictions shouldn’t “have a lifelong ‘blot’ on their record but should be able to live without that shadow.” The internet “provides a challenge” to that right, he said, but also noted that some people were concerned that the right to be forgotten “might lead, in effect, to censorship.”', 'Google has “staked quite a lot of resources” on trying to do a good job of deciding when to approve requests for links to be taken down, said George Brock, a journalism professor at City, University of London and the author of a 2016 book about the right to be forgotten. He said Google had been “opaque” about its approach to making those decisions. If this case shed light on how it reached the decisions, “it would be a real breakthrough,” he said.', 'The men are being represented by the law firm Carter Ruck. It has defended\xa0clients in privacy and libel actions and was one of the first firms to use super-injunctions, court orders that prevent publication of any confidential information relating to a person or an issue and also any existence of the order itself.', 'The pair’s court papers say that revealing their identity would “defeat the object of the claims.”', 'Google has publicly raised the alarm about risks to freedom of speech that it says are posed by the right to be forgotten. Two separate\xa0European Court of Justice cases about that right “represent a serious assault on the public’s right to access lawful information,” Google’s general counsel, Kent Walker, said in a blog post in November.', 'The cases are: NT1 v. Google and NT2 v. Google, High Court of Justice, Queen’s Bench Division, Case No.’s HQ15X04128 and HQ15X04127.', '', '', '©2018 Bloomberg L.P.']"
0,bloombergquint,['technology'],"January 22 2018, 10:00AM",Gerry Smith,Facebook Trustworthiness Ratings Boost `Fake News Award' Winner,[],(Bloomberg) -- Facebook Inc.’s plan to rank news sources by their trustworthiness boosted the shares of New York Times Co. -- one of the top winners in President Donald Trump’s “Fake News Awards.”,"['(Bloomberg) -- Facebook Inc.’s plan to rank news sources by their trustworthiness boosted the shares of New York Times Co. -- one of the top winners in President Donald Trump’s “Fake News Awards.”', 'The publisher’s shares jumped 8.4 percent to $21.90, the highest price in more than a decade, after Facebook Chief Executive Officer Mark Zuckerberg announced the plan in apostFriday. The social network will survey users on whether they’re familiar with a news source and whether they trust the outlet, Zuckerberg said.', 'Notwithstanding the president’s animosity, the Times has been a beneficiary of the Trump presidency, withsubscriptionsup 60 percent in September from a year earlier to 2.5 million. Republicans took the newspaper to task this week in theirlistof reporting they considered inaccurate, criticizing columnist Paul Krugman’s predictions of economic catastrophe and a story that the administration had buried a report on climate change.', 'How the Times fares in Facebook’s ratings system will be a big test, since it’s one of the country’s most respected journalistic institutions and a lightning rod for conservatives who say it’s biased. Other news organizations will also have to sort out how Zuckerberg’s plan affects them.', '“What we don’t know is how the proposed system to identify trusted news sources will really work,” said David Chavern, CEO of the NewsMedia Alliance, a group of about 2,000 organizations pressing for a larger share of the revenue their content generates on the social-media service. “We will be watching that very closely as the changes are rolled out.”', '', '', '©2018 Bloomberg L.P.']"
0,bloombergquint,['technology'],"January 19 2018, 12:06PM",Spencer Soper,Amazon Reveals Very Long Short List of 20 Cities for HQ2,[],"(Bloomberg) -- Amazon.com Inc. narrowed the field of cities for its proposed new headquarters to 20, with New York, Boston, Chicago, Miami and Toronto among the contenders.","['(Bloomberg) -- Amazon.com Inc. narrowed the field of cities for its proposed new headquarters to 20, with New York, Boston, Chicago, Miami and Toronto among the contenders.', 'Seattle-based Amazon solicitedproposalsin September for its second corporate seat, a project that’s expected to cost more than $5 billion and create 50,000 high-paying jobs over the next 10 to 15 years. The company received proposals from 238 locations, including from smaller markets like Tulsa, Oklahoma, and Memphis, Tennessee. The retailer plans to make a decision this year and will continue discussions with the finalists, it said in a statement Thursday.', 'Amazon’s Great HQ2 Search ignited\xa0a reality TV-style competition among governors, mayors and bureaucrats across the U.S. and Canada. Civic boosters didn’t let long odds of success deter them, and the public relations stunts were legion. Birmingham, Alabama, erected a massive Amazon shipping box outside a new hip food hall to announce the city’s bid. The city council in Stonecrest, Georgia, voted to let the ecommerce giant form its own City of Amazon.', 'The company said it created a shortlist because it was difficult engaging with so many applicants, but winnowing competitors down to a chosen few is a staple of reality TV -- and sparked yet more publicity.', 'Read more: These cities didn’t make Amazon’s first cut', 'The spectacle is also good optics for Amazon in the age of Trump. The U.S. President and Amazon Chief Executive Officer Jeff Bezos have publicly sparred over sales taxes and jobs, but a commitment to spend $5 billion and create 50,000 high paying positions fits into Trump’s call for companies to manufacture and hire American. (Unless, of course, Toronto wins the bid.)', 'Earlier this week Apple Inc. alsoannounced plansfor a second corporate campus somewhere in the U.S. and said it would add another 20,000 employees. The company also said it plans about $30 billion in capital expenditures\xa0over the next five years.', 'Whatever city gets chosen will be transformed by Amazon, which has already changed the character of its native Seattle, setting in motion a building boom and rising rents. High paying tech jobs can permanently transform a region and raise the political prospects of the leader who helped seal the deal.', 'Amazon has said its preferences for the site include a metropolitan location with a population of more than 1 million, mass transit, proximity to an international flight hub and the potential to retain and attract technical talent.', 'The list reveals little in terms of geographic preferences, with finalists on both coasts and the heartland.', '“Getting from 238 to 20 was very tough – all the proposals showed tremendous enthusiasm and creativity,” Holly Sullivan, of Amazon Public Policy, said in a statement. “Through this process we learned about many new communities across North America that we will consider as locations for future infrastructure investment and job creation.”', '', '', '©2018 Bloomberg L.P.']"
0,bloombergquint,['technology'],"January 19 2018, 11:54PM",Bloomberg News,"Key Analyst Cuts iPhone X Estimates, Sees Production End in 2018",[],"(Bloomberg) -- A closely watched Apple Inc. analyst has whacked about 23 percent off his initial projections for iPhone X shipments, citing weak Chinese demand.","['(Bloomberg) -- A closely watched Apple Inc. analyst has whacked about 23 percent off his initial projections for iPhone X shipments, citing weak Chinese demand.', 'Apple should move 62 million units of its most expensive smartphone over its lifetime, down from an earlier estimate of 80 million, Kuo Ming-chi of KGI Securities wrote in a note dated Jan. 18. Kuo’s was the latest in aseriesof downgrades since December, as analysts re-assess the global reception for the U.S. company’s most advanced device. He expects production to stop sometime this year as Apple rolls out newer versions in the second half.', 'Apple had been counting on a redesigned 10th anniversary iPhone to boost shipments as its market value advances toward $1 trillion. But smartphone sales in China -- its most important market outside of the U.S. -- have shrunk as the market got saturated. Customers seemed to be opting for cheaper models of the iPhone, according to Cowen & Co., which said that suggested Apple failed to cram enough new technology into the iPhone X to justify its $999 price tag.', 'Chinese brands such as Huawei, Oppo and Xiaomi are also moving into Apple’s turf with new models designed to appeal to upscale buyers.', '“High-end Chinese users adore big screen devices. But the notched design and the fact that many apps aren’t yet compatible with the device made many users think the screen of iPhone X looked smaller than the 5.5-inch iPhone,” Kuo said in his note. “The hefty price also compressed replacement demand.”', '', '', '', '©2018 Bloomberg L.P.', 'With assistance from Gao Yuan']"
0,bloombergquint,['technology'],"January 22 2018,  2:13PM",Blake Schmidt,"As Bitcoin Sinks, Crypto Bros Party Hard on a Blockchain Cruise",[],"(Bloomberg) -- When 600 cryptocurrency enthusiasts set sail from Singapore on Monday night for their second annual Blockchain Cruise, the price of Bitcoin was hovering comfortably above $13,500.","['(Bloomberg) -- When 600 cryptocurrency enthusiasts set sail from Singapore on Monday night for their second annual Blockchain Cruise, the price of Bitcoin was hovering comfortably above $13,500.', 'By the time their 1,020-foot-long ship pulled into Thailand on Wednesday, for an afternoon of bottomless drinks and crypto-focused talks on a sun-soaked private beach, Bitcoin had cratered to $10,000.', 'The group of mostly young men, many of whom became wildly rich -- at least on paper -- as Bitcoin and other digital tokens skyrocketed last year, had in all likelihood just lost millions.', 'But if anyone was fazed, they didn’t show it. The party rolled on as the sangria and Red Bull flowed, Bitcoin-themed rapmusicblared and drones filmed it all from above.', '“Nothing goes up in a straight line,” explained Ronnie Moas, the founder of Miami Beach-based Standpoint Research, who was one of the event’s speakers on Wednesday. In a best-case scenario, he said, Bitcoin could jump to $300,000 in as little as seven years.', 'For skeptics of the crypto craze, it’s hard not to see all this as another sign of runaway exuberance -- a repeat of the boosterish Las Vegas securitization conference, immortalized inThe Big Short, that preceded the subprime mortgage meltdown of 2007. But the steadfast optimism on display at this week’s Blockchain Cruise also carries a warning for anyone betting on a cryptocurrency crash: It’s going to take more than a 50 percent drop in Bitcoin from its Dec. 18 high to drive out the diehards.', '“This is something that you either believe in or not,” said Moas, who has become a crypto-celebrity after issuing stratospheric price forecasts for Bitcoin.', 'The cruise’s eclectic list of speakers included Jose Gomez, a former aide to the late Venezuelan President Hugo Chavez; Kaspar Korjus, the head of Estonia’s e-residency program (which may issue its own cryptocurrency); and Jorg Molt, an early digital currency backer whose claim to hold 250,000 Bitcoins (worth $2.8 billion at the current price) couldn’t be verified.', 'But perhaps the biggest draw was John McAfee, the anti-virus software pioneer with a checkered past. In 2012, while living in Belize, McAfee had run-ins with local police forallegedunlicensed drug manufacturing and weapons possession, but was released without charge. At one point, Belize police started asearchfor him as a person of interest in connection with the murder of his neighbor. McAfee said he was innocent and that he fled Belize because of persecution by corrupt officials.', 'He now helps run MGT Capital Investments Inc., a small-cap tech company with a Bitcoin mining business. He has become a cryptocurrency evangelist on Twitter, touting the technology and various tokens to his more than 700,000 followers. Coinsbank, the digital currency exchange and wallet operator that organized the cruise, made him a headline speaker.', 'On Wednesday, McAfee blamed the recent market slump on unfounded fear of government intervention. He urged cryptocurrency holders -- one of whom sported a “Buy The Dip” t-shirt -- to stick with their bets.', 'Read more: Bitcoin Fall Extends to 25% as Fears of Crypto Crackdown Linger', '“You cannot force a ban on a distributed system,” McAfee said in an interview after his speech. “It’s like how do you ban smoking weed? You can’t ban it. People will come back.”', 'Not every conversation on the Blockchain Cruise revolved around cryptocurrencies. Attendees, unsurprisingly, had plenty to say about blockchain -- the distributed ledger technology that underpins Bitcoin -- and its potential to improve industries from finance to health care.', 'Charity was also a topic raised by speakers including Moas, who urged the audience to donate some of their newfound wealth and help reduce global inequality.', 'Many attendees have far more than they need.', 'Rowan Hill, a former coal miner in Australia, said he retired by 26 after getting in on the crypto boom early. After the cruise, he’s heading to Japan for a four-week snowboarding trip.', '“A lot of people can’t stand the price swings” in digital currencies, Hill said, donning a fedora and sunglasses as he lounged on the beach. “The average person just sells, and they lose out.”', 'Joe Stone, an Australian who invests in digital assets, said market declines are easier to bear in the company of fellow enthusiasts. For many on the cruise, the next stop is another cryptocurrency conference in Bangkok.', '“There’s nowhere I’d rather be,” said Stone, after a late night of mingling at the ship’s cigar bar over whiskeys. “Otherwise I’d just be at my computer.”', '', '', '©2018 Bloomberg L.P.']"
