,Source,Category,Date,Author,Title,Tags,Subtitle,Content
0,bloombergquint,['business'],"January 19 2018,  3:50PM",PTI,RCom Seeks Shareholders’ Nod Ahead Of Asset Monetisation,[],"Reliance Communications Ltd. today sought shareholders’ approval to sell its assets including spectrum, tower, optical fibre network and other wireless infrastructure.","['Reliance Communications Ltd. today sought shareholders’ approval to sell its assets including spectrum, tower, optical fibre network and other wireless infrastructure.', 'The approval for sale, disposal of assets or of its subsidiaries has been sought through a postal ballot, and e-voting will take place between Jan. 17 and Feb. 15.', '“The results of the postal ballot will be announced on or before Saturday, Feb. 17, 2018,” the company said in a regulatory filing. The total outstanding loans of RCom Group, as on Sep. 30, 2017 were about Rs 40,052 crore.', 'RCom said that it had initiated a monetisation exercise that entailed wireless spectrum, towers, fibre, media convergence nodes, and real estate assets including Dhirubhai Ambani Knowledge City campus, Navi Mumbai.', '""Based on final recommendation of EC (Bid Evaluation Committee), Reliance Jio Infocomm Limited (RJIL) has been identified as the successful bidder. RCom Group has entered into binding agreement with RJIL for transfer/sale of wireless spectrum, towers, fibre and MCNs and other related infrastructure assets...,"" it said.', 'The process of monetisation of other assets is ""ongoing"" in consultation with the lenders.', 'The assets monetisation includes transfer or sale of wireless spectrum of Reliance Telecom Limited, a wholly owned subsidiary of the company, RCom said.', '""...the company cannot, except with the consent of the shareholders by way of special resolution, sell, lease or otherwise dispose of the whole or substantially the whole of the undertaking of the company...,"" RCom said.', 'Also Read:Billionaire Ambani Bails Out Brother by Buying Wireless Assets', 'On Dec. 28, the company announced that Reliance Jio willtake overits mobile business assets – spectrum, tower, optical fibre network amongst others, and that the proceeds will be used to repay debt.', 'While the two companies did not disclose the deal size, banking sources had pegged the transaction value at Rs 24,000-25,000 crore.', 'After the asset monetisation is concluded, RCom will focus on enterprise business, including Indian and global enterprise, internet data centres and the largest private submarine cable network in the world.']"
0,bloombergquint,['business'],"January 19 2018, 11:43AM",Isha Arora,Jubilant FoodWorks’ Profit Triples As Same-Store Sales Surge,[],Jubilant FoodWorks Ltd.’s profit for the quarter ended December more than tripled fuelled by healthy same-store sales growth of Domino’s Pizza chain.,"['Jubilant FoodWorks Ltd.’s profit for the quarter ended December more than tripled fuelled by healthy same-store sales growth of Domino’s Pizza chain.', 'Net profit rose to Rs 66 crore from 20 crore in the same quarter last year, the company which Domino’s Pizza and Dunkin’ Donuts chains in India said in an exchange filing today. That’s higher than Rs 44 crore profit estimate of analysts tracked by Bloomberg. The top line increased 20.8 percent to Rs 795 crore from the year-ago period.', 'The same-store sales in the Domino’s pizza chain grew 17.8 percent in the third quarter from 5.5 percent in the three months ended September.', '“The lowering in rate of applicable GST to 5 percent has allowed us to demonstrate our commitment to deliver the best value proposition as we passed on the benefits of lower tax rate to the customers,” Chairman Shyam Bhatia said in a separate press release. The GST Council in its Nov 10 meeting reduced the tax rate on all restaurants to 5 percent without input tax credit from 18 percent earlier.', 'Jubilant FoodWorks continued to reduce its losses from Dunkin’ Donuts outlets, with greater focus on donuts and beverages and closure of unprofitable stores, the press release added.', 'Operating income of the Noida-based company surged 115 percent to Rs 136 crore, while the margin expanded to 17.1 percent from 9.6 percent last year.', 'Earlier this week, Morgan Stanley labelled Jubilant Foodworks as its top pick in the fast-moving consumer goods segment, replacing Titan Company Ltd., owing to an anticipated uptick in sales and margin. Jefferies also initiated coverage on the stock with a ‘Buy’ rating.']"
0,bloombergquint,['business'],"January 22 2018,  9:24AM",Ari Altstedter,Biocon Inks Deal With Novartis After U.S. Nod for Biologic Drug,[],"(Bloomberg) -- Biocon Ltd. said it signed a deal to develop copycat versions of biologic drugs with a unit of Novartis AG, its latest move to become a global player in the next generation of generic medicines after a similar partnership with Mylan NV delivered a recent success.","['(Bloomberg) -- Biocon Ltd. said it signed a deal to develop copycat versions of biologic drugs with a unit of Novartis AG, its latest move to become a global player in the next generation of generic medicines after a similar partnership with Mylan NV delivered a recent success.', 'The tie-up with Novartis’s generics unit Sandoz will focus on developing copies, or biosimilars, of biologic drugs in immunology and oncology, Bengaluru-based Biocon said in a statement Thursday. The two will share cost and profit globally, with Sandoz responsible for commercialization in North America and the European Union, and Biocon in the rest of the world.', 'Biologic drugs are produced from substances in living cells, making them challenging to copy. Biosimilars, which are often cheaper than their branded counterparts, are becoming an important part of the world’s medicine cabinets. Because developing and winning regulatory approval for biosimilars requires much higher investment in the developed world, Biocon’s strategy has been to offer its development and manufacturing expertise in collaboration with multinational drug makers.', '“This synergistic partnership will enable us to scale up our capabilities for an end-to-end play in the global biosimilars space,” Kiran Mazumdar-Shaw, Biocon’s managing director said in the statement. “We remain committed to our mission of developing biopharmaceuticals that have the potential to benefit a billion patients across the globe.”', 'Another partnership to develop and market six biosimilars that Biocon signed with Mylan saw the pair win the first U.S. approval for a version of Roche Holding AG’s blockbuster breast cancer drug Herceptin in December.', '', '', '©2018 Bloomberg L.P.']"
0,bloombergquint,['business'],"January 19 2018,  5:17PM",Revati Krishna,Kotak Mahindra Bank Posts Slowest Profit Growth In 10 Quarters,[],Kotak Mahindra Bank Ltd.’s profit rose at its slowest pace in 10 quarters even as India’s third-largest private lender’s asset quality improved.,"['Kotak Mahindra Bank Ltd.’s profit rose at its slowest pace in 10 quarters even as India’s third-largest private lender’s asset quality improved.', 'Net profit rose 19.7 percent on a yearly basis to Rs 1,053 crore in the quarter ended December, the private lender said in an exchange filing. Analysts tracked by BloombergQuint had pegged the profit at Rs 1,090 crore.', 'Net interest income, or the core income of the bank, rose 17 percent to Rs 2,394 crore, missing the Rs 2,427 crore consensus estimate.', 'The Uday Kotak-led bank’s gross non-performing loans in absolute terms fell 2.6 percent to Rs 3,715 crore quarter-on-quarter.', 'The management said during a press conference held in Mumbai that they have found no divergence in their reported NPAs during the March 2017 inspection.', 'A well-diversified client-base and increase in the number of branches led to a 23 percent rise in the loan book to Rs 1.6 lakh crore year-on-year, according to Bloomberg Intelligence. The bank added 13 branches across the country. Total customer base rose to 12 million from 10.5 million in the last quarter.', 'The capital adequacy ratio stood at 18.7 percent for the quarter. Higher capital adequacy ratio should support growth for the bank, without having to raise equity, Bloomberg Intelligence said.', 'Shares of the Mumbai-based bank rose as much as 1.3 percent to Rs 1,059.9, the highest in three months, after the earnings announcement. That compares with 0.88 percent rise in the NSE Nifty Bank Index.']"
0,bloombergquint,['business'],"January 22 2018,  3:42AM",Swansy Afonso,"India Is Said to Seek Steel Ministry's Control of Iron, Coal",[],"(Bloomberg) -- India is considering a plan to hand over control of iron ore and coking coal mining to the steel ministry to boost supplies of the key steelmaking materials as the country is poised to become the world’s second-biggest producer, according to a person with knowledge of the plan.","['(Bloomberg) -- India is considering a plan to hand over control of iron ore and coking coal mining to the steel ministry\xa0to boost supplies of\xa0the key steelmaking materials as the country is poised to become the world’s second-biggest producer, according to a person with knowledge of the plan.', 'The proposal\xa0to shift the regulatory authority from the current mines and coal ministries is under discussion and needs approval from the prime minister’s office and the ministries, said the person, who asked not to be identified as the matter is not yet public.\xa0The integration would allow the steel ministry to make better trade policies, speed up approval of mining licenses and make it easier for foreign steelmakers to set up operations in India, the person said.', 'India’s steel and mining industries have been at loggerheads over iron ore\xa0exports. While miners have sought lower export taxes to become more competitive globally, steelmakers have argued for conserving the material for domestic use and focus on exports of value-added products rolled out of their mills.', 'The steel ministry has been trying to formulate a policy on iron ore pricing for more than a year as it seeks to protect the industry from volatility.\xa0The plan to shift control of the sectors would enable the ministry to finalize its plan sooner, the person said.', 'Spokespeople from the prime minister’s office and the coal and steel ministries didn’t respond to calls. Mines secretary Arun Kumar wasn’t available.', 'India’s steel output is expected to rise to 108 million metric tons this year,\xa0topping Japan’s 107 million. “If it happens, it will surely be helpful for the steel companies,” said Goutam Chakraborty, a Mumbai-based analyst at Emkay Global Financial Services. “JSW Steel being a non-integrated producer, will benefit most assuming better accessibility to iron ore.”', 'Shares of the top steel mill JSW Steel Ltd. rose as much as 1.2 percent in Mumbai on Friday, reversing earlier losses of 2.4 percent. Tata Steel Ltd. rallied as much as 1.4 percent, and Steel Authority of India Ltd. climbed as much as 2 percent.', '', '', '', '©2018 Bloomberg L.P.']"
0,bloombergquint,['business'],"January 19 2018,  1:56AM",Bhuma Shrivastava,Moody's Says Ambani's Jio May Spend $23 Billion to Build Service,[],"(Bloomberg) -- Moody’s Investors Service estimates Jio, the mobile carrier run by India’s richest man, may invest as much as $23 billion on capital spending over three to four years as it expands beyond wireless services.","['(Bloomberg) -- Moody’s Investors Service estimates Jio, the mobile carrier run by India’s richest man, may invest as much as $23 billion on capital spending over three to four years as it expands beyond wireless services.', 'Reliance Jio Infocomm Ltd.’s parent Reliance Industries Ltd. has already spent more than$31 billionto break into India’s mobile-phone market. The 2016upstart, known as Jio, dislodged rivals and has emerged as the nation’s No. 4 carrier. A Jio spokesman didn’t immediately answer an email with questions about the Moody’s estimate. Reliance Industries is scheduled to report quarterly earnings, including Jio’s financials, on Jan. 19.', 'The next leg of capital spending for the carrier will probably cover fiber-to-home, digital TV and the enterprise business in addition to improving mobile phone services, Vikas Halan, a Singapore-based Moody’s analyst said in an e-mail response to questions. Some of the money will also be spent on the company’s fourth-generation feature phones and associated network costs, he said.', 'Jio is also gearing up for newer data-heavy services that can connect homes, businesses and cars to the Internet. Billionaire\xa0Mukesh Ambani’s venture has already triggered a bruising tariff war in the mobile-carrier segment after offering call services free for life and data transmission at no charge for an introductory period. He took another swing at rivals in July by unveiling a data-enabledfeature phoneadvertised to sell at the equivalent of\xa0$23.', '', '', '©2018 Bloomberg L.P.']"
0,bloombergquint,['business'],"January 18 2018,  1:02PM",Mahima  Kapoor,"Yes Bank Q3 Profit Matches Estimates, Asset Quality Improves",[],Yes Bank Ltd.’s profit matched analyst estimates for the December ended quarter while asset quality improved marginally.,"['Yes Bank Ltd.’s profit matched analyst estimates for the December ended quarter while asset quality improved marginally.', 'The Rana Kapoor-led bank’s net profit rose 22 percent to Rs 1,077 crore as compared to a year ago, according to its exchange filing. Analysts tracked by Bloomberg had estimated the bottom line at Rs 1,062 crore.', 'Net interest income, or the core income of the lender, jumped 26.8 percent to Rs 1,889 crore, lower than the Rs 1,935 crore estimate. Net interest margins stood at 3.5 percent compared to 3.7 percent sequentially.', ""The growth was driven by continued improvement in the retail banking segment which has doubled to 11.8 percent of the loan book and a CASA ratio of 38 percent, Rana Kapoor, managing director and chief executive officer of the lender said in the press release accompanying the exchange filing. Yes Bank's balance sheet stood at Rs 2.5 lakh crore with a Rs 1.7 lakh crore loan book, at the end of the quarter."", 'The bank’s asset quality improved marginally in the third quarter after bad loans doubled in the three months ended September. Gross bad loan ratio stood at 1.72 percent compared to 1.82 percent in the previous quarter. Net bad loan ratio stood at 0.93 percent versus 1.04 percent.', 'Provisions for bad loans reduced marginally to Rs 421.3 crore from Rs 447 crore in the previous quarter.', 'In the previous quarter, Yes Bank had disclosed a significant divergence in the assessment of bad loans for the June ended quarter, between the lender and the Reserve Bank of India. The divergence stood at Rs 6,355 crore or three times the reported amount.', 'The private lender has an exposure of Rs 1,342 crore to nine stressed accounts which are currently undergoing resolution at the National Company Law Tribunal under the insolvency code, it said in the press release.', 'The bank has provisioned for 51 percent of its aggregate exposure to stressed accounts identified by the Reserve Bank of India in its first list of likely defaulters and provided for 43 percent of aggregate exposure to RBI’s second list. One loan account of Rs 23.4 crore turned into a non-performing asset during the third quarter, Yes Bank said.', 'Here are the other highlights:', 'Shares ofYes Bank rose 0.15 percentto Rs 342.75 apiece after the earnings announcement.']"
0,bloombergquint,['business'],"January 18 2018,  9:14AM",Isha Arora,Why Indian Steelmakers Need To Be Cautious About Expansion,[],"India’s steelmakers should be cautious while setting up new plants or buying stressed assets as the global capex recovery for metals is slow, and there are perpetual downside risks in the industry.","['India’s steelmakers should be cautious while setting up new plants or buying stressed assets as the global capex recovery for metals is slow, and there are perpetual downside risks in the industry.', 'That’s the warning coming from Rakesh Arora, managing partner at Go India Advisors and a long-time watcher of the mining and metals sector. He is bullish on cash-richCoal India Ltd.,NMDC Ltd.andHindustan Zinc Ltd.“[But] one has to be cautious with companies having high debt and looking to expand, as it doesn’t bode too well in case things turn down.”', 'That’s why Arora maintains a ‘neutral’ stance onTata Steel Ltd.even after the steelmaker announced plans to raise$2 billionto buy stressed assets and repay part of its debt.', 'Assets In Insolvency', 'Among the stressed steelmakers going into insolvency, the most competitively bid for assets are likely to beBhushan Steel Ltd.and Essar Steel Ltd., Arora told BloombergQuint.', 'These two companies serve as a perfect opportunity for global steel majors like ArcelorMittal SA to enter the Indian market, he said. The Luxembourg-based steelmaker should be aggressive in its approach, considering that domestic peers like JSW Steel Ltd. and Tata Steel are potential bidders too, he added.', 'BloombergQuint reported on Wednesday that the Ruia family may have found a way tobid for Essar Steel’sassets despite the clause asking promoters to clear pending dues before bidding for stressed assets.', '“Nobody knows the projects better than their existing promoters,” Arora said indicating that this would help the Ruias place a higher bid if permitted to participate.', 'Overall, the first six months of 2018 look promising for commodities while the second half is clouded with doubt. It will largely depend on China’s stand on metals as it continues to cut down obsolete and polluting capacities, which will impact India’s imports. The weakening dollar also potentially threatens the industry as it will push up manufacturing costs.']"
0,bloombergquint,['business'],"January 19 2018, 10:14AM",Arundhati Sarkar,Bharti Airtel Profit Falls For Sixth Straight Quarter,[],Bharti Airtel Ltd.’s profit fell for the sixth straight quarter after the telecom regulator reduced the fee that operators earn for cross-network calls by more than half.,"['Bharti Airtel Ltd.’s profit fell for the sixth straight quarter after the telecom regulator reduced the fee that operators earn for cross-network calls by more than half.', 'India’s largest wireless carrier’s net profit in the December-ended quarter declined 11 percent over the previous three months to Rs 306 crore, Bharti Airtel said in a stock exchange filing. The consensus estimate of analysts tracked by Bloomberg had expected profit at Rs 359 crore.', 'The fall in profit for the Sunil Bharti Mittal-led company comes at a time when the world’s second-largest telecom market is locked in a tariff war unleashed by Mukesh Ambani’s Reliance Jio Infocomm Ltd. The country’s newest wireless carrier first launched services free and then offered cheaper data plans, forcing rivals to match its prices and benefits.', 'The Telecom Regulatory Authority of India’s decision to reduce interconnect fee—that operators earn for completing calls by rival network subscribers—to 6 paise a minute from 14 paise further hurt revenue and profit. Larger operators like Bharti Airtel that have a wider reach are the net earners of interconnect usage charges.', 'Airtel earned an average revenue of Rs 123 per user (blended) during in the three months ended December, below the estimated Rs 129. “Regulatory fiat in the form of a cut in domestic IUC rates has exacerbated the industry ARPU decline,” Gopal Vittal, managing director and chief executive officer at Bharti Airtel (India and South Asia), said.', 'Shares of Bharti Airtel closed 1.17 percent lower ahead of the earnings announcement, while the benchmark S&P BSE Sensex ended trade 0.5 percent up. The stock appreciated 27.1 percent in the October-December period.']"
0,bloombergquint,['business'],"January 18 2018,  7:06PM",PTI,Tech Mahindra To Pick Up 17.5 % Stake In Altiostar For $15 Million,[],Information technology company Tech Mahindra Ltd. today announced it will acquire 17.5 percent stake in U.S.-based telecom software development company Altiostar Networks for $15 million in an all-cash deal.,"['Information technology company Tech Mahindra Ltd. today announced it will acquire 17.5 percent stake in U.S.-based telecom software development company Altiostar Networks for $15 million in an all-cash deal.', 'The investment committee of the board of directors of Tech Mahindra “has approved the proposal to acquire shareholding in Altiostar Networks Inc, USA, through its wholly owned subsidiary, that is, Tech Mahindra (Americas) Inc, USA,” the company said in an exchange filing.', 'Altiostar Networks is a U.S. corporation with presence across six countries in Europe, Asia Pacific and Latin American regions.', '""This is a portfolio investment from Tech Mahindra Ltd (TML) in the nascent but promising and fast-growing virtualised Radio Access Networks space. TML through its wholly owned subsidiary Tech Mahindra (Americas) Inc is investing an amount of $15 million in return for a 17.5 percent shareholding in Altiostar on a fully diluted basis,"" it added.', 'The investment will be completed by Jan. 19, 2018.', 'Altiostar, was founded in 2011 and has close to 220 employees. The company has presence in the U.K., Germany, India, Mexico, Argentina and Israel.']"
0,bloombergquint,['business'],"January 18 2018,  9:15AM",Nickey Mirchandani,UltraTech Cement’s Profit Declines For Second Straight Quarter,[],"UltraTech Cement Ltd.’s net profit declined for the second straight quarter, on the back of the ban on petroleum coke use in some states and an increase in variable costs.","['UltraTech Cement Ltd.’s net profit declined for the second straight quarter, on the back of the ban on petroleum coke use in some states and an increase in variable costs.', ""Net profit during the October-December quarter declined 25 percent, compared to the corresponding quarter last year, to Rs 421.5 crore, according to the Aditya Birla Group company's exchange notification. The profit was in-line with the Rs 428 crore consensus of analysts tracked by Bloomberg."", 'Revenues of the country’s largest cement maker rose 35.3 percent to Rs 7,590 crore. Analysts had expected the top line to come in at Rs 7,054 crore.', 'UltraTech Cement’s operational performance fell short of analysts estimates. Earnings before interest, tax, depreciation, and amortisation, rose 13.9 percent to Rs 1,268 crore, compared to the Rs 1,340 crore consensus estimate. The operating margins contracted 310 basis points to 16.7 percent.', 'The Supreme Court allowedcement makers to use pet cokeon Dec. 13, reversing its decision on Oct. 24 that banned the use of pet coke and furnace oil in Uttar Pradesh, Haryana and Rajasthan from Nov. 1 in view the pollution in Delhi and the National Capital Region.', 'Shares of UltraTech Cementextended declines for the second session and fell as much as 2.6 percent, the most in over three weeks, to Rs 4,427.9 apiece after the results announcement.', 'The stock trades at 45.1 times trailing 12-month earnings per share and 46 times its estimates for the coming year, according to Bloomberg data. The stock rose 32.9 percent last year compared to the 27.9 percent rise in the country’s benchmark BSE S&P Sensex Index.', 'The expected higher budget allocation for infrastructure and rural development will be the key demand drivers, the cement maker added.']"
