,Source,Category,Date,Author,Title,Tags,Subtitle,Content
0,bloombergquint,['politics'],"January 19 2018,  8:21PM",John McCormick,Candidates and Contributors May Make 2018 the Year of the Woman,[],(Bloomberg) -- Democratic women –- from grassroots donors to wealthy political benefactors -- are stepping up contributions at a record pace as they seek to send President Donald Trump a strong rebuke in this year’s midterm elections that will determine control of Congress.,"['(Bloomberg) -- Democratic women –- from grassroots donors to wealthy political benefactors -- are stepping up contributions at a record pace as they seek to send President Donald Trump a strong rebuke in this year’s midterm elections that will determine control of Congress.', 'Democrats have a shot at seizing control of the House from Republicans and at least a potential path to a Senate majority, and women activists are helping create a wave of momentum for the party.', 'After being stung by Hillary Clinton’s loss in the 2016 presidential election, the women have been regrouping, organizing and spending in an effort to help the Democratic Party bounce back. Their efforts have been bolstered by the#MeToo movement, recent special election victories and an inspirationalspeechlast week by Oprah Winfrey.', 'As Trump closes out his first year as president,\xa0a record 266 Democratic women have reported raising money for House races, and other women are putting money into campaigns at unprecedented rates,\xa0according to ananalysisby the Center for Responsive Politics in Washington.', 'The outpouring of support for women on social media as a result of the flood of sexual harassment and misconduct accusations against men in powerful positions has spurred some of the new activism. This weekend marks the one-year anniversary of the Women’s March in Washington and other cities, and on Saturday and Sunday, thousands of people across the nation are expected to gather for rallies and other events.', '""It has the potential to be the year that women turn the tide and transform our country,"" said Barbara Lee, a Boston-based political consultant and philanthropist who gave $1.9 million to super political action committees that supported the Clinton campaign.', 'A Quinnipiac University Poll released on Jan. 17showedthat\xa063 percent of women\xa0disapprove of the president’s job performance, compared to 57 percent of American voters overall.', '""Women are facing the brunt of Trump’s and the Republican Party’s attacks -- attacks on reproductive justice, minimum wage laws, protections for tipped workers, anti-immigrant policies, student loan debt forgiveness and access to healthcare,"" said Amber Anderson Mostyn, a Texas lawyer and a major Democratic donor.', 'In the first three quarters of 2017, Democratic candidates, especially women, benefited the most from the trend, with female candidates receiving 44.2 percent of their contributions from women, on average, up from 40.3 percent in 2016, the analysis by the Center for Responsive Politics showed.', 'Among Democratic candidates, about 33 percent are women, while fewer Republican women are running and raising money in House races than usual this cycle. Campaigns will next report their latest fundraising totals on Jan. 31.', '“There is a real commitment here and women are looking around to see who the candidates are,” said Susie Tompkins Buell, a prominent Democratic donor from San Francisco who co-founded the Esprit clothing line. “I’m focusing more on the House races because I think that’s where the fresh young ones are going.”', 'Emily’s List, the largest national organization devoted to electing female candidates, said December set the fundraising record\xa0in its 33-year history for the final month of the year. Much of the added giving came in the form of small donations contributed online. The group said it could not provide a total as it was still tallying the final numbers.', 'Stephanie Schriock, the group’s president, said the number of women running for office is soaring. During the entire 2016 election cycle, Emily’s List heard from 920 women who were considering running for office or getting involved politically in some way. That number has already grown, to 26,000 for the 2018 election cycle.', '“People are seeing women candidates are a good investment,” Schriock said in an interview last week in her Washington office. ""We are in a tipping-point moment.""', 'A decisive win by Democrat Patty Schachtner this week in a special election in a Wisconsin state senate district that Trump carried by 17 points in 2016 gave the party its latest boost, following the first Democratic victory in a U.S. Senate race in Alabama in 25 years in December and decisive wins for governor and other contests in Virginia the month before.', 'Still, November remains a long way off, and Trump won 41 percent of women’s votes in 2016, according to exit polls. The Republican Party is also likely to have significant financial resources in 2018. House Speaker Paul Ryan’s joint fundraising committee, Team Ryan, said Thursday that it raised more than $44 million in 2017, a record total for a non-national-election year.', 'Typically, the party holding the White House almost always loses congressional seats in the midterm elections. Democrats need a net gain of 24 seats to take the House and two to secure a majority in the Senate. Analysts suggest their chances are better in the House because they’re defending far more Senate seats than Republicans and only have a few strong pick-up opportunities in that chamber.', 'Democratic candidates for office -- and potential future ones -- are also seeking to leverage this weekend’s marches and rallies for their own campaigns.', '""This weekend marks one year since women across the country marched for equality and in protest of Donald Trump’s sexism,"" J.B. Pritzker, a billionaire and Democratic candidate for governor in Illinois, said in a statement Thursday. ""As these issues continue to plague our country, I’m proud to march again this coming Saturday.""', 'Tompkins Buell, a major supporter of Clinton’s campaign who gave $2.5 million in the 2015 and 2016 election cycle to candidates and committees that report to the Federal Election Commission, said she’ll likely give even more for this election than in past midterm races.', '“Anyone who was committed to Hillary is committed to the bigger picture,” she said. “These deep dark days have really brought the best out of women.”', 'In addition to the record number of House candidates, there are 79 women who are running or exploring runs for governor and 49 for U.S. Senate seats, according to the Center for American Women and Politics at Rutgers University. Lee, the Boston philanthropist, said she is leaning toward supporting candidates in those races because the positions are better stepping-stones to the Oval Office.', 'As disappointing as Clinton’s 2016 loss was, Lee said, she thinks the number of women running for office -- including at the local and state level -- will make it easier for a woman to eventually win the White House.', '""She will have been carried by a movement and not compelled to carry it herself,"" said Lee, whose family foundation helps women running for office regardless of party.', '', '', '©2018 Bloomberg L.P.']"
0,bloombergquint,['politics'],"January 22 2018, 10:20AM",Ania Nussbaum,Paris Gets Early Start on Olympics Turmoil With Transport Delays,[],"(Bloomberg) -- Spiraling construction costs and delays are nothing new in the history of hosting the Olympics. Yet Paris is starting early, with growing controversy about whether a plan to upgrade its metro system will be ready for the 2024 summer games.","['(Bloomberg) -- Spiraling construction costs and delays are nothing new in the history of hosting the Olympics. Yet Paris is starting early, with growing controversy about whether a plan to upgrade its metro system will be ready for the 2024 summer games.', 'A project to extend the city’s transport network is increasingly bogged down with accusations of mismanagement and a ballooning budget, partly due to tighter deadlines so it can be ready for the sporting event.', 'A national audit published this week has placed a question mark over whether the French capital can make good on a pledge\xa0to get athletes and fans to use its extensive public transit system to reduce carbon emissions and traffic jams.', '“We boasted about an excellent transport network and some programs that would be delivered for the games,” Tony Estanguet, the head of the committee that oversees the Olympics organization, told a parliamentary hearing. “It’ll be very difficult for us if some lines aren’t delivered on time.”', 'The brouhaha erupted after the auditor published a scathing report about the transport plan known asGrand Paristhat was supposed to be ready in time for the Olympics. The agency overseeing the project -\xa0which would expand the city’s metro system to improve connections to deprived suburbs -- isn’t well managed and costs have risen dramatically, said the head of the auditor, Didier Migaud.', 'In response, Estanguet wrote to President Emmanuel Macron to defend parts of the plan Olympics organizers deem critical for the games. The most important rail link is line 17 to the Bourget airport, where journalists will be hosted during the games, he said. Transport Minister Elisabeth Borne hadwarnedin parliament that some lines would not be ready.', 'Thereportby the auditor, called the Cour des Comptes, made for compelling reading. It warned the pricetag of Grand Paris could balloon to 38.5 billion euros ($47 billion), twice the initial budget put forth in 2010, and in a worst-case scenario could weigh on France’s sovereign\xa0debt through 2100.', 'The extra costs stem in part from added urgency to complete the extension in time for the Olympics and insufficient staffing at the public agency overseeing the plan, Migaud told a parliamentary hearing. The auditor also criticized contract-award procedures that he said aren’t sufficiently public and lack transparency.', 'Builders Vinci SA, Bouygues SA and Eiffage SA are set to benefit the most from Grand Paris, which is the city’s most ambitious and expensive building project in 150 years. Vinci’s\xa0share of orders amounts to about 1.3 billion euros.', 'With 200 kilometers (124 miles) of new metro tracks and 68 new stations, Grand Paris will connect some of the least prosperous suburbs to the city, spurring development in the greater Paris. The region represents about a third of France’s GDP. Funding for the project includes mainly long-term debt, but also Paris region tax receipts and subsidies.', '', '', '©2018 Bloomberg L.P.']"
0,bloombergquint,['politics'],"January 20 2018, 12:39PM",Laurence Arnold,What Shuts Down During a U.S. Government Shutdown: QuickTake Q&A,[],"(Bloomberg) -- A U.S. government shutdown, once just a specter, is now animminent possibility. Without agreement on the 12 appropriations bills that guide annual spending, the U.S. has been operating since Oct. 1 on temporary funding provided by a ""continuing resolution."" Funding was due to run out after Dec. 8 but has twice been extended,most recentlythrough today. Republicans and Democrats in the U.S. Congress have to keep passing short-term extensions or reach accord on a trillion-dollar spending plan for the rest of the fiscal year. Barring that, the U.S. at midnight will encounter what’s officially called a ""spending gap,"" which triggers a carefully prescribed, but still disruptive, halt to Washington’s work.","['(Bloomberg) -- A U.S. government shutdown, once just a specter, is now animminent possibility. Without agreement on the 12 appropriations bills that guide annual spending, the U.S. has been operating since Oct. 1 on temporary funding provided by a ""continuing resolution."" Funding was due to run out after Dec. 8 but has twice been extended,most recentlythrough today. Republicans and Democrats in the U.S. Congress have to keep passing short-term extensions or reach accord on a trillion-dollar spending plan for the rest of the fiscal year. Barring that, the U.S. at midnight will encounter what’s officially called a ""spending gap,"" which triggers a carefully prescribed, but still disruptive, halt to Washington’s work.', 'Many, though not all, federal government functions are frozen, and many, though not all, federal employees are furloughed. Agencies in the executive branch, the one with the largest workforce and budget, regularly review shutdown plans that spell out what work must continue, and how many employees will be retained, during a ""short"" lapse (one to five days) and one that lasts longer.', 'The ones thatdraw headlinesareclosures of national parks, monuments and the Smithsonian museums in Washington. Other activities that may stop if the shutdown lasts more than a few days include the processing of applications for passports and visas; new enrollments in experimental treatments under the National Institutes for Health; and the maintenance of U.S. government websites, including ones used by businesses and researchers. Mortgage approvalscan be delayedby furloughs at the Internal Revenue Service and the Federal Housing Administration. The last shutdown, which lasted 16 days in 2013, delayed release of Labor Department monthly employment reports, Commerce Department data on retail sales and housing starts and a monthly Fed report on industrial production that uses Labor Department data.Also delayedwas approval of drilling applications at the Bureau of Land Management, consideration of applications for small business loans and the start of the Alaska crab season, which relies on harvest levels apportioned by the National Oceanic and Atmospheric Administration.', 'Activities related to national security (like the military services), safety and order (air traffic control, law enforcement) and medical care\xa0(veterans’ hospitals) are among the essential activities that carry on. So does the U.S. mail, since the Postal Service hasits own funding stream.U.S. Treasury debt auctionscontinue, Social Security and Medicare checks get mailed, food stamps are distributed. Federal courts are open but their work issubject to disruption.', 'In the 2013 shutdown, the number of executive-branch employees who were furloughed on a given day peaked at 850,000, or about 40 percent of the workforce.', 'Eventually. When a shutdown happens, most federal employees -- there are about 2.8 million of them now -- are placed on unpaid furlough. Though there ""appears to be no guarantee"" that they will eventually be paid, in practice they always have been, retroactively, via legislation passed by Congress, according to the Congressional Research Service.', 'There have been 12 shutdowns since 1981, ranging in duration from a single day to 21 days,according tothe Congressional Research Service.\xa0The 21-day one, in December 1995 and January 1996, was a famous budget showdown that pitted President Bill Clinton, a Democrat, and the Republican House speaker, Newt Gingrich.\xa0Shutdowns over budget disagreements are different (andless grave) than what would happen if the U.S. breached itsdebt ceilingand defaulted on some of its obligations. That’s never happened -- though its specter, too, will grow if Congress doesn’t reach a budget deal in thenext several weeks.', 'Until then, ""funding gaps"" didn’t result in shutdowns; agencies operated mostly as normal, and their expenses were covered retroactively once a deal was reached. Benjamin Civiletti, attorney general under President Jimmy Carter, put an end to that. With legal opinions issued in 1980 and 1981, he established that government work generally must cease until Congress agrees to pay for it. His rulings were codified in theAntideficiency Act, which, in theory at least, authorizes fines or prison terms to federal employees whodare work for freeduring a shutdown.', 'Leaders in Congress are juggling demands from factions in both parties to tie agreement on a spending plan to resolution of a variety of other measures. Those include raising budget caps for defense and domestic spending, funding theMexico border wallpromised by President Donald Trump,\xa0and extending theDeferred Action for Childhood Arrivals, a program toprotect from deportationsome 800,000 young people brought to the U.S. illegally as children.', '', '', '©2018 Bloomberg L.P.']"
0,bloombergquint,['politics'],"January 21 2018, 11:44AM",David Wainer,Netanyahu Visit to India Shows Great Optics -- and Obstacles,[],"(Bloomberg) -- Indian authorities pulled out the stops during Israeli Prime Minister Benjamin Netanyahu’s visit this week: His counterpart Narendra Modi showed up unexpectedly to greet him on the tarmac. At a dusty backwater in Modi’s home state, children waved Star of David flags and sang in Hebrew. Farmers praised Israeli technology, and posters and billboards bearing the Israeli prime minister’s likeness were plastered on roads.","['(Bloomberg) -- Indian authorities pulled out the stops during Israeli Prime Minister Benjamin Netanyahu’s visit this week: His counterpart Narendra Modi showed up unexpectedly to greet him on the tarmac.\xa0At a dusty backwater in Modi’s home state,\xa0children waved Star of David flags and sang in\xa0Hebrew. Farmers praised Israeli technology, and posters and billboards bearing the Israeli prime minister’s likeness were plastered on roads.', 'Netanyahu’s first state visit to India, capping a year in which he assiduously courted the Asian giant, was brimming with positive optics and lavish compliments. Behind the scenes,\xa0however, officials are laboring to sweep away significant obstacles to the more flourishing trade both countries want.', 'Since 2010,Israel and India have been negotiating a free-trade agreement intended to lower barriers for Israeli goods in exchange for better access for Indian workers in Israel. India’s bureaucratic maze makes it hard to reach a deal quickly, according to a senior Israeli government official, who spoke on condition of anonymity because talks are ongoing. An Indian delegation is scheduled to arrive in Israel next month for more talks, he said.', 'An Indian diplomat, speaking on condition of anonymity to discuss confidential talks, said India is taking a renewed look at all its free trade accords, complicating the negotiations with Israel. Bilateral trade topped $5 billion last year, and Netanyahu and Modi repeatedly spoke of their desire for more.', '“Getting to a free-trade deal is the focus of our efforts to boost economic ties with India,” said Ohad Cohen, head of the Foreign Trade Administration at Israel’s Economy Ministry. While Israel has many free-trade pacts around the world, he said, India’s are mainly focused in Asia.', 'Driving the growing ties is Netanyahu and Modi’s shared worldview as national-security hawks and free-market proponents. Both see Israel’s technology-oriented economy as a natural fit for India’s, which needs innovation to improve everything from farming to healthcare.', 'In a remote farming village in Gujarat, Netanyahu and Modi visited an agricultural training center where locals learn Israeli water-conservation and energy-efficiency\xa0techniques. Israel has such agricultural centers around the world, but India -- with more than 30 -- hosts more than any other country.', 'Military deals underpin the economic relationship, and Israeli officials said\xa0on this trip\xa0they’d revived a scuttled deal to sell missiles to India. No explanation was given for India’s about-face, and it wasn’t clear if the the revived deal would still be worth $500 million.', 'The growing ties have yet to produce Indian support where Israel wants it most -- at the UN and other international fora. Netanyahu expresseddisappointmentthat India supported a UN General Assembly resolution last month blasting U.S. recognition of Jerusalem as Israel’s capital, but said it wouldn’t impede closer ties.', 'One hurdle to trade is the circuitous flight between the countries. Direct flights have to circumvent countries to Israel’s east that don’t have official relations with the Jewish state, so it takes more than nine hours to fly the 4,000 kilometers (2,500 miles) from Tel Aviv to Mumbai. With Israel’s still-clandestine relations with Saudi Arabia improving, Netanyahu told a group of businesspeople in Mumbai that Israel is working on a “simple, direct flight” to India.', 'Netanyahu brought some 130 business leaders to India, which his office said was the biggest delegation an Israeli leader has ever taken abroad. Modi reciprocated with warm embraces, feting\xa0Netanyahu with traditional dancers in peacock feathers during a visit to Agra, where\xa0the Taj Mahal mausoleum was closed to tourists so Netanyahu and his wife could have a private visit.', '“We have a clear message coming down from both leaders that they want to bring our countries closer together,” said Anju Kumar, deputy ambassador from India to Israel. “There’s a number of issues we need to work on. We are working on it.”', 'On his last night in Mumbai, Netanyahu partied with Bollywood royalty such as actor Amitabh Bachchan and director Abhishek Kapoor. Once the festivities are finished, it will be time to get down to details.', '“Both sides understand that the real work will begin next week, when we get back from this trip,” Israel Foreign Ministry Director-General Yuval Rotem said. “We are engaging on all fronts, beyond the military and diplomacy. We are creating links in the movie industry, oil and gas, cyber and more.”', '', '', '©2018 Bloomberg L.P.']"
0,bloombergquint,['politics'],"January 19 2018,  8:35AM",Marc Champion,Approval of U.S. Leadership Under Trump Tumbles Globally in Poll,[],"(Bloomberg) -- An annual Gallup poll of international support for U.S. leadership, conducted after President Donald Trump’s election and published Thursday, shows a sharp fall in approval since 2016.","['(Bloomberg) -- An annual Gallup poll of international support for U.S. leadership,\xa0conducted after President Donald Trump’s election and published Thursday, shows a sharp fall in approval since 2016.', 'Gallup found that U.S. approval ratings fell by 10 percentage points or more in 65 of the 134 countries surveyed in March to November last year. America’s image improved in just 17 countries, and by more than 10 percentage points in three -- Belarus, Israel, and Macedonia. Worldwide, more people now say they disapprove of U.S. leadership (43 percent), than of China’s or Russia’s (30 percent and 36 percent respectively).', '', '', '©2018 Bloomberg L.P.']"
0,bloombergquint,['politics'],"January 19 2018, 11:35AM",Justin Sink,Trump Says He Called Apple's Cook to Thank Him for Investments,[],(Bloomberg) -- President Donald Trump said Thursday that he called Apple Inc. Chief Executive Officer Tim Cook to thank him for announcing hundreds of billions of dollars in U.S. investments following passage of Republican tax legislation last year.,"['(Bloomberg) -- President Donald Trump said Thursday that he called Apple Inc. Chief Executive Officer Tim Cook to thank him for announcing hundreds of billions of dollars in U.S. investments following passage of Republican tax legislation last year.', 'Applesaid Wednesdayit would return hundreds of billions of dollars to the U.S. from overseas, pay a $38 billion tax bill on that money and invest about $350 billion in its domestic operations over the next five years. The company plans capital expenditures of about $30 billion and will create about 20,000 new jobs at existing sites and a new campus.', '“When I heard the news yesterday -- and Tim Cook is a great guy, the head of Apple -- when I heard the news, I heard $350 billion and I said, ‘you mean $350 million, that is going to be a beautiful plant,’ and they said ‘no,’ they said ‘it is $350 billion,”’ Trump said in a speech at a factory in Coraopolis, Pennsylvania, a Pittsburgh suburb. “I just called Tim Cook and thanked him, but I don’t imagine there has ever been an investment that big in our country by a company.”', 'Apple shares were mostly unchanged on Thursday after closing Wednesday at a record high, $179.10.', 'Cook and Trump have not been close. While the Apple chief has spread his political donations across both major U.S. parties, according to Federal Election Commission, he held a fundraiser in 2016 for Hilary Clinton and last year pledged $2 million to anti-hate groups after a deadly rally by white supremacists in Charlottesville, Virginia.', 'In an email to Apple staff, Cook criticized President Trump for blaming “both sides” for violence at the rally.', '', '', '', '©2018 Bloomberg L.P.']"
