rowNumber,companyName,Source,Category,Date,Author,Title,Tags,Subtitle,Content
21264,5Paisa Capital,moneycontrol,Markets,"['Oct 20, 2017 06:27 PM IST']",['Moneycontrol.com'],Nifty could record 15-17% return in Samvat 2074 — 5 wealth-creating ideas,['MARKET OUTLOOK'],"['Prakarsh Gagdani. Chief Executive Officer of IIFL Group subsidiary 5Paisa Capital, is optimistic about the market.']","['Prakarsh Gagdani, Chief Executive Officer of IIFL Group subsidiary 5Paisa Capital, said in an interview to Moneycontrol that he is optimistic about the market in Samvat 2074 and sees the Nifty giving returns of 15-17 percent in the next one year.Excerpts:What is your call on markets for Samvat 2074?The market looks extremely strong and amid a bull rally. The Nifty has already hit a high and the Sensex followed suit. So far as Samvat 2074 is concerned, I am optimistic about the market.related newsMarket snaps 6-day gaining streak: Experts discuss the outlook & specific stocksGautam Shah feels market still far from major top, could gain 10-12% in 2018Remain stock specific ahead of Budget 2018; 3 stocks which could give up to 20% returnI am expecting Nifty to give 15-17 percent returns in the next one year. The main reason for this surge is healthy domestic inflows and I don’t see any reason why domestic inflows would reduce in coming months.Insight 18 | Samvat 2074: The Story Behind Muhurat TradingMutual funds have seen a huge demand with retail investors pumping money into the system. Besides, foreign flows would also continue to chase India considering its size and high growth compared to the rest of the emerging markets.I see market continuing this momentum and scaling new heights next year.Any top stocks which you think are under-owned but have tremendous potential to deliver strong returns in next 3-5 years?As per our house view some stocks suggested are --Century Plyboards,Tata Motors DVR,ICICI Prudential Life Insurance,Ujjivan Financial ServicesandCG Power.It looks like the market has climbed wall of worries – earnings growth, muted macros and geopolitical concerns. What is your target for Nifty and Sensex for FY18?I agree that markets have crossed all walls of worries even as we say prices are slaves of earnings and there have been some muted earnings in the last financial year. But I expect the next year to be much better in corporate earnings than this year.I am sure the effect of demonetisation on the economy will fade out over the next year and even the positive aspects of GST will be clearly visible clearly in the earnings.Overall, the market looks good for 2018 and I expect Nifty and Sensex to deliver around 15 to 17 percent growth in the coming year.IPO mania has gripped D-Street with most primary offers getting oversubscribed multiple times. Do you see the trend continuing for Samvat 2074? What is the kind of money we are talking about?We have seen a huge surge in IPOs in the last 12 months there has been active participation from retail investors in all the good quality IPOs.I am confident that the same mania will continue for the next 12months as well. However, it also depends on the quality of the IPOs’, as we have seen good quality IPOs last year like D-mart, ICIC Lombard etc. hitting the market.If we get good quality companies coming into the stock market and we have a fair valuation, investors would grab such opportunities and see oversubscriptions in these IPOs.It will be difficult to put numbers on IPOs but with IPOs like NSE, SBI Life Insurance, Reliance AMC and others, the quality IPO pipeline looks good. The amount to be raised, I believe, would be almost equal to last year or may be higher.What is your call on the broader market? The euphoria doesn’t seem to die down. Should investors\xa0keep accumulating or book profits?Though markets look a bit stretched on the EPS front, the price to book still looks attractive. It is a phase of caution and one should focus on quality only.Investors will get an opportunity to invest in specific stocks, so my advice to the investors will be look for good quality companies either in midcap small cap or large cap in invest for a long term.The way domestic money is flowing into equity markets – do you think it is a cause of worry? Equities are high return but at the same time high-risk instruments. There is always a possibility of a negative return – will that dent optimism?In the last one year, there is a huge inflow in the equity market. If you see September itself, we got a record of Rs 5,000 crore coming only into SIP\xa0in the equity market.Even though I agree equity has a high return, it also has a high risk as well involved but the money coming as SIP is normally for a long-term and the kind of SIP amount month on month we are seeing has shown 46 percent growth as compared to last year.It clearly means that the money is coming for long-term and if the money is coming for long-term then the flow will continue and I don’t think there is any reason to worry.The only reason why it would reduce will be purely dependent on earnings of companies. Otherwise, I don’t see any problem in the domestic inflow of money because it is healthy and good money is coming from equity in the form of SIP.What is the one thing or habit you want investors to start this Diwali with respect to trading or portfolio?Investing in the stock market should be a long-term strategy. If any retail investor is looking to approach the stock market it should be through mutual fund SIP in the beginning.The objective should be for long term and if they make a habit of regularly investing into market then it is statistically proofed over time and you negate the cyclical behaviour of market and you negate the rise and drops in the prices which may affect your portfolio or stocks.One thing all investors should start from this Diwali is to invest one fixed amount in a month and make it a habit of investing rather than making it a one-time activity. Only if you have access to good research and advisory do invest directly, else SIP is the best.Some analysts expect earnings to recover slightly in the September quarter. What are your views?We expect some recovery in the September quarter, but significant recovery is likely in the quarters after and the next financial year.Which sectors are likely to lead the next leg of the rally?Our house research is overweight on NBFC, infrastructure, and metals.']"
21627,5Paisa Capital,moneycontrol,Markets,"['Oct 19, 2017 05:47 PM IST']",['Moneycontrol.com'],Top 10 stocks which gave up to 300% return in last 4 out 5 Samvat years; do you own any?,"['Market Edge', 'Muhurat Special 2017']",['Samvat 2074 is unlikely to be any different from Samvat 2073. Analysts expect stock specific action to dominate next 12 months while benchmark indices could well give another high teen return in the same period.'],"['The festival of lights, Diwali is just a few days away and there are fireworks all around on D-Street with benchmark indices touching record highs in the run-up to the event. If you would have invested in equities at the start of Samvat 2073 chances are you might be sitting on a huge pile of profits.However, chances of you making a sound return on your investments increase exponentially if you would have invested in ten stocks which historically have given smart double-digit returns in the last five Samvat years.Top stocks which have given returns up to 300 percent in the last four out of five Samvat years include names like Britannia Industries, Eicher Motors, Transpek Industry, Avanti Feeds, Hester Bio, Natco Pharma, Hatsun Agro, Sakuma Exports, LT Foods, Ruchira Papers and Indian Terrain.related newsTechnical View: Nifty forms ‘Hanging Man’ pattern; 11,110 crucial for bullsBudget 2018: Housing, infrastructure, and rural economy theme may remain in focusNo high beta but quality to lead rally in 2018; 10 stocks which can give up to 37% returnBritannia Industries, the FMCG major, more than doubled investors’ wealth in two out of five Samvat years. It rose nearly 40 percent in Samvat 2073. For the September quarter, the event such as GST will have a short-term impact on sales, but it is positive in the long run.New product addition and expansion in distribution channels will help the company to post steady earnings growth in the coming years, suggest experts. The stock is currently trading at 42x its FY2019E earnings.Insight 18 | Samvat 2074: The Story Behind Muhurat TradingAnother company which has been investors’ favourite is Avanti Feeds. The stock hit a fresh record high on Tuesday. It has already rallied over 400 percent so far in the year 2017 and about 360 percent in Samvat 2073.It rose by about 3 percent in Samvat 2072 but it has been a massive outperformer in the last five years. The stock rose over 500 percent in Samvat 2017 and over 50 percent each in Samvat 2071 and Samvat 2069.Ruchira Papers, LT Foods, Sakuma Exports, Hatsun Agro also did not disappoint investors. Shares of these companies more than doubled investors’ wealth in two out of five Samvat years.Sectoral PerformanceAmong the sectors, the S&P BSE Consumer Durable index rose by over 40 percent in Samvat 2073, followed by metals index which rose 39 percent, and Realty index gained 37 percent in the same period.The S&P BSE Smallcap index rose 24 percent while the S&P BSE Midcap index gained 18 percent compared to 16 percent rise in the S&P BSE Sensex.Going into Samvat 2074, analysts advise investors to focus on sectors which are related to consumption, economy and govt policy.These sectors are likely to hog the limelight. IT and pharma could well show some gains if the rupee depreciates further but they have headwinds which would cap upside.“The key overweight sectors for us are – Cement, Capital Goods, and Oil & Gas. Government’s continued focus on affordable housing and infrastructure creation should aid demand in Cement and Capital Goods,” Harsha Upadhyaya, CIO- Equity, Kotak Mutual Fund told Moneycontrol.Oil&Gas sector is likely to deliver one of the more consistent sets of earnings growth in the market and is also reasonably valued.“Some other sectors such as Pharma, Telecom and IT are facing structural headwinds and earnings are under pressure. We do not envisage any improvement in the short to medium term in these sectors,” said Upadhyaya.He further added that valuation-wise there are many other sectors such as NBFCs, FMCG etc. which are trading at rich multiples, and therefore could pose risk.Outlook for Samvat 2074Samvat 2074 is unlikely to be any different from Samvat 2073. Analysts expect stock specific action to dominate next 12 months while benchmark indices could well give another high teen return in the same period.The broader market looks extremely strong although some stocks could be displaying frothy valuations. But, corporate earnings growth which is likely to rebound in next few quarters should lead the recovery and support sentiments, suggest experts.“Market looks extremely strong and amid a bull rally. Nifty has already hit a high and Sensex followed the suit. So far as Samvat 2074 is concerned, I am optimistic about the market. I am expecting Nifty to give 15-17 percent returns in the next one year,” Prakarsh Gagdani CEO, 5Paisa Capital, A subsidiary of IIFL Group told Moneycontrol.“The main reason for this surge is healthy domestic inflows and I don’t see any reason why domestic inflows would reduce in coming months. I expect the next year to be much better in corporate earnings’ than this year. I am sure the effect of demonization which was there on the economy will fade out over next year,” he said.']"
561,8K Miles Software Services,moneycontrol,Stocks,"['Jan 23, 2018 08:49 AM IST']",['Moneycontrol.com'],DSP Blackrock Mutual Fund buys 4.26 lakh shares of 8K Miles Software Services,['Buzzing Stocks'],"['DSP Blackrock Mutual Fund bought 4,26,281 shares of 8K Miles Software Services at Rs 748.']","['On January 22, 2018 Ramani R S sold 2,50,000 shares of8K Miles Software Servicesat Rs 750 and sold 4,32,506 shares at Rs 748.64 on the NSE.However, DSP Blackrock Mutual Fund bought 4,26,281 shares at Rs 748.In the previous trading session, the share closed down 5.45 percent or Rs 45 at Rs 781.05.The share touched its 52-week high Rs 1,029.95 and 52-week low Rs 364.70 on 29 November, 2017 and 27 September, 2017, respectively.Currently, it is trading 24.17 percent below its 52-week high and 114.16 percent above its 52-week low.']"
3703,8K Miles Software Services,moneycontrol,Markets,"['Jan 08, 2018 08:24 AM IST']",['Moneycontrol.com'],DuPont analysis: These 4 stocks gained over 500% in the last three years,"['Market Edge', 'markets']","['Moneycontrol did a DuPont analysis of its own to pick out stocks that checked all our parameters -- an increasing operating profit margin, an increasing asset turnover, and a decreasing asset-to-equity ratio. ']","['Picking stocks to invest in could be tricky at times, particularly when there are tips flying around left, right and centre. There are many aspects one must ideally consider before settling on a scrip to invest in because rushing in blindly to where the light is shining the brightest may not always pay off.A DuPont analysis is one of the most apt indicators to go by when it comes to picking stocks because it gives you the exact return on equity (RoE) for a particular stock. In order to do so, it combines three of the most important parameters that pertain to the profitability of a company -- operating profit margin, operational efficiency (based on total asset turnover), and financial leverage (based on ratio of total assets to equity).However, a DuPont analysis is only a tool of measure and does not exactly spell out which stock is worth investing in. In order to do so, Moneycontrol did a DuPont analysis of its own to pick out stocks that checked all our parameters -- an increasing operating profit margin, an increasing asset turnover, and a decreasing asset-to-equity ratio.An increasing operating profit margin indicates that a company is making more today for the same amount of products sold than it was making earlier, while an increasing asset turnover is indicative of improving profitability of a company as a whole. A decreasing asset-to-equity ratio indicates that a company is less dependent on debt than it was before.related newsTechnical View: Nifty forms ‘Hanging Man’ pattern; 11,110 crucial for bullsBudget 2018: Housing, infrastructure, and rural economy theme may remain in focusNo high beta but quality to lead rally in 2018; 10 stocks which can give up to 37% returnAlthough there are many companies who reported an increase in their return on equity over the last three years, only 15 managed to do so while meeting all three above-mentioned criteria. And not surprisingly, 13 of these stocks have returned between 100 and 970 percent over the last three years.Among these 13 stocks,COSYN,Maithan Alloys,Associated AlcoholsandVakrangeeled the pack with gains of over 550 percent.Of the 15 companies that passed our filters, there were four IT companies -- 8K Miles Software Services, COSYN,Onward Technologiesand Vakrangee -- and three auto ancillary companies --GP Petroleums,Harita Seating Systems,Investment & Precision Castings.Follow @riteshpresswala']"
12565,8K Miles Software Services,moneycontrol,Announcements,"['Nov 22, 2017 02:04 PM IST']",['Moneycontrol.com'],"8K Miles Software Services' board meeting on December 1, 2017",['Announcements'],"['To consider and approve the unaudited standalone and consolidated financial results for the quarter ended September 30, 2017.']","['To consider and approve the unaudited standalone and consolidated financial results for the quarter ended September 30, 2017.At 14:01 hrs 8K Miles Software Services was quoting at Rs 830.20, up Rs 9.00, or 1.10 percent.The share touched its 52-week high Rs 900.20 and 52-week low Rs 364.75 on 06 November, 2017 and 27 September, 2017, respectively.Currently, it is trading 7.78 percent below its 52-week high and 127.61 percent above its 52-week low.Market capitalisation stands at Rs 2,533.57 crore. Source : BSERead More']"
17781,A2Z Infra Engineering,moneycontrol,Stocks,"['Nov 03, 2017 08:26 AM IST']",['Moneycontrol.com'],IL&FS Financial Services sells 22.50 lakh shares of A2Z Infra Engg,['Buzzing Stocks'],"['On November 2, 2017 IL&FS Financial Services Ltd - Proprietary Portfolio sold 22,50,322 shares of A2Z Infra Engineering.']","['On November 2, 2017 IL&FS Financial Services Ltd - Proprietary Portfolio sold 22,50,322 shares ofA2Z Infra Engineeringat Rs 38.22 on the NSE.On Thursday, A2Z Infra Engineering was quoting at Rs 41.95, up Rs 4.55, or 12.17 percent.The share touched its 52-week high Rs 52.65 and 52-week low Rs 33.10 on 26 April, 2017 and 22 November, 2016, respectively.']"
18230,A2Z Infra Engineering,moneycontrol,Stocks,"['Nov 02, 2017 08:00 AM IST']",['Moneycontrol.com'],IL&FS Financial Services sells 9.43 lakh shares of A2Z Infra Engineering,['Buzzing Stocks'],"['IL&FS Financial Services Ltd - Proprietary Portfolio sold 9,43,613 shares of A2Z Infra Engineering.']","['On November 1, 2017 IL&FS Financial Services Ltd - Proprietary Portfolio sold 9,43,613 shares ofA2Z Infra Engineeringat Rs 38.05 on the NSE.On Wednesday, A2Z Infra Engineering ended at Rs 37.40, up Rs 0.55, or 1.49 percent on the NSE.The share touched its 52-week high Rs 52.65 and 52-week low Rs 33.10 on 26 April, 2017 and 22 November, 2016, respectively.']"
16730,A2Z Infra Engineering,moneycontrol,Announcements,"['Nov 06, 2017 04:25 PM IST']",['Moneycontrol.com'],"A2Z Infra Engineering's board meeting on November 13, 2017",['Announcements'],"['Dear Sir,', <br/>, ' ', <br/>, ' Pursuant to Regulation 29 of SEBI (LODR) Regulations, 2015, please note that a meeting of the Board of Directors of A2Z INFRA ENGINEERING LTD. is scheduled to be held on Monday, the 13th day of November, 2017']","['Dear Sir,Pursuant to Regulation 29 of SEBI (LODR) Regulations, 2015, please note that a meeting of the Board of Directors of A2Z INFRA ENGINEERING LTD. is scheduled to be held on Monday, the 13th day of November, 2017 at Gurugram, inter-alia to consider and take on record the Unaudited Standalone Financial Results for the Quarter (Q2) and half year ended 30th September, 2017.Further in accordance with the SEBI (Prohibition of Insider Trading) Regulations, 2015, the ""trading window"" for dealing in the Equity Shares of the Company will remain closed for the directors/officers/designated employees of the Company in accordance of the Company\'s ""Code of Conduct for Prohibition of Insider Trading"" from 07th November, 2017 till the completion of 48 hours after the unaudited financial results of the Company for the Quarter (Q2) and half year ended on 30th September, 2017 are approved by the Board and made public.You are requested to take the above information on records.Source : BSERead More']"
1671,Aarti Drugs,moneycontrol,Markets,"['Jan 16, 2018 02:50 PM IST']",['Moneycontrol.com'],Centrum initiates coverage on Aarti Drugs; target at Rs 940,['Market Edge'],"['The brokerage believes that good growth of existing products, new product launches and over 75% utilization are its positives.']","['Centrum has initiated coverage onAarti Drugswith a buy call and a target of Rs 940.The brokerage believes that good growth of existing products, new product launches and over 75% utilization are its positives.It sees a strong scope for rerating and expects it to perform well due to growth across geographics and economies of scale.It expects revenue/EBITDA/net profit to grow at a CAGR of 14%/15%/19% over FY17-20. It also sees the company benefitting from its presence over the entire pharma value chain.The company has outperformed peers’ due to its efficacious presence in the domestic and emerging markets, the report added.']"
