,Company,Source,Category,Date,Author,Title,Tags,Subtitle,Content
721954,3M INDIA,moneycontrol,Earnings,2015-06-01 15:04:00,['Moneycontrol.com'],3M India standalone Mar '15 sales at Rs 477.44 crore,"['3M India', 'Diversified', 'Results']","[""3M India has reported a sales total income from operations of Rs 477.44 crore and a net profit of Rs 41.63 crore for the quarter ended Mar '15""]","[""3M India has reported a standalone total income from operations of Rs 477.44 crore and a net profit of Rs 41.63 crore for the quarter ended Mar '15. Other income for the quarter was Rs 7.65 crore.For the quarter ended Mar 2014 the standalone total income from operations was Rs 438.55 crore and net profit was Rs 25.40 crore, and other income Rs 7.14 crore.3M India shares closed at 7,998.75 on May 29, 2015 (BSE) and has given 27.36% returns over the last 6 months and 90.44% over the last 12 months.3M IndiaStandalone Quarterly Results-------- in Rs. Cr. --------Mar '15Dec '14Mar '14Net Sales/Income from operations469.79435.08431.40Other Operating Income7.657.637.14Total Income From Operations477.44442.71438.55EXPENDITUREConsumption of Raw Materials173.71150.60170.27Purchase of Traded Goods101.47139.98109.05Increase/Decrease in Stocks1.00-18.12-8.69Power & Fuel------Employees Cost58.2266.1055.89Depreciation12.8612.2212.44Excise Duty------Admin. And Selling Expenses------R & D Expenses------Provisions And Contingencies------Exp. Capitalised------Other Expenses73.3668.8265.32P/L Before Other Inc. , Int., Excpt. Items & Tax56.8223.1034.27Other Income7.472.667.37P/L Before Int., Excpt. Items & Tax64.3025.7641.64Interest0.650.423.05P/L Before Exceptional Items & Tax63.6425.3438.59Exceptional Items------P/L Before Tax63.6425.3438.59Tax22.018.6913.18P/L After Tax from Ordinary Activities41.6316.6525.40Prior Year Adjustments------Extra Ordinary Items------Net Profit/(Loss) For the Period41.6316.6525.40Equity Share Capital11.2711.2711.27Reserves Excluding Revaluation Reserves------Equity Dividend Rate (%)------EPS Before Extra OrdinaryBasic EPS36.9614.7822.55Diluted EPS36.9614.7822.55EPS After Extra OrdinaryBasic EPS36.9614.7822.55Diluted EPS36.9614.7822.55Public Share HoldingNo Of Shares (Crores)0.280.280.28Share Holding (%)25.0025.0025.00Promoters and Promoter Group Shareholdinga) Pledged/Encumbered- Number of shares (Crores)------- Per. of shares (as a % of the total sh. of prom. and promoter group)------- Per. of shares (as a % of the total Share Cap. of the company)------b) Non-encumbered- Number of shares (Crores)0.840.840.84- Per. of shares (as a % of the total sh. of prom. and promoter group)100.00100.00100.00- Per. of shares (as a % of the total Share Cap. of the company)75.0075.0075.00Source :Dion Global Solutions Limited""]"
733533,3M INDIA,moneycontrol,Announcements,2015-03-27 22:37:00,['Moneycontrol.com'],3M India: Outcome of board meeting,['Announcements'],"['3M India has informed regarding Outcome of Board Meeting held on March 27, 2015.']","['3M India Ltd has informed BSE regarding Outcome of Board Meeting held on March 27, 2015.Source : BSERead all announcements in 3M IndiaRead More']"
755946,3M INDIA,moneycontrol,Earnings,2014-11-14 18:00:00,['Moneycontrol.com'],3M India standalone Sep '14 sales at Rs 457.53 crore,"['3M India', 'Diversified', 'Results']","[""3M India has reported a sales total income from operations of Rs 457.53 crore and a net profit of Rs 24.61 crore for the quarter ended Sep '14""]","[""3M India has reported a standalone total income from operations of Rs 457.53 crore and a net profit of Rs 24.61 crore for the quarter ended Sep '14. Other income for the quarter was Rs 9.02 crore.For the quarter ended Sep 2013 the standalone total income from operations was Rs 454.64 crore and net profit was Rs 1.56 crore, and other income Rs 8.19 crore.3M India shares closed at 6,506.10 on November 13, 2014 (BSE) and has given 68.70% returns over the last 6 months and 103.95% over the last 12 months.3M IndiaStandalone Quarterly Results-------- in Rs. Cr. --------Sep '14Jun '14Sep '13Net Sales/Income from operations448.51455.09446.45Other Operating Income9.027.538.19Total Income From Operations457.53462.62454.64EXPENDITUREConsumption of Raw Materials138.01146.61158.43Purchase of Traded Goods155.41132.22116.19Increase/Decrease in Stocks-16.661.9121.56Power & Fuel------Employees Cost59.9858.9561.90Depreciation12.3412.1812.06Excise Duty------Admin. And Selling Expenses------R & D Expenses------Provisions And Contingencies------Exp. Capitalised------Other Expenses72.8672.7580.34P/L Before Other Inc. , Int., Excpt. Items & Tax35.5838.004.14Other Income2.122.230.77P/L Before Int., Excpt. Items & Tax37.7040.234.92Interest0.491.873.65P/L Before Exceptional Items & Tax37.2138.371.27Exceptional Items------P/L Before Tax37.2138.371.27Tax12.6012.92-0.29P/L After Tax from Ordinary Activities24.6125.451.56Prior Year Adjustments------Extra Ordinary Items------Net Profit/(Loss) For the Period24.6125.451.56Equity Share Capital11.2711.2711.27Reserves Excluding Revaluation Reserves------Equity Dividend Rate (%)------EPS Before Extra OrdinaryBasic EPS21.8522.591.39Diluted EPS21.8522.591.39EPS After Extra OrdinaryBasic EPS21.8522.591.39Diluted EPS21.8522.591.39Public Share HoldingNo Of Shares (Crores)0.280.280.28Share Holding (%)25.0025.0025.00Promoters and Promoter Group Shareholdinga) Pledged/Encumbered- Number of shares (Crores)------- Per. of shares (as a % of the total sh. of prom. and promoter group)------- Per. of shares (as a % of the total Share Cap. of the company)------b) Non-encumbered- Number of shares (Crores)0.840.840.84- Per. of shares (as a % of the total sh. of prom. and promoter group)100.00100.00100.00- Per. of shares (as a % of the total Share Cap. of the company)75.0075.0075.00Source :Dion Global Solutions Limited""]"
766223,3M INDIA,moneycontrol,Earnings,2013-11-01 17:03:00,['Moneycontrol.com'],3M India standalone Sep '13 sales at Rs 454.64 crore,"['3M India', 'Diversified', 'Results']","[""3M India has reported a sales standalone turnover of Rs 454.64 crore and a net profit of Rs 1.56 crore for the quarter ended Sep '13""]","[""3M India has reported a standalone sales turnover of Rs 454.64 crore and a net profit of Rs 1.56 crore for the quarter ended Sep '13. Other income for the quarter was Rs 0.77 crore.For the quarter ended Sep 2012 the standalone sales turnover was Rs 383.10 crore and net profit was Rs 11.30 crore, and other income Rs 1.84 crore.3M India shares closed at 3,310.05 on October 31, 2013 (NSE) and has given -6.27% returns over the last 6 months and -13.70% over the last 12 months.3M IndiaStandalone Quarterly Results-------- in Rs. Cr. --------Sep '13Jun '13Mar '13Sales Turnover454.64421.37409.08Other Income0.771.475.90Total Income455.41422.84414.98Total Expenses438.43391.78373.58Operating Profit16.2129.5935.50Profit On Sale Of Assets------Profit On Sale Of Investments------Gain/Loss On Foreign Exchange------VRS Adjustment------Other Extraordinary Income/Expenses------Total Extraordinary Income/Expenses------Tax On Extraordinary Items------Net Extra Ordinary Income/Expenses------Gross Profit16.9831.0641.40Interest3.653.043.56PBDT13.3328.0137.84Depreciation12.0610.269.66Depreciation On Revaluation Of Assets------PBT1.2717.7528.18Tax-0.295.167.09Net Profit1.5612.5921.09Prior Years Income/Expenses------Depreciation for Previous Years Written Back/ Provided------Dividend------Dividend Tax------Dividend (%)------Earnings Per Share1.3911.1818.72Book Value------Equity11.2711.2711.27Reserves------Face Value10.0010.0010.00Source :Dion Global Solutions Limited""]"
766569,3M INDIA,moneycontrol,Announcements,2013-10-31 20:20:00,['Moneycontrol.com'],3M India: Outcome of board meeting,['Announcements'],"['3M India at its meeting held on October 31, 2013, has Confirmed the circular resolution dated October 04, 2013 pertaining to: (i) the appointment of Mr. Amit Laroya as Director and Managing Director of the Company for a period of 5(five) years from October 01, 2013.']","['3M India Ltd has informed BSE that the Board of Directors of the Company at its meeting held on October 31, 2013, has;1. Confirmed the circular resolution dated October 04, 2013 pertaining to: (i) the appointment of Mr. Amit Laroya as Director and Managing Director of the Company for a period of 5(five) years from October 01, 2013 (ii) accepted the resignation of Mr. Ajay Nanavati as Director and Managing Director with effect from October 01, 2013.2. Finalised the terms and conditions including remuneration of Mr. Amit Laroya, Managing Director of the Company.3. Reconstituted the Shareholders? / Investors? Grievance Committee of the Board by including Mr. Amit Laroya in place of Mr. Ajay Nanavati with effect from November 01, 2013.4. Accepted the resignation of Mrs. Sadhana Kaul as Director and Whole-time Director of the Company with effect from November 01, 2013 as she is being relocated to Singapore for taking up the responsibility as General Counsel for South East Asia Pacific Region.Source : BSERead all announcements in 3M India']"
779336,3M INDIA,moneycontrol,Announcements,2013-12-26 11:18:00,['Moneycontrol.com'],"3M India to close manufacturing operations at Ranjangaon plant, Pune from Dec 26 to Dec 31, 2013",['Announcements'],"[""3M India has informed that it is proposed to close the manufacturing operations at the Company's Ranjangaon Plant, Pune from December 26, 2013 to December 31, 2013 on account of planned maintenance activities to be undertaken.""]","['3M India Ltd has informed BSE that :""It is proposed to close the manufacturing operations at the Company\'s Ranjangaon Plant, Pune from December 26, 2013 to December 31, 2013 on account of planned maintenance activities to be undertaken"".Source : BSERead all announcements in 3M India']"
779537,3M INDIA,moneycontrol,Announcements,2013-12-24 12:00:00,['Moneycontrol.com'],"3M India to close manufacturing operations at its Electronic City Plant, Bangalore",['Announcements'],"[""3M India has proposed to close the manufacturing operations at the company's Electronic City Plant, Bangalore for two days on December 30, 2013 and December 31, 2013 on account of planned maintenance activities to be undertaken.""]","['3M India Ltd has informed BSE that :""It is proposed to close the manufacturing operations at the Company\'s Electronic City Plant, Bangalore for two (2) days on December 30, 2013 (Monday) and December 31, 2013 (Tuesday) on account of planned maintenance activities to be undertaken.""Source : BSERead all announcements in 3M India']"
779813,3M INDIA,moneycontrol,Announcements,2013-12-21 13:32:00,['Moneycontrol.com'],"3M India's trading window to remain closed from December 23, 2013 to February 11, 2014",['Announcements'],"['3M India has informed that the trading window will remain closed from December 23, 2013 to February 11, 2014 (both days inclusive).']","['3M India Ltd has informed BSE that :""In terms of our Company\'s Code of Conduct for the prevention of Insider Trading, the trading window will remain closed from December 23, 2013 to February 11, 2014 (both days inclusive).""Source : BSERead all announcements in 3M India']"
798447,3M INDIA,moneycontrol,Earnings,2014-02-12 17:37:00,['Moneycontrol.com'],3M India standalone Dec '13 sales at Rs 427.78 crore,"['3M India', 'Diversified', 'Results']","[""3M India has reported a sales standalone turnover of Rs 427.78 crore and a net profit of Rs 3.43 crore for the quarter ended Dec '13""]","[""3M India has reported a standalone sales turnover of Rs 427.78 crore and a net profit of Rs 3.43 crore for the quarter ended Dec '13. Other income for the quarter was Rs 10.33 crore.For the quarter ended Dec 2012 the standalone sales turnover was Rs 374.08 crore and net profit was Rs 3.17 crore, and other income Rs 0.34 crore.3M India shares closed at 3,699.00 on February 11, 2014 (NSE) and has given 9.23% returns over the last 6 months and -3.23% over the last 12 months.3M IndiaStandalone Quarterly Results-------- in Rs. Cr. --------Dec '13Sep '13Jun '13Sales Turnover427.78454.64421.37Other Income10.330.771.47Total Income438.12455.41422.84Total Expenses409.39438.43391.78Operating Profit18.3916.2129.59Profit On Sale Of Assets------Profit On Sale Of Investments------Gain/Loss On Foreign Exchange------VRS Adjustment------Other Extraordinary Income/Expenses------Total Extraordinary Income/Expenses------Tax On Extraordinary Items------Net Extra Ordinary Income/Expenses------Gross Profit28.7216.9831.06Interest4.433.653.04PBDT24.3013.3328.01Depreciation12.8412.0610.26Depreciation On Revaluation Of Assets------PBT11.461.2717.75Tax8.03-0.295.16Net Profit3.431.5612.59Prior Years Income/Expenses------Depreciation for Previous Years Written Back/ Provided------Dividend------Dividend Tax------Dividend (%)------Earnings Per Share3.051.3911.18Book Value------Equity11.2711.2711.27Reserves------Face Value10.0010.0010.00Source :Dion Global Solutions Limited""]"
799079,3M INDIA,moneycontrol,Announcements,2014-02-10 22:49:00,['Moneycontrol.com'],3M India's outcome of board meeting,['Announcements'],"['3M India Ltd has informed BSE that at the Board Meeting held on February 10, 2014, the Board Accepted the resignation of Mr. John R. Houle and Mr. Frank R. Little as Directors of the Company with effect from February 10, 2014.']","['3M India Ltd has informed BSE that at the Board Meeting held on February 10, 2014, the Board:1. Accepted the resignation of Mr. John R. Houle and Mr. Frank R. Little as Directors of the Company with effect from February 10, 2014.2. Appointed Mr. Ippo Vrohidis, Mrs. Sadhana Kaul and Mr. Ashish Khandpur as Directors of the Company with effect from February 10, 2014.Source : BSERead all announcements in 3M India']"
799113,3M INDIA,moneycontrol,Announcements,2014-02-10 21:59:00,['Moneycontrol.com'],3M India's outcome of board meeting,['Announcements'],"['3M India Ltd has informed BSE that at the Board Meeting held on February 10, 2014, the Board Accepted the resignation of Mr. John R. Houle and Mr. Frank R. Little as Directors of the Company with effect from February 10, 2014.']","['3M India Ltd has informed BSE that at the Board Meeting held on February 10, 2014, the Board:1. Accepted the resignation of Mr. John R. Houle and Mr. Frank R. Little as Directors of the Company with effect from February 10, 2014.2. Appointed Mr. Ippo Vrohidis, Mrs. Sadhana Kaul and Mr. Ashish Khandpur as Directors of the Company with effect from February 10, 2014.Source : BSERead all announcements in 3M India']"
811733,3M INDIA,IIFL,[],2017-05-20 11:52:00,['India Infoline News Ser'],"BSE Midcap weekly blockbusters: Adani Power, 3M India","['BSE Midcap', 'Adani Power', '3M India']","The Nifty50 closed marginally lower by 1 point or 0.02% at 9427 level, whereas the 30-share BSE Sensex closed at 30464 higher by 30 points or 0.1% on Friday.","['The Nifty50 closed marginally lower by 1 point or 0.02% at 9427 level, whereas the 30-share BSE Sensex closed at 30464 higher by 30 points or 0.1% on Friday.Benchmark index Nifty50 closed where it opened, having a rather disappointing session on Friday. The index formed a ?spinning top? on the daily chart and a ?Doji? on the weekly chart.Nifty was down by 0.18% and Sensex was down by 0.4% on a weekly basis.\xa0While the BSE Mid cap was down by 2.6% in the week ended on May 19.Company NameChange in % (May 15 to May19)Adani Power Ltd.6.933M India Ltd.4.15Ajanta Pharma Ltd.2.75Colgate-Palmolive (India) Ltd.2.06National Aluminium Company Ltd.1.73']"
822627,3M INDIA,IIFL,[],2016-01-01 09:38:00,['capital market '],3M India drops after dull Q2 financial performance,"['capital', 'market', 'Know more']","3M India lost 2.98% to Rs 11,809.70 at 09:45 IST after net profit rose 1.26% to Rs 48.21 crore on 9.25% increase in total income to Rs 576.74 crore in Q2 September 2016 over Q2 September 2015.","[""The result was announced after market hours on Friday, 18 November 2016.Meanwhile, the S&P BSE Sensex was down 55.89 points, or 0.21%, to 26,094.35On BSE, so far 52 shares were traded in the counter as against average daily volume of 270 shares in the past one quarter. The stock hit a high of Rs 11,910 and a low of Rs 11,640.30 so far during the day. The stock hit a record high of Rs 15,200 on 26 July 2016. The stock hit a 52-week low of Rs 9,405 on 27 January 2016.The large-cap company's equity capital is Rs 11.27 crore. Face value per share is Rs 10.3M India provides industrial, automotive, electrical, telecom and safety products.Powered byCapital Market - Live News""]"
828546,3M INDIA,IIFL,[],2016-08-05 09:41:00,['India Infoline News Servic'],3M India gains 3%,"['3M India', '3M India', 'Know more']",The company reported a 60.4% YoY growth in the net profit to Rs 59.70 crore for the quarter ended June.,"[""3M India Ltd stock was higher by 3% at Rs. 14100. The company reported a 60.4% YoY growth in the net profit to Rs 59.70 crore for the quarter ended June.The scrip opened at Rs. 13901 and has touched a high and low of Rs. 14300 and Rs. 13900 respectively. So far 1103(NSE+BSE) shares were traded on the counter. The current market cap of the company is Rs. 15403.95 crore.The BSE group 'B' stock of face value Rs. 10 has touched a 52 week high of Rs. 15200 on 26-Jul-2016 and a 52 week low of Rs. 9405 on 27-Jan-2016. Last one week high and low of the scrip stood at Rs. 14849.4 and Rs. 13400 respectively.The promoters holding in the company stood at 75 % while Institutions and Non-Institutions held 12.14 % and 12.86 % respectively.The stock is currently trading above its 50 DMA.""]"
836262,3M INDIA,IIFL,[],2016-05-27 14:15:00,['India Infoline News Ser'],3M India Q4 net profit at Rs.57.4 crore,"['3M India', 'Q4', 'stock market']",The total income was at Rs.552.1 crore as against Rs.477.4 Cr (YoY).,"[""3M India Q4 net profit stood at Rs.57.4 croreThe total income was at Rs.552.1 crore as against Rs.477.4 Cr (YoY).3M India Ltd is currently trading at Rs. 12898.95, down by Rs. 276.05 or 2.1% from its previous closing of Rs. 13175 on the BSE.The scrip opened at Rs. 13200 and has touched a high and low of Rs. 13329 and Rs. 12799 respectively. So far 5067(NSE+BSE) shares were traded on the counter. The current market cap of the company is Rs. 14848.23 crore.The BSE group 'B' stock of face value Rs. 10 has touched a 52 week high of Rs. 14400 on 20-Apr-2016 and a 52 week low of Rs. 7950 on 28-May-2015. Last one week high and low of the scrip stood at Rs. 13284.2 and Rs. 12602 respectively.The promoters holding in the company stood at 75 % while Institutions and Non-Institutions held 12.4 % and 12.6 % respectively.The stock is currently trading above its 50 DMA.""]"
840484,3M INDIA,IIFL,[],2016-04-20 18:14:00,['India Infoline News Servi'],"UltraTech Cement, 3M India among 37 stocks that hit 52-week high","['UltraTech Cement', '3M India', '52-week high']",The Nifty and Sensex managed to extend their winning streak to the sixth trading session amidst choppy trade.,"['3M India Limited, Alankit Limited, Atul Limited, Bannari Amman Sugars Limited, Biocon Limited, Capital First Limited, Cosmo Films Limited, Dalmia Bharat Limited, EID Parry India Limited, Electrotherm (India) Limited, Essel Propack Limited, Finolex Industries Limited, GIC Housing Finance Limited, Grasim Industries Limited, Havells India Limited, HeidelbergCement India Limited, JK Paper Limited JSW Steel Limited, Kakatiya Cement Sugar & Industries Limited, Keynote Corporate Services Limited, Lakshmi Energy and Foods Limited, Maithan Alloys Limited, Manappuram Finance Limited, Minda Corporation Limited, Next Mediaworks Limited, National Fertilizers Limited, The Ramco Cements Limited, Ruchira Papers Limited, Sagar Cements Limited, Supreme Petrochem Limited, Supreme Industries Limited, TPL Plastech Limited, TVS Motor Company Limited, The Ugar Sugar Works Limited, UltraTech Cement Limited, V.S.T Tillers Tractors Limited, Winsome Yarns were some of the prominent stocks to log a fresh 52-week high.The BSE Sensex ended with a gain of 27 points at 25,844. The BSE Sensex opened at 25,942 touched an intra-day high of 25,956 and low of 25,716.The NSE Nifty closed at 7,915. The NSE Nifty opened at 7,950 hitting a high of 7,950.40 and low of 7,877.The India VIX (Volatility) index was marginally up 0.75% to 17.0750.']"
841177,3M INDIA,IIFL,[],2016-04-12 18:47:00,['India Infoline News Servi'],"3M India, Ashok Leyland among 31 stocks that hit 52-week high","['3M India', 'Ashok Leyland', '52-week high']",The Indian equity market ended with smart gains on Tuesday extending its winning streak for the third consecutive trading session.,"['3M India Limited, Adi Finechem Limited, Ashok Leyland Limited, Bajaj Finance Limited, Balaji Amines Limited, Bannari Amman Sugars Limited, Biocon Limited, Bodal Chemicals Limited, Can Fin Homes Limited, Cholamandalam Investment and Finance Company Limited, Cosmo Films Limited, EID Parry India Limited, Electrotherm (India) Limited, Essel Propack Limited, Gujarat Narmada Valley Fertilizers and Chemicals Limited, Goa Carbon Limited, Grasim Industries Limited, Hero MotoCorp Limited, Hind Syntex Limited, Infibeam Incorporation Limited, ITD Cementation India Limited, JSW Steel Limited, Kakatiya Cement Sugar & Industries Limited, Kiri Industries Limited, Maithan Alloys Limited, Marico Limited, Meghmani Organics Limited, Minda Corporation Limited, Ruchira Papers Limited, V.S.T Tillers Tractors Limited, Winsome Yarns were some of the prominent stocks to log a fresh 52-week high.The BSE Sensex ended with a gain of 123 points at 25,145. The BSE Sensex opened at 25,056 touched an intra-day high of 25,180 and low of 24,996.The NSE Nifty closed with a gain of 38 points at 7,708. The NSE Nifty opened at 7,669 hitting a high of 7,717 and low of 7,663.The India VIX (Volatility) index was marginally up 0.07% to 16.0250.']"
843945,3M INDIA,IIFL,[],2016-03-19 11:56:00,['India Infoline News Servi'],Indian Oil inks agreement with 3M India,"['IndianOil', '3M India', 'IndianOil outlets']",IndianOil has signed an agreement with 3M India Ltd. for setting up 3M auto care centres at IndianOil outlets.,"['IndianOil has signed an agreement with 3M India Ltd. for setting up 3M auto care centres at IndianOil outlets.\xa03M is a US based multinational company in the top 100 of Fortune 500 list of companies and has a diversified range of products from adhesives & laminates to car and bike detailing services. In our relentless efforts to provide value added services to customers, the auto care centres will not only provide car/bike detailing services but would also sell vehicle care products such as sun films, polish, wax, car shampoo, treatment for the exterior, interior and under- chassis rust protection, amongst other products and services.The auto care centres will be operated by the franchisee appointed by 3M India Ltd and they have a plan to establish 25 such centres during 2016-17 on pan India basis. This partnership is a significant step in further improving vehicle care facilities/services at our ROs and the brand synergy of these two Fortune 100 companies will definitely help in winning the loyalty of existing clientele and fetching new customers.']"
850531,3M INDIA,IIFL,[],2016-02-08 16:17:00,['India Infoline News Service '],3M India gallops 13.5% after blockbuster Q3 numbers,"['3M India', 'upper limit', 'BSE']",The company's net sales for the quarter under review surged 17% to Rs. 517.64 crore from Rs. 442.71 crore reported for the same period a year ago.,"[""3M India galloped 13.5% to Rs.11,493 on BSE. The company reported a 240% year-on-year jump in Q3 profit at Rs. 56.61 crore compared with Rs. 16.65 crore reported for the same period a year ago.\xa0 The company's net sales for the quarter under review surged 17% to Rs. 517.64 crore from Rs. 442.71 crore reported for the same period a year ago.The scrip opened at Rs. 10700 and has touched a high and low of Rs. 12154.65 and Rs. 10700 respectively. So far 26272(NSE+BSE) shares were traded on the counter. The current market cap of the company is Rs. 11415.27 crore.The BSE group 'B' stock of face value Rs. 10 has touched a 52 week high of Rs. 12899 on 29-Sep-2015 and a 52 week low of Rs. 6499 on 10-Feb-2015. Last one week high and low of the scrip stood at Rs. 10200 and Rs. 9686.65 respectively.The promoters holding in the company stood at 75 % while Institutions and Non-Institutions held 12.54 % and 12.46 % respectively.The stock is currently trading below its 100 DMA.""]"
850611,3M INDIA,IIFL,[],2016-02-08 11:43:00,['India Infoline News Service '],3M India skyrockets 17% upper limit,"['3M India', 'upper limit', 'BSE']",The company's net sales for the quarter under review surged 17% to Rs. 517.64 crore from Rs. 442.71 crore reported for the same period a year ago.,"[""3M India has skyrocketed 17% on BSE. The company reported a 240% year-on-year jump in Q3 profit at Rs. 56.61 crore compared with Rs. 16.65 crore reported for the same period a year ago.\xa0 The company's net sales for the quarter under review surged 17% to Rs. 517.64 crore from Rs. 442.71 crore reported for the same period a year ago.The scrip opened at Rs. 10700 and has touched a high and low of Rs. 12154.65 and Rs. 10700 respectively. So far 22990(NSE+BSE) shares were traded on the counter. The current market cap of the company is Rs. 11415.27 crore.The BSE group 'B' stock of face value Rs. 10 has touched a 52 week high of Rs. 12899 on 29-Sep-2015 and a 52 week low of Rs. 6499 on 10-Feb-2015. Last one week high and low of the scrip stood at Rs. 10200 and Rs. 9686.65 respectively.The promoters holding in the company stood at 75 % while Institutions and Non-Institutions held 12.54 % and 12.46 % respectively.The stock is currently trading below its 100 DMA.""]"
