,Company,Source,Category,Date,Author,Title,Tags,Subtitle,Content
865397,3M INDIA,IIFL,[],2015-09-29 14:22:00,['India Infoline News Service |'],"3M India, Arvind Infra and 23 other stocks hit all time high","['3M India', 'Arvind Infra', 'bse']","Stock of 3M India touched the all time high of Rs. 12,899, Aarti Ind, Arvind Infra, Can Fin Home, Paul Merchant.","['Following the reduction of 50 bps in benchmark interest rate by the RBI today, as many as 25 stocks have hit all time high on BSE.Stock of 3M India touched the all time high of Rs. 12,899, Aarti Ind (Rs. 524.95), Arvind Infra (Rs. 63.80), Can Fin Home (Rs. 904.40), Paul Merchant Ltd (Rs. 5,063.50, Dynacom Tech (Rs. 15.01), Enbee Trade (Ra. 37), ETT Ltd (Rs. 37), FCS Software (Rs. 0.42), GM Brewery (Rs. 486.70), Kesar Petro (Rs. 397.50), Kumar Wire (Rs. 30.80), Mercury Lab (Rs. 365.50), Meenakshee Enterprise (Rs. 245.90), Pact Ind (Rs. 11.10), Panchmahal Steel (Rs. 63.40), Parnani Credits (Rs. 7.78), SAR Auto (Rs. 221), Pradeept Metals (Rs. 76.50), Synergy Biocon (Rs. 157.10), Shivalik Rasayan (Rs. 73.90), Snul Healthcare (Rs. 85.55), Swaraj Automotive (Rs. 14.45) and Waterbase Ind hit an all time high of Rs. 127.30.Meanwhile, the BSE Sensex is up 416 points at 26,033.']"
870827,3M INDIA,IIFL,[],2015-08-06 16:37:00,['India Infoline News Servic'],3M India gains 6% on stellar performance,"['3M India', 'Q1 results', 'Stocks']",The company reported more-than 55 percent surge in Q1 net at Rs. 39.50 crore for the quarter ended June 2015 on a year-on-year basis.,"['3M Indiagained another 5.8 percent to a fresh all-time high at Rs. 10,504 on the back of stellar Q1 performance.The company reported more-than 55 percent surge in Q1 net at Rs. 39.50 crore for the quarter ended June 2015 on a year-on-year basis.The stock has soared over 18% in the last three trading sessions and skyrocketed by as much as 31 percent in the last seven straight trading sessions.Stock Price:The stock of the company closed at Rs. 10433.10. The stock closed up 5.03% from its previous close which was at Rs. 9933.10. It hit a high at Rs. 10758.70 and low at Rs. 10000. The total traded quantity was 3724 and low at Rs. 1669.']"
870848,3M INDIA,IIFL,[],2015-08-06 16:02:00,['India Infoline News Servic'],"3M India, Cummins, 90 other scrips hit all time high","['3M India', 'Abbott India', 'Aditya Birla Nuvo']","The BSE benchmark index, the Sensex, opened 69-odd points higher at 28,292, and then gyrated between zones in thin range till mid-noon deals, wherein the BSE index touched a low of 28,164. A fresh bout of buying, mainly in banking shares and Larsen & Toubro, in the latter half of the day saw the BSE index advance to a high of 28,360 - up almost 200 points from the day's low.","[""3M India, Abbott India, Aditya Birla Nuvo, Adani Transmission, Alstom India, Allsec Technologies, Aurobindo Pharma, Balaji Telefilms, Bhartiya International, Century Enka, Cummins India, Dabur India, Deep Industries, Dish TV India, Divi's Laboratories, Dr. Reddy's Laboratories, Elecon Engineering Company, FDC, Gayatri Projects, GM Breweries, Grindwell Norton, Indiabulls Housing Finance, Indo Count Industries, Indraprastha Gas, Ind-Swift Laboratories, ITD Cementation India, JMT Auto, Jubilant Life Sciences, Kalpataru Power Transmission, Kirloskar Industries, LIC Housing Finance, Madhucon Projects, Marksans Pharma, Motherson Sumi Systems, Nahar PolyFilms, NBCC, Neuland Laboratories, Nitesh Estates, Nitin Spinners, Omaxe, Pfizer, Ramco Industries, Repco Home Finance, Rushil Decor, The Sandesh, Sangam (India), Siemens, Standard Industries, Siyaram Silk Mills, SMS Pharmaceuticals, Sundaram Clayton, Sutlej Textiles and Industries, Tube Investments of India, TVS Electronics, Visaka Industries, Vishnu Chemicals, Vardhman Textiles, Welspun Enterprises, Wendt (India) and Zen Technologies were some of the prominent stocks to register a fresh 52-week high today.The BSE benchmark index, the Sensex, opened 69-odd points higher at 28,292, and then gyrated between zones in thin range till mid-noon deals, wherein the BSE index touched a low of 28,164. A fresh bout of buying, mainly in banking shares and Larsen & Toubro, in the latter half of the day saw the BSE index advance to a high of 28,360 - up almost 200 points from the day's low.The Sensex finally ended with a gain of 75 points at 28,298.The NSE Nifty jumped above the 8,600-level to touch a high of 8,606 towards the end of the trading session. The Nifty eventually settled with a marginal gain of 21 points at 8,589.The India VIX (Volatility) index added 0.4 percent to 14.73.""]"
870862,3M INDIA,IIFL,[],2015-08-06 14:26:00,['India Infoline News Servic'],"3M India extends winning run, at new summit","['3M India', 'BSE', 'NSE']",The company reported more-than 55 percent surge in Q1 net at Rs. 39.50 crore for the quarter ended June 2015 on a year-on-year basis on 3 August after the market hours.,"['3M Indiacontinues to trade on a gung-ho note on the back of stellar Q1 results.The company reported more-than 55 percent surge in Q1 net at Rs. 39.50 crore for the quarter ended June 2015 on a year-on-year basis on 3 August after the market hours. Total income too was up over 12 percent at Rs. 518.59 crore from Rs. 462.62 crore.Post which, the stock has skyrocketed over 18 percent to touch a new summit at Rs. 10,759 in trades today. The stock is now up 4.5 percent at Rs. 10,388. The counter has seen trades of around 2,900-odd shares as against the two-week daily average volume of around 1,669 shares on the BSE.The stock has been in an uptrend for the last seven trading sessions, and has appreciated by nearly 31 percent in the same period.Meanwhile, the Sensex is trading at 28,333 - up 110 points.']"
871310,3M INDIA,IIFL,[],2015-08-03 17:20:00,['India Infoline News Servic'],3M India Q1 net profit at Rs. 39.5 crore,"['3M India', 'Q1', 'Earnings']",The total income was at Rs. 518.6 Crore,"['3M IndiaLtd has posted results for the first quarter ended 30th June, 2015.The net profit for the quarter was at Rs. 39.5 crore.The total income was at Rs. 518.6 Crore']"
875161,3M INDIA,IIFL,[],2015-06-26 17:05:00,['India Infoline News Serv'],3M India partners with CII to launch the Young Innovators Challenge Awards 2015,"['3M india', 'CII', 'Young Innovators Challenge Awards']","3M India, the Indian subsidiary of US multinational conglomerate 3M Co., announced the launch of the second edition of the Young Innovators Challenge Awards 2015 in association with CII.","['3M India, the Indian subsidiary of US multinational conglomerate 3M Co., announced the launch of the second edition of the Young Innovators Challenge Awards 2015 in association with CII. The platform aims to support and encourage young technical innovators between the age of 18 ? 30, across India to come up with inspiring and innovative ideas witha social relevance. Themes from which they could choose:-\xa0\xa0\xa0\xa0\xa0\xa0 Productivity: Innovations that improve output or affordability-\xa0\xa0\xa0\xa0\xa0\xa0 Sustainability: Innovations that leave a positive ecological and environmental impact-\xa0\xa0\xa0\xa0\xa0\xa0 Disruptive: Innovations that represent breakthrough technology or help create a totally new market or way to deliver the impactSpeaking on the occasion, Mr. Amit Laroya, Managing Director, 3M India said, ?Innovative thinking forms an integral part of the 3M culture. Through this initiative we believe we are taking this belief a notch higher. 3M is looking to promote and invest in young ideas and talent to develop not only socially responsible innovations but ideas which could be prototyped with the capability to address social good at large?.?3M-CII Young Innovators Challenge gives an opportunity for youth across India to showcase their innovations and getrecognized. This recognition allows winners to get additional funding and scale up their innovations,? said Mr. Kris Gopalakrishnan, Past President, CII and Chairman, India Innovation Summit & Co-Founder, Infosys Limited.The 10 best ideas will be invited for a pitch session on 23-24 July, based on which a reputed jury will choose 3 winningentries. The winners will then be felicitated at the 11th India Innovation Summit 2015, organized by CII in Bangalore on 6th ? 7th August, where they will be given an opportunity to present their winning projects. The winners will also receivegrants (up to Rs, 2, 00, 000) from 3M India to prototype theiridea.']"
889302,3M INDIA,IIFL,[],2015-02-23 14:16:00,['India Infoline News Service '],M3M India launches M3M Latitude,"['M3M', 'M3M Latitude', 'UHA London']",M3M Latitude offers you your dream home with unmatched location and exhilarating views.,"['M3M India, a leading ultra-luxury real estate developer recently launched M3M Latitude, the new signature residential tower reaching a height of over 160 meters, carefully-designed to celebrate ??Sky Living??. Built by UHA London and situated at a prime location of Sector 65, Gurgaon, the project rises in the shape of a single tower that is designed to offer exclusivity by creating a clutter free aura for its residents. The 42 storied tower houses exquisite features like Express Lifts, Roof-top Club & Lounge and 4 to a core layout that offers privacy, breath-taking bird??s eye view and elements of modern comfort.The magnificent premises promise its guests an opulent and splendorous greeting at the Grand Entrance lobby and vehicular drop off with its dramatically cascading water lily ponds. Built on the ??Eagle Soaring?? roof design architectural philosophy, the towering height of the structure is enhanced by robust vertical cladding lines topped by a dramatic cantilevered roof that soars above the tower like an eagle??s wings.Pankaj Bansal, Director-M3M Indiasaid,??The launch of M3M Latitude is a testament to the fact that we are pulling all stops to provide our patrons with the best-in-class homes. As quality, timely delivery and excellence are in our DNA, we strive to offer our customers with state-of-the-art real estate masterpieces with distinguished features and multi-dimensional realty solutions. M3M Latitude is built on the same lines.??The M3M Latitude tower can be reached directly from Golf Course Extension Road that is in close proximity to the sprawling 75 acre M3M Golf Estate. The feature of underground parking provides ample green space at the ground level. The apartments are limited to four per lift lobby and each apartment occupies a corner of the tower benefitting from double aspect 180 degree views.\xa0 The glazing from floor to ceiling enables the natural daylight to seep inside, giving you mesmerizing views. The generous balconies provide the apartment with outdoor living space, giving natural shading to the apartment below, which helps in minimizing solar heat.Lush landscaping and shaded outdoor lounge areas effectively screen the pool deck from the drop-off, whilst hinting at the luxury within. The exclusive Skyclub at levels 42 and 43 is perfect to delve into the spell-binding sights of Gurgaon. The club includes gym, spa, paddle pool, event space, screening room, and Observation Deck with PV array. Offering close proximity to DPS International, Medanta, Fortis, Airport, NH-8 and Delhi, M3M Latitude is investor as well as end-user friendly.Gift yourself a new home this year and get immersed in the realm of fascinating luxury and fine living at the M3M Latitude.']"
891851,3M INDIA,IIFL,[],2015-01-30 09:04:00,['India Infoline News Service'],3M India Q3 PAT at Rs. 16.6 crore,"['3M India', 'Q3', 'Earnings']",3M India Q3 sales Rs.435 cr vs Rs.417 cr YoY.,"['3M India Ltd has announced the following results for the quarter ended December 31, 2014:3M India Q3 PAT Rs.16.6 crore vs Rs.3.4 crore YoY.3M India Q3 sales Rs.435 cr vs Rs.417 cr YoY.']"
893965,3M INDIA,IIFL,[],,[''],M3M India Accelerates Land Acquisition from Sahara Group with an Advance Fund of Rs 300 crore,"['Business/ Finance', 'Advertising', 'PR & marketing']",M3M India Accelerates Land Acquisition from Sahara Group with an Advance Fund of Rs 300 crore,"[""Business Wire IndiaM3M India, a leading ultra-luxury real estate developer has made the unprecedented move of paying a whopping Rs 300 crore in advance to Sahara Group in order to close the deal of Rs 1221 crore on a premium land parcel in Gurgaon. The move shows the real estate giant??s earnest desire to develop the land into a Smart City within a short span of time. This demonstrates M3M??s confidence and desire to obtain and go-ahead with the development.M3M India, one of India??s reputed real estate developers has made this investment following the land transaction worth Rs.1221 crore that it had sealed with Sahara Group for 185 acres of land in Delhi NCR region. This land is to be utilized for the development of branded residencies, branded service apartments, multiplexes, hotels, offices, entertainment centers and other smart city features.Mr. Pankaj Bansal, Director-M3M India said, ??Every deal we enter into is a matter of great importance for us. We are eager to close the deal with Sahara Group so that we can kick start the developmental work of the Gurgaon land; hence we opted to make the advance payment. This is a testament to the fact that we are constantly endeavoring to make remarkable contributions to the real-estate industry and construct uber-smart cities for our patrons.??Going by the deal, M3M India was supposed to pay only Rs 150 crore but ended up paying another tranche of Rs 300 crore to shorten the time to conclude the deal. Contrary to the lukewarm position of most real estate players in the market today, M3M India is launching into new deals and leaving no stone unturned to transform the fate of the property landscape of the country.About M3M GroupM3M Group is one of India's premiere business conglomerates with interests in Real Estate (Residential / Commercial / Retail), Hospitality, Education and IT / SEZs. The land bank exceeds 2000 acres of prime land with 11 million sq. ft. of built up space. The organization has already invested over US $ 500 million in developing many iconic projects in North India. The projected business value of the organization exceeds US $ 5 billion.M3M has embarked upon 39 projects in Haryana. M3M Golf Estate, the 75 acre uber luxury resort-like residential complex is an example of it venture. This project has won many accolades and awards the world over at Dubai, London and San Francisco. Recently it won the award for the Best Luxury Project in India from NAREDCO, a Govt. of India patronized organization. The group is known for its philanthropist activities in uplifting the weaker sections of our society. M3M is also known to back healthy and clean living by promoting sports and games for the youth. The recent Polo tournaments were sponsored by the company.M3M is an ardent supporter of all government initiatives. The company directors were part of the recent business delegation to Japan along with the PM and also accompanied the President of India, His Excellency Shri Pranab Mukherjee, to Finland and Norway.""]"
899375,3M INDIA,IIFL,[],2014-11-14 11:19:00,['India Infoline News Service '],3M India at new all-time high on strong Q2,"['3M India', 'BSE', 'NSE']",The stock has rallied nearly 5 per cent in trade today.,"['3M India has rallied nearly 5 per cent to register a fresh all-time high at Rs 6,822 this morning on the back of sharp jump in Q2 net profit.The company reported a solid 57.4 per cent jump in Q2 net profit for the quarter ended September 2014 when compared with Rs 15.64 crore in the corresponding quarter a year ago. Total income was up 0.6 per cent at Rs 457.53 crore from Rs 454.64 crore.The stock continues to trade on a buoyant note, and is now up 4 per cent at Rs 6,764.The counter has seen trades of around 1,215-odd shares as against the two-week daily average volume of around 256-odd shares on the BSE.Meanwhile, the Sensex is now up 75 points at 28,015.']"
902611,3M INDIA,IIFL,[],2014-10-09 09:27:00,['India Infoline News Service'],M3M India partners with Miele International for its ultra-luxury project,"['M3M India', 'Miele International', 'ultra-luxury project']",Recently M3M Golf Estate baggs the Best Luxury Group Housing Project Award from NAREDCO.,"[""M3M India, a leading ultra-luxury real estate developer, today announced their business partnership with Miele, Germany??s premium manufacturer of high-end domestic built-in Kitchen appliances and commercial equipment. \xa0Redefining your living experience, this association is exclusively for M3M India??s ultra-luxury project ??M3M Golf Estate?? for which it also bagged the Best Luxury Group Housing Project Award recently from NAREDCO.As a result of this tie-up between the two leading brands in the infrastructure and lifestyle space, each M3M Golf Estate apartment will be equipped with a combination of four Miele branded built-in kitchen appliances namely Gas Hob, Hood, Microwave and a dishwasher. A total of 3,000 magnificent apartments will be furnished with about 12,000 state-of the-art appliances making them an epitome of true modern aesthetics and style.Pankaj Bansal, Director-M3M India said, ??The partnership with Miele Germany is a testament to the fact that we are committed to provide our patrons with quality, excellence and best-in-class real estate masterpieces. To satisfy the ever-evolving lifestyle aspirations of our highly discerning customers, we always strive to ensure unparalleled innovations and superlative quality.??Dr. Reinhard Christian Zinkann, the proud co-owner and managing director of Miele (Great Grandson of the Co-Founder??s Family) on the occasion of signing up of Miele??s first project association in India with M3M India Pvt. Ltd. said, ??With M3M we look forward to a prolific and brighter relationship paving way for happy customers. I have always had faith in India and its taste for style and luxury. I am elated with the response India has given us since our inception in the country and this association stands as testimony. For past 115 years Miele is known not only for its excellent masterworks and novelties, but also because it pledges to stay by you as a passion.??The Golf Estate project is M3M India??s flagship residential project. Located on the premium Golf Course Extn. Road in Gurgaon and spread over an enormous area of 30.35 hectares (75 acres), the project is built around a 9-hole ??In City?? executive golf course.Perfectly engineered with sprawling eco-friendly green landscapes and cutting-edge design, the project also offers a large Ultra Luxury club, fully integrated with art gallery, spa centre, library, gym, tennis court, and other recreational areas. Its roof-top jogging track, gardens and dining area at the pool side make M3M Golf Estate a truly classy abode. The project is designed by the world's leading Architectural firm ?? Le Group Arcop Canada.""]"
902660,3M INDIA,IIFL,[],2014-10-08 16:44:00,['India Infoline News Service'],"Trivia: Samsung, Sony, Jitnedra Singh and M3M India etc.","['Samsung', 'Sony', 'LG']","Union Science and Technology Minister, Jitnedra Singh, has launched the ingenious broad spectrum confocal microscope that generates 3D images of objects.","['Samsung, Sony and LG have stopped fresh supply of sale to the India??s biggest e-commerce retailer due to low prices being offered on the Big Billion day and are also considering legal action for what they term as ????predatory pricing????Rs. 250 crore has been issued by Central government as equity contribution for construction of Delhi Metro Rail Corporation (DMRC) Phase III project.Union Science and Technology Minister, Jitnedra Singh, has launched the ingenious broad spectrum confocal microscope that generates 3D images of objects.CEO Prasar Bharti has announced that it is setting deadlines to telecast programmes in Europe and Middle East.Realty firm M3M India has awarded a contract worth Rs. 133 crore to Germany-based Miele for supply of kitchen appliances for M3M??s luxury housing project in Gurgaon.To tap Indian Defense Market, Communication and aviation electronic solutions firm Rockwell Collins has signed a MoU with Hyderabad-based Zen Technologies.Stagnant Demand has forced steel producers to reduce prices by Rs. 500-750 a tonne providing some relief to end-use sectors.After a gap of 10 years, India??s recruitment sector is back to venture capital investors. The latest being Matrix Partners India which has decided to invest an undisclosed amount in GrownOut.The world??s largest cycle manufacturer in volume, Hero Cycles, has called off its proposed acquisition of Germany??s leading Cycle maker Mitteldeutsche Fahrradwerke AG (MIFA) due to non-fulfillment of a clause in the agreement.Canara Bank donates an amount of Rs. 5.67 crore to Prime Minister??s relief fund for rescue and relief operations in Flood ravaged Jammu & Kashmir.']"
906690,3M INDIA,IIFL,[],2014-09-01 10:39:00,['India Infoline News Service |'],3M India culminates 3rd edition of its Scotch 'Dikhao Apna Magic' craft contest,"['3M India Limited', 'Know more', 'Click here']","This edition witnessed a combined participation from 60 leading schools across Bangalore and Chennai, a significant increase from last year","['3M India Limited, the name behind innovative products like Scotch Magic Tape and Post-it Notes, culminated the third edition of its Scotch ??Dikhao Apna Magic?? Craft Contest on a grand note. The annual contest that was initiated in 2012 in Bangalore to encourage, celebrate and reward the creativity of young minds was introduced in Chennai for the first time to further its reach and give opportunity for more students to showcase their talent. This edition witnessed a combined participation from 60 leading schools across Bangalore and Chennai, a significant increase from last year. The top three winners across categories from each city were felicitated by Rob, celebrity anchor of popular children??s shows.In addition to the felicitation, Rob also kept the audience comprising of children, parents and teachers engaged through an interactive, fun-filled and creative workshop. Utilizing 3M??s Scotch and Post-it range like Purple Glue Stick, White Glue Stick, Magic? Tape, Transparent Tape, Double Sided Foam Tape, re-positionable Post-it Notes and Flags, the children were taken on an exciting creative journey under Rob??s guidance.While preparations for the contest began as early as June, 2014 through direct school contact programmes in Bangalore, 3M took a step further and introduced online submission page as part of their portal MyActivityRoom.com, an online resource for activity-based learning, making it convenient for children across all schools to participate. This helped in reaching out to more students from class I-VII across schools in both cities.\xa0 The online submissions were then hand -picked by a panel of experts who shared the shortlisted entries with Rob for the final judgment.From Chennai, Master Ratissh M of Chennai Public School emerged as the winner in the Junior Category, while Miss Bhagyalakshmi and Miss R Harini from Vidyodaya Girls Higher Secondary School won in the Intermediate & Senior Categories respectively.??We are very impressed with ingenuity displayed by such young children,?? saidAmit Laroya, Managing Director, 3M India Ltd,??I am amazed by how our 3M products have been used by these creative young minds to create such fun-filled and innovative crafts,?? he added.D. S. Sachdeva, Executive Director - Consumer Business Group, 3M India Ltdsaid, ??We were amazed at the participation we saw from students from Bangalore and Chennai. Given this is our third consecutive success in executing such a large format event, we hope to make the contest bigger and better every year enabling more children to push their boundaries of creative thought and expression.????The overwhelming response to Scotch ??Dikhao Apna Magic?? Craft Contest from both Bangalore and Chennai, was made possible thanks to the great effort of our stationery team and the wholehearted support of our partner schools, teachers and parents. Current year??s learning on Digital Activation will stand us in good stead for expanding to all major metros in coming years?? addedSibi Sekhar, Division Manager ?? Stationery & Office Supplies Division, 3M India Ltd']"
