Unnamed,Source,Category,Date,Author,Title,Tags,Subtitle,Content
0,livemint,Politics,02-07-2018 09:38,Isis Almeida,Indian exports threaten white sugar?s premium as crops recover,"['Sugar', 'Sugar export', 'Indian exports', 'Crops', 'Sugar traders']","The sales by India, which produces mostly white sugar, could further weigh on the premium that white sugar commands over raw","['London:India might soon become even more important to the world?s sugar traders.', 'The world?s second-biggest producer is threatening to resume exports as output recovers. The sales by India, which produces mostly white sugar, could further weigh on the premium that white sugar commands over raw.', 'The premium has halved from a peak last year and is now below a level that many refiners globally need to turn a profit. The gap narrowed as the European Union removed output curbs, flooding the market with refined sugar, which accounts for most of the expected surplus this season and the next. The glut has also seen sugar futures slide about 35% in the past year.', '?If you get through the summer, the monsoon is good out there and the market expects a significant export program out of India next year?which is very likely?that would be the nail in the coffin of anyone who wants to see the white premium rally,? said Philip Ryan, sugar trading product line director at Bunge Ltd, one of the world?s top crop merchants.', 'India has been absent from the world market since 2015-16 after an El Nino-induced drought slashed its crop. With output recovering, millers want the government to scrap an export duty so they can ship at least 1 million metric tonnes in 2017-18 so they don?t start next season with too much inventory, said Abinash Verma, director general of the Indian Sugar Mills Association.', 'Better crop', 'Indian output this season is turning out better than thought amid higher yields in some states, Verma said in an interview in Dubai. ISMA expects a crop of 26.1 million tonnes, but Olam International Ltd says the figure could be bigger and trader ED&F Man Holdings Ltd has raised its forecast to 27 million tonnes.', 'Good rains and reservoir levels mean next season?s production could be even bigger, leaving a domestic surplus, Verma said.', '?If next year turns out to be a very big crop, we don?t want to start with too big a surplus because exporting a huge surplus would be too big of a challenge,? he said.', 'While India should have excess supplies to export this season, it will depend on government measures given low world market prices, said Kona Haque, head of research at ED&F Man. Also, there may be less reason to help millers export because the country started the season with low stockpiles. While inventories will rise, they won?t be much more significant than in previous years, said Chris Thompson, a senior vice president at Olam, which owns mills in India.', 'The white sugar premium is now less than $60 a tonne, down from a high of $115 last year. A good rainy season in India could increase output and bring even more pain.', '?You could argue that the market could trade a relatively low white premium if you get a decent monsoon,? Bunge?s Ryan said.Bloomberg']"
0,livemint,Politics,02-07-2018 01:30,Gireesh Chandra Prasad,Govt: 10 million notices sent to investors in cryptocurrencies,"['cryptocurrency investors', 'investment in cryptocurrencies', 'GST', 'GST filing', 'tax evasion']","Traders paying GST on a quarterly basis under a concessional flat rate scheme and investors in cryptocurrencies are suspected of tax evasion, say finance ministry officials","['New Delhi:Traders paying goods and services tax (GST) on a quarterly basis under a concessional flat rate scheme and investors in cryptocurrencies are suspected of tax evasion, finance ministry officials said on Tuesday.', 'Finance secretary Hasmukh Adhia said at an industry meet that of the one million businesses that signed up for the GST composition scheme during the July-September period, about seven lakh filed GST returns for the quarter. Of the seven lakh assessees, five lakh filed returns for the quarter showing annual turnover of less than Rs5 lakh.', '?Now we are wondering why did they register then? Up to Rs2 million (annual turnover) there is no need to register in GST,? Adhia said.', 'At a separate event, Central Board of Direct Taxes (CBDT) chairman Sushil Chandra said nearly 10 million notices have been sent to people who have invested in cryptocurrencies like bitcoin and have not declared it in their income tax returns.', '?People who have made investments (in cryptocurrency) and have not declared income while filing taxes and have not paid tax on the profit earned by investing, we are sending them notices as we feel that it is all taxable,? Chandra was quoted as saying in a statement issued by industry lobby Associated Chambers of Commerce & Industry of India (Assocham).', 'Chandra said surveys have been done on cryptocurrency exchanges to find out how many people were regular contributors, how many had registered themselves and how many traded on these platforms.', 'He said that the department had found that there was no clarity on investments made by many people, which implied they had not declared them.', '?As per income tax laws, whatever money one is investing (in cryptocurrency), it would be taxable if it is unexplained. Besides, even the profit gained on the same is taxable,? he said.']"
0,livemint,Politics,02-07-2018 01:27,Soumonty Kanungo,"Yashwant Sinha slams Union Budget, calls it election manifesto","['Yashwant Sinha', 'Union Budget', 'Arun jaitley', 'election manifesto', 'farm income']","Yashwant Sinha slams the Union Budget, saying the government had made promises in the style of an election manifesto without creating provisions for achieving them","['Kolkata:Former union finance minister Yashwant Sinha on Tuesday slammed the Union Budget, saying the government had made promises in the style of an election manifesto without creating provisions for achieving them.', 'It is not clear from the budget documents how the government will provide for various targets and programmes, Sinha said in Kolkata.', 'Whereas the government has committed to double agricultural income by 2022, farm income has over the past four years declined by 1.38%, the rebel BJP leader said.']"
0,livemint,Politics,02-07-2018 01:25,Sachin P. Mampatta,What does tax data say about long-term capital gains?,"['Long-term capital gains', 'long-term capital gains tax', 'LTCG tax on shares', 'tax on equities', 'stock market crash']","Individuals and companies account for the bulk of long-term capital gains declared, shows a ?Mint? analysis of income tax data","['Mumbai:Many have attributed the fall in the stock market after the Union budget to the introduction of the 10% long-term capital gains tax on shares. Who exactly might be the most affected by its introduction?', 'An analysis of income-tax (I-T) data shows that individuals and companies declare the highest proportion of long-term capital gains. Individuals accounted for the highest proportion of long-term gains declared in two out of the four years for which income tax numbers are available. Companies come out on top for the other two years.', 'Companies accounted for 49.19% of long-term capital gains in the latest year available which is financial year 2014-15 (corresponding to assessment year 2015-16). Individuals accounted for 43.92% in the same year.', '', 'In terms of number, a disproportionate number of those declaring long-term capital gains are also individuals, according to income tax statistics thatMintanalysed. They account for 90% of the total number of entities who mention long-term capital gains in their income tax returns. Other categories such as company, Hindu undivided family, firm, association of persons (AOP) or a body of individuals (BOI) and others account for the remaining. Less than 1% of the tax returns filed mention long-term capital gains across the years.', 'The caveat to this is that the data includes all kinds of long-term capital gains: transactions on property, bullion and others. The government has not released more granular data. It would be interesting to see if the trend is significantly different if one considers long-term capital gains on only listed securities. Individuals, for example, have a significant proportion of their savings in physical assets like real estate and gold.', 'Even if individuals have to bear a significant portion of the new capital gains tax, it is no reason why it should not be imposed in India. In fact, it has been observed that India has an especially liberal taxation policy on capital gains after long-term gains were made tax-free in the 2004 budget.', '?The paper finds that capital gains tax on securities is very liberal in India... Distinction between capital gains on the basis of holding period and exemption of long-term capital gains, coupled with a low flat tax rate of 15% on short-term capital gains, is resulting in severe revenue implications for the exchequer in India,? said a May 2016 paper entitledRevisiting Capital Gains Tax on Securities in India,authored by Prashant Prakash, Jaya Kumari Pandey and Abhishek K. Chintu, published in theEconomic & Political Weekly.', 'The paper referenced a method to calculate long-term capital gains tax (Amaresh Bagchi?s paperRethinking Tax Treatment of Capital Gains from Securities,published in 2007). It used regulatory data about the value of delivery-based transactions during a given year to calculate the amount of long-term capital gains that might have been generated.Mintreplicated this methodology using data from theSecurities and Exchange Board of India?s Handbook of Statistics.', 'Calculations show that the government has missed out an annual average figure of over Rs32,000 crore in long-term capital gains over the last 10 years, based on a 10% tax rate.This is higher than the Rs20,000 crore mentioned in the budget speech.', 'The methodology does not account for the exemption on gains up to Rs1 lakh which has been made available in the latest budget due to lack of data on individual gains. Tax data was also not sufficiently granular to calculate how much of the long-term capital gains declared may have been below this threshold.', '', 'There is a direct correlation between market movement and long-term capital gains. There are peaks seen during the bull run preceding the global financial crisis. Similar gains are seen when the markets rose after the Narendra Modi government came to power. This may also mean that a crash in markets would erode collections.', 'The caveat to this is that the methodology considers that investors held half the delivered shares for more than a year. It also assumes that the capital gains realized on the same were not more than 50% of the final selling price. Differences in the proportion of delivered shares which have been held for more than a year, and the degree of their gains may alter the arithmetic. However, it does give an estimate which is useful until more granular data is made available.', 'The gains through the new tax would be important at a time the Modi government has been struggling with meeting fiscal targets. The fiscal deficit has been targeted at 3.3% of the gross domestic product (GDP) for 2018-19. This is higher than the earlier target of 3%. The new tax would help reduce the deficit by 0.1% of GDP, based on the government?s expected collection of Rs20,000 crore.', 'A little extra tax from the average stock market investor may not be asking for too much at such a time, though the government could consider providing indexation benefits and removal of securities transaction tax to soften the blow.']"
0,livemint,Politics,02-07-2018 01:10,Ajai Sreevatsan,Hardeep Puri says adequate funds available for flagship urban schemes,"['Budget 2018', 'affordable housing', 'Hardeep Puri', 'Smart Cities Mission', 'Pradhan Mantri Awas Yojana']",Housing and urban affairs minister Hardeep Puri says the Smart Cities Mission and Pradhan Mantri Awas Yojana (Urban) have received a significant increase in allocations,"['Housing and urban affairs minister Hardeep Puri on Tuesday said while funding for urban schemes might have gone up by just 3% in a rural focussed budget, there is a sufficient scale up for some key flagship schemes, many of which have a timeline for completion much beyond the 2019 polls.', 'The Smart Cities Mission and Pradhan Mantri Awas Yojana (Urban), in particular, have received a significant increase in allocations, he said at a press briefing.', '?We were actually a little worried because more than 3.7 million houses have been approved under PMAY till January 2018, but a dedicated fund has now been set up and we are confident we can build these houses,? Puri said.', 'The extra-budgetary support of Rs25,000 crore will be used to set up a dedicated affordable housing fund to be managed by the National Housing Bank.', 'Both Smart Cities and AMRUT have seen increases in allocation, but the absolute amount of committed investment for each of those flagship urban renewal schemes this year is only around Rs6,000 crore. The total investment envisaged in the 99 selected smart cities alone is Rs203,979 crore.', 'Ministry officials also said that the online building plan approval system in place in Mumbai and Delhi, which gave a boost to India in the World Bank?s ease of doing business rankings, would be extended to the 500 AMRUT cities in phases. According to estimates, the new system had reduced the number of days required for building approvals from 30 days to 8 days and gave a boost to India?s score.', 'The municipal corporations of Mumbai and Delhi will soon organise a stakeholder consultation and a third-party review of the online system will be undertaken to improve the approval process further, it was announced.', 'Since ease of living has become the new buzzword of the government, the commitment to release a livability ranking of 116 Indian cities, which includes all the smart cities, by June 2019 was reiterated by Puri.']"
0,livemint,Politics,02-07-2018 01:01,Neetu Chandra Sharma,Doctors in Delhi march against National Medical Commission Bill,"['Doctors', 'National Medical Commission', 'NMC Bill', 'Medical Council of India', 'AIIMS']",Doctors claim that the proposed NMC Bill would ?cripple? the functioning of medical professionals by making them completely answerable to the bureaucracy and non-medical administrators,"['New Delhi:Over 10,000 doctors staged a protest on Tuesday in the national capital, marching from All India Institute of Medical Sciences (AIIMS) to the Parliament House opposing the National Medical Commission (NMC) Bill 2017 that seeks to replace the Medical Council of India (MCI) with a new body.', 'Resident doctors from AIIMS-Delhi, Safdarjung Hospital, Post Graduate Institute (PGI)-Chandigarh and Aligarh Muslim University along with several other institutions and senior doctors took part.', 'The bill proposes allowing practitioners of alternative medicine, such as homoeopathy and ayurveda, to practice allopathy after completing a ?bridge course.? AIIMS Resident Doctors Association (RDA) has termed the bill as ?anti-poor?, ?anti-people? and ?unacceptable? to doctors and medical students in its present form.', 'During their protests, the doctors had claimed that the proposed legislation would ?cripple? the functioning of medical professionals by making them completely answerable to the bureaucracy and non-medical administrators. The Bill also proposes a common entrance exam and licentiate (exit) exam which all medical graduates will have to clear to get practising licences.', 'The RDA has also written to both the health ministry and the parliamentary committee to ?remove? these clauses. The Indian Medical Association (IMA) last month alleged that the proposed legislation will be beneficial to the rich and will hurt the poor while presenting its views before a parliamentary panel.', 'The bill also proposes constitution of four autonomous boards entrusted with conducting undergraduate and postgraduate education, assessment and rating of medical institutions and registration of practitioners under the National Medical Commission. The commission will have a government-nominated chairman and members, and the board members will be selected by a search committee under the cabinet secretary, the Bill says. The medical fraternity is opposing the clause fearing the body would effectively be run by the government.', 'The Bill was introduced in the Lok Sabha in December last year. Following protests by doctors from across the country, the Bill was referred to a parliamentary select committee.']"
0,livemint,Politics,02-07-2018 00:54,Pretika Khanna,"Budget 2018: Challenge is to implement healthcare scheme without leakages, says Ajay Narayan Jha","['Budget 2018', 'Ajay Narayan Jha', 'healthcare scheme', 'NITI Aayog', 'minimum support price']","Ajay Narayan Jha, expenditure secretary, on the spending targets of public enterprises, expenditure on the proposed mega healthcare scheme and minimum support price","['Ajay Narayan Jha, expenditure secretary, spoke about the spending targets of public enterprises, expenditure on the proposed mega healthcare scheme and minimum support price at the CNBCTV18-Mint Budget Verdict conclave.', 'On underestimation on the expenditure side:', 'I don?t think there is an under-provisioning of any kind in the estimates for next year.', 'Public enterprises spend target up at Rs93,000 crore:', 'A bulk of this will come from the railways and roads sector. Besides this, the other public sector firms also take up investments and have been factored in. We expect resources that we mobilize via the market and internal resources of enterprises will add up to almost a lakh crore this year.', 'On the new healthcare scheme (National Health Protection Scheme, or NHPS) expenditure:', 'I may not be able to give you a number because it depends a lot on the contours of the programme that will unfold. We have a broad outline of the programme but the challenge is to implement this programme in such a way that leakages can be prevented. It would be more than the Rs2,000 crore that has been provided.', 'On MSP:', 'The centre is committed to buy farmers? produce at 1.5 times the cost of cultivation. The second part is to find the mechanism for reimbursement which NITI Aayog has been asked to do in consultation with states and the ministry of agriculture.']"
0,livemint,Politics,02-07-2018 00:53,Amrit Raj,"There is no reason for fear, Nitin Gadkari tells auto industry","['Auto Expo', 'electric vehicles', 'Nitin Gadkari', 'auto industry', 'Ashok Leyland']",Union minister for road transport and highways Nitin Gadkari?s assurance comes amid concerns arising from the government?s decision to shift to electric vehicles,"['New Delhi:The Indian auto industry need not fear the momentum in favour of electric vehicles (EVs), said Nitin Gadkari, Union minister for road transport and highways. Gadkari?s assurance comes in the wake of views by several experts who feel that a sudden shift to EVs may change the shape and size of the industry, and may lead to job losses. In an interview, he set the context for future of policy, technologies and changing mobility in the country. Edited excerpts:', 'What is the outlook for the auto sector?', 'The size of the auto industry is Rs4.5 lakh crore, while the auto parts industry is around Rs1.45 lakh crore. Now, 125 trucks manufactured by Ashok Leyland have been exported from Chennai port to Bangladesh, while 258,000 cars have been exported from Mumbai port. Tuticorin port has exported 450,000 cars.', 'With the coming of cars running on alternative fuels such as electricity, ethanol, biodiesel, bio-CNG (compressed natural gas) and the progress in technology, there will be a definite rise in exports.', 'There will also be policies to scrap older cars and commercial vehicles. That will reduce the cost of raw materials, and make spare parts cheaper, which will increase their exports.', 'The industry, especially component makers, fear a significant disruption if EVs were to come to India suddenly.', 'They can make those spare parts which would be used in EVs. Besides, we are not banning petroleum and diesel fuels, so ICE (internal combustion engine) vehicles will still sell. Individuals can choose the fuel their car runs on but they will benefit if they (consumers) slowly change with the technology.', 'I believe there is no reason for fear because there are no restrictions in terms of fuel.', 'Initially, there was some talk that by 2030, India would have an all-electric fleet. Is that the official stand of the government?', 'There has been a fixation on the year 2030. The market should be driven by market dynamics.', 'If you spend Rs6,000 on your monthly car maintenance, but have to spend only Rs1,000 on an EV, with the maintenance cost falling, you would naturally buy the EV.', '(Let?s say) petrol costs Rs80 (per litre), diesel costs Rs60 (per litre) and electricity costs Rs8 (per unit). There are savings, so there?s no need to force EVs on people the world over.', 'We will also have an electric bus. BEST (Brihanmumbai Electric Supply and Transport) spends Rs110 per km, while a bus running on ethanol in Nagpur spends Rs78 per km. An electric bus will spend even lesser, at Rs50. Ticket rates will also fall by 25-40%. This is a good thing.', 'When is the policy on EVs expected?', 'The NITI Aayog has prepared it and we are awaiting cabinet approval.', 'There are several government departments involved with EVs. It is not clear who the final decision-making authority will be.', 'As long as the industry is progressing, there?s no issue. In Nagpur, there are 200 electric taxis, 20 charging stations with 20 more being added, with a location being readied to charge 600 EVs at once. An electric bike will also be available soon, with a proposal to deploy them as taxis. The driver and rider will be mandated to wear helmets. If it costs Rs200 to commute in a taxi, Rs100 in an auto, it will take Rs60 in an e-rickshaw and maybe Rs15 on an e-bike.', 'What is the incremental allocation you have asked for in the budget for the promotion of EVs in public transport?', 'We have requested for the road sector, bus ports, etc. We have asked for Rs25,000 crore more from the finance ministry, taking the total to Rs80,000 crore. But there are a few constraints.', 'The market for cars is three million units, with a projection that the number would reach 13 million by 2025 on the back of infrastructure growth and new technology. What is your view on this?', 'The auto industry in India provides maximum employment and contributes the most to growth. This is the most important industry as far as our industry is concerned and constantly, exports of automobile parts and even cars as a unit, have increased.', 'Therefore, we want to grow the sector and increase its exports contribution by way of innovation and research in alternative fuels, which are cost-effective, pollution free and indigenous import substitutes. We would like to promote such new technology and exports cars fitted with them; this would increase employment. So the industry and our GDP would benefit as well.', 'Earlier, the industry was averse to new technology. Have you noticed a change recently?', 'We said that 1 April 2020 is the deadline for the changeover to BS VI. Everybody was questioning the possibility. But today, a company has met the BS VI emission norms with BS IV fuel, so it is possible with research. There is no reason for fear. The more we innovate, research and design, the more our market and exports will grow. The cost of running a car will reduce, we will save fuel costs, so it will benefit the country.']"
