Unnamed,Source,Category,Date,Author,Title,Tags,Subtitle,Content
0,bloombergquint,['politics'],1/28/2018 3:25,Erik Wasson,Pentagon Wins as Trump Readies a $716 Billion Budget Request,[],"(Bloomberg) -- President Donald Trump will propose $716 billion in defense spending in his fiscal 2019 budget request, a 7.2 percent from his request for this year that backs the Pentagon?s push for a major buildup, a U.S. official said.","['(Bloomberg) -- President Donald Trump will propose $716 billion in defense spending in his fiscal 2019 budget request, a 7.2 percent from his request for this year that backs the Pentagon?s push for a major buildup, a U.S. official said.', 'The funding would include $597 billion for the Defense Department?s base budget, with the rest going for its war-fighting account and to other government programs such as the Energy Department?s nuclear weapons program, said the official, who spoke on condition of anonymity in advance of the release of Trump?s second proposed budget next month.', 'The amount is a sharp increase from the $668 billion total Trump proposed last year for fiscal 2018 and also offered as a placeholder for fiscal 2019. Currently, the Pentagon is operating under stopgap funding at fiscal 2017 levels, which totaled $634 billion. The plan, reported earlier Friday by the Washington Post, represents a victory of defense hawks over those trying to constrain deficit spending.', 'The U.S. official confirmed Trump?s next proposed budget will include major increases on procurement spending over the $124 billion sought this year.', 'Defense Secretary Jim Mattis has pushed for a jump in defense spending to match the breadth of the new National Defense Strategy he released this month.', 'Citing Russian and Chinese military ambitions, Mattis said in a Jan. 19 speech presenting the strategy that ?everything we do in the department must contribute to the lethality of our military? because ?our competitive edge has eroded in every domain of warfare -- air, land, sea, space and cyberspace -- and it is continuing to erode.?', '?No enemy in the field has done more to harm the readiness of the U.S. military? than the ?budgetary confusion? imposed by congressional budget caps and by stopgap spending measures passed by Congress, Mattis said in the speech.', 'Related story: Terror Loses Top Spot on U.S. Threats as Russia, China Rise', 'Ultimately, Trump?s proposal will be measured by the amount it exceeds the caps in the Budget Control Act of 2011.', 'Unless Congress waives the budget limits, as it?s done three times in the past, the cap for fiscal 2019, which begins Oct. 1, is $563 billion for defense-related spending, including $534 billion for the base defense budget.', 'The official said more than $90 billion of Trump?s budget proposal would come from the war-fighting fund -- known as Overseas Contingency Operations -- that?s exempt from caps. While the fund is supposedly for pressing war needs, it?s often used as a tool to bulk up overall defense funding. Trump?s war-fighting budget for the current year includes $10 billion for weapons acquisition.', 'Todd Harrison,\xa0a defense budget analyst with the Center for Strategic and International Studies, said in an email that a war-fighting fund in that range would be ?big news.?', 'The proposed defense budget, which Harrison said amounts to an increase of about 5 percent after adjusting for inflation, tracks bipartisan negotiations taking place in Congress on a two-year budget deal. Republicans and Democrats are seeking agreement on a $70 billion increase to defense budget caps in 2018 and 2019 paired with increases for domestic spending.', 'Combined with the recently passed tax-cut package, the defense increases are likely to make it difficult for the White House to produce a 10-year budget blueprint that balances over a decade, which has been a goal of White House budget director Mick Mulvaney.', 'Office of Management and Budget spokeswoman Meghan Burris declined to comment.', 'The funding request is consistent with Mattis?s strategy which focuses on ?high-end conflicts and identifies several technologies that need to be enhanced,? saidMark Cancian, a defense strategy analyst who?s also with the Center for Strategic and International Studies and is aware of the proposed numbers.', '?That would argue for a large increase in acquisition, procurement and R&D,? he said. The strategy also signals that adding military personnel ?will be a lower priority, so there will be less budget pressure on acquisition,? Cancian said in an email.', '', '', '', '©2018 Bloomberg L.P.']"
0,bloombergquint,['politics'],1/28/2018 8:00,The Quint,"Kabul  Blast: Death Toll Rises to 95; US, India Condemn  Attack",[],"A bomb, hidden in an ambulance, killed and wounded scores of people at a police checkpoint in the Afghan capital Kabul on Saturday, 27 January, in an area near foreign embassies and government buildings.","['A bomb, hidden in an ambulance, killed and wounded scores of people at a police checkpoint in the Afghan capital Kabul on Saturday, 27 January, in an area near foreign embassies and government buildings.', 'The spokesperson of the Ministry of Public Health in Afghanistan confirmed that the death toll from the blast rose to 95, with around 191 wounded.', 'The blast came a week after a deadly attack on the Intercontinental Hotel in the city. Although the Taliban group claimed responsibility for the attack, according to Iran?s Press TV, the Afghan government said that the Haqqani Network was responsible for the blast.', 'In a press release, India condemned the attacked and said there could not ?justification for such reprehensible attacks?.', 'Read the full text of the press release below:', 'President Ramnath Kovind also expressed his shock at the news of the attack and said, ?India stands shoulder-to-shoulder with the people and government of Afghanistan in the fight against the forces of terror and evil.?', 'Member of parliament Mirwais Yasini, who was in the area when the explosion occurred, said the ambulance approached the checkpoint, close to an office of the High Peace Council and several foreign embassies, and blew up. He said he saw a number of people lying on the ground.', 'A plume of grey smoke rose from the blast area in the city centre, while buildings hundreds of metres away were shaken by the force of the explosion.', ""US President Donald Trump also condemned the attack. ?All countries should take decisive action against the Taliban, which has claimed responsibility for Saturday's attack,? Trump said."", 'According to a report in AP, Trump said the ""murderous attack"" renewed US? resolve with its Afghan partners. ""The Taliban\'s cruelty will not prevail,"" he said, adding that the US is ""committed to a secure Afghanistan that is free from terrorists.""', 'In a tweet, Trump also said, ?We will not allow the Taliban to win!?', 'UN Secretary-General Antonio Guterres has strongly condemned the attack. In the statement released in Addis Ababa, where the UN chief is attending an African Union summit, he said:', 'France\'s ""Iron Lady,"" the Eiffel Tower, will turn off its lights in solidarity with the victims of Afghan capital Kabul\'s attack, the Paris Mayor said.', '(This is a developing story and will be updated)']"
0,bloombergquint,['politics'],1/29/2018 12:39,John McCormick,Wynn Out as Republican Finance Chair After Harassment Claims,[],"(Bloomberg) -- Billionaire Steve Wynn has stepped down as Republican National Committee finance chair, the RNC?s chairwoman said, a day after reports that the casino magnate had engaged in multiple instances of sexual harassment.","['(Bloomberg) -- Billionaire Steve Wynn has stepped down as Republican National Committee finance chair, the RNC?s chairwoman said, a day after reports that the casino magnate had engaged in multiple instances of sexual harassment.', 'The decision may be a blow to the Republican Party?s fundraising as it gears up for midterm elections in November with anunpopular presidentas its standard-bearer.', '?Today I accepted Steve Wynn?s resignation as Republican National Committee finance chair,? the RNC?s Ronna Romney McDaniel said in a statement that didn?t reference the harassment allegations.', 'Wynn,\xa0the founder of Wynn Resorts Ltd., paid $7.5 million to settle claims brought by a former manicurist at his Las Vegas resort who said he pressured her to have sex with him, the Wall Street Journal said Friday. The report contained numerous other allegations of harassment and coercion by other women.', 'Wynn?s departure was first reported by Politico. In a statement on Saturday, Wynn, whose fortune is estimated by the Bloomberg Billionaires Index at about $3.5 billion, noted the ?distraction? caused by allegations he termed ?preposterous? a day earlier.', '?The work we are doing to make America a better place is too important to be impaired by this distraction,? Wynn said in the statement. ?I thank the president for the opportunity to serve.?', 'The board of directors of Wynn Resorts met and formed a special committee comprised of independent directors to investigate the allegations, according to a statement issued by the board.', '?The board is deeply committed to ensuring the safety and wellbeing of all of the company?s employees and to operating with the highest ethical standards,? it said in the statement.', 'Committee members contacted by Bloomberg said they first learned of the allegations from news reports. One, who asked not to be identified because he wasn?t authorized to speak for the party, said that in his view the Republican Party couldn?t keep Wynn in such a high-profile position given the nature of the accusations.', 'Under Wynn, the RNC set a fundraising record in 2017 for a non-election year. It ended November with $33.5 million more in the bank than its Democratic counterpart, thanks in part to the big donors Wynn can attract.', '?Most of the credit for the cash on hand advantage goes to chairwoman McDaniel and her team. But Wynn was certainly a part of the success. He will be hard to replace, especially mid-cycle,?\xa0said Dan Eberhart, chief executive officer of oilfield services firm Canary LLC and a Republican fundraiser. ?It?s another worry the Republicans don?t need.?', 'The allegations come at a delicate time for the party, which needs to maintain its financial edge as it faces a wave of retiring House incumbents and an expensive Senate race in Florida.', 'The party is also struggling to\xa0improve its standing with women after its reputation was bruised last year in Alabama. Roy Moore, the party?s candidate for what had been one of its safest Senate seats, lost after allegations arose that he had sexually assaulted a 14-year-old girl when he was in his mid-30s and had pursued other teenagers.', 'Republicans also have to contend with the fact that President Donald Trump, who personally asked Wynn to be the party?s top fundraiser, came under fire in 2016 for a video in which he made lewd comments while taping the television program ?Access Hollywood? in 2005. Separately, 19 women have accused the president of sexual misconduct.', 'More recently were revelations this month that one of Trump?s lawyers paid adult-film actress Stephanie Clifford, known as Stormy Daniels, $130,000 before the 2016 election to keep quiet about an alleged affair with Trump that started in 2006.', 'As powerful men across an array of industries have been accused of harassing and abusing women, both parties have had to deal with misconduct allegations in their ranks. Democrats forced high-profile incumbents, including SenatorAl Frankenof Minnesota and Representative John Conyers of Michigan, to resign.', 'Among Republics, Representative Blake Farenthold of Texas\xa0decidednot to seek re-electionafter a report surfaced that he used $84,000 of taxpayer money to settle a sexual-harassment complaint brought by a former aide.', 'Republicans have been critical of Democrats for accepting money from the movie producer Harvey Weinstein, who was a prolific fundraiser for the party as well. In response to the allegations of sexual misconduct against Weinstein, the RNC?s McDaniel tweeted that returning his money ?would be a no-brainer.?', 'According to the Journal, which said it had contacted more than 150 people who worked with Wynn, he coerced the manicurist and massage therapists to perform sex acts for $1,000 tips.', 'In his statement denying the allegations, Wynn told the Journal that it was ?deplorable for anyone to find themselves in this situation.?', 'Democrats were quick to pounce. ?They remain silent amid sexual assault allegations involving Steve Wynn, one of their party?s most senior officials,? spokeswoman Sabrina Singh said in a statement on Friday. ?We believe that women must be empowered and respected.?', 'Wynn and Trump have a long history. They competed in the Atlantic City casino market two decades ago -- a period that included a fierce court battle. They have since made amends, though Wynn has said hedidn?t fully embraceTrump until he had already won.', 'Wynn said Trump asked him to be the committee?s finance chairman before the inauguration. His duties include building a national network of fundraisers and courting major donors, who increasingly have more options amid the rise of outside groups that can raise and spend unlimited sums.', '', '', '', '©2018 Bloomberg L.P.']"
0,bloombergquint,['politics'],1/29/2018 16:49,Timothy Ross,Trump Says He'd Be `Tougher' Than May in Brexit Talks With EU,[],"(Bloomberg) -- Donald Trump has criticized the way U.K. Prime Minister Theresa May is negotiating Brexit, saying he would take a ?tougher? line with the European Union in the talks.","['(Bloomberg) -- Donald Trump has criticized the way U.K. Prime Minister Theresa May is negotiating Brexit, saying he would take a ?tougher? line with the European Union in the talks.', 'Only three days after putting on a show of unity with May at the World Economic Forum in Davos, Trump risked reopening thewoundsin the so-called ?special relationship? between Britain and America.', 'In an interview with ITV?s Piers Morgan, he said he would have taken ?a different attitude? to the Brexit negotiations with the EU.', '?Would it be the way I?d negotiate? No, I wouldn?t negotiate it the way it?s negotiated,? Trump said in an interview to be broadcast in full later on Sunday. ?I would have said that the European Union is not cracked up to what it?s supposed to be and I would have taken a tougher stand in getting out.?', 'Trump?s comments will disappoint May?s office after the two leaders tried to patch up their differences during a mini-summit in the Swiss resort on Thursday. Such an outspoken critique of May?s Brexit policy from the U.S. president also threatens to weaken May further at home.', 'She?sunder pressurefrom Brexit-supporting lawmakers in her Conservative party who fear she will fail to deliver the decisive break with the EU that they want.', 'Trump is due to make a trip to the U.K. later this year, though no date has yet been set for the full state visit he?s been offered.', 'In the interview extract released in advance, Trump told Morgan he had ?a lot of respect for your prime minister and I think that you?re doing a job? on Brexit. But he saved his warmest words for his ?friend,? the French President Emmanuel Macron. ?He?s a great guy, his wife is fantastic, I like him a lot,? Trump said.', '', '', '©2018 Bloomberg L.P.']"
0,bloombergquint,['politics'],1/29/2018 17:03,Nafeesa Syeed,Senator Sees `End' of Trump's Presidency If He Fires Mueller,[],"(Bloomberg) -- Donald Trump?s presidency would ?end? if he followed through on efforts to fire Robert Mueller, the special counsel leading the investigation into Russian interference in the 2016 U.S. election, said Senator Lindsey Graham.","['(Bloomberg) -- Donald Trump?s presidency would ?end? if he followed through on efforts to fire Robert Mueller,\xa0the special counsel leading the investigation into Russian interference in the 2016 U.S. election, said Senator Lindsey Graham.', 'The South Carolina Republican spoke on ABC?s ?This Week,? days after a New York Times report that Trump had ordered Mueller?s firing in June but pulled back from the brink after the White House counsel threatened to quit in protest.', 'Graham and Republican Senator Susan Collins of Maine also said Congress should move forward on bipartisan legislation preventing a president from firing a special counsel.', '?I?m sure that there will be an investigation around whether or not President Trump did try to fire Mr. Mueller. We know that he didn?t fire Mr. Mueller,? Graham said. ?We know that if he tried to, it would be the end of his presidency.?', 'Graham?s comments echoed those of former Defense Secretary Robert Gates, who said on NBC?s ?Meet the Press? that members of Congress must underscore the ?political cost? that Trump would pay if he were to fire Mueller.', 'Bills have been floated that would protect a special counsel from being fired by a president. ?It probably wouldn?t hurt for us to pass one of those bills? to put an ?extra safeguard in place, given the latest stories,? Collins said on CNN?s ?State of the Union.?', '?It would be good to have legislation protecting all special counsels,? said Graham.', 'Read more: A Q&A explainer on what happens if Trump fires Mueller', 'Representative Kevin McCarthy of California, the second-ranking House Republican, said he doesn?t think there?s a need for legislation to protect Mueller. ?Right now there is not an issue. So why create one when there isn?t a place for it? ? McCarthy said on NBC.', 'Gates said it wasn?t clear that lawmakers would have the authority to stop the president with legislation if he decided to fire an executive-branch appointee like Mueller.', '?The one thing that can be done is to try and figure out how to make it clear, the magnitude of the political cost that would be incurred should he be fired,? Gates said.', 'White House legislative director Marc Short, asked if Trump would sign a special counsel protection bill, said, ?I don?t know, hypothetically.?', 'Gates, 74, who served both Republican and Democratic presidents, praised Mueller?s ?extraordinary integrity and character.? He said the former FBI director ?may come to a different conclusion? in the Russia investigation than what people are assuming, and ?that will elate some people and anger some people.?', 'Trump wanted to fire Mueller in June, weeks after he was appointed, the New York Times reported on Jan. 25. The president rescinded the order after White House counsel Donald McGahn threatened to resign rather than carry it out, the Times reported, citing people familiar with the matter who it didn?t identify. Trump called the story ?fake news.?', 'Gates rejected the idea posited by some conservative lawmakers and commentators that there?s a ?deep state? conspiracy of federal bureaucrats working to undermine the president. Conspiracies don?t work in Washington because of all the leaks, he said.', '?The idea that you could have some kind of a cabal to organize or control the government in some way and have it not leak or somebody go sell the story to a magazine or to a book publisher doesn?t comport with reality,? Gates said.', '', '', '', '©2018 Bloomberg L.P.']"
0,bloombergquint,['politics'],1/29/2018 17:25,Bloomberg News,"China Will Join First Japan, South Korea Summit Since 2015",[],"(Bloomberg) -- Chinese Premier Li Keqiang will travel to Tokyo for his country?s first joint summit with Japan and South Korea since 2015, the clearest sign yet of improving ties between the three neighbors.","['(Bloomberg) -- Chinese Premier Li Keqiang will travel to Tokyo for his country?s first joint summit with Japan and South Korea since 2015, the clearest sign yet of improving ties between the three neighbors.', 'The meeting was announced by China and Japan late Sunday, as Japanese Foreign Minister Taro Kono concluded a two-day visit aimed at repairing his country?s strained relationship with China.', 'Norio Maruyama, a spokesman for the Japanese delegation, said the summit could set the stage for reciprocal visits by Prime Minister Shinzo Abe and Chinese President Xi Jinping -- a trip neither leader has made since coming to power in 2012.', '?What we are envisaging is a visit to China by Prime Minister Abe and after that a visit to Japan by President Xi Jinping,? Maruyama said.', 'A three-way summit would demonstrate not only improvement in ties between Beijing and Tokyo, but in their relationships with Seoul, as well. China recentlyshelveda months-long dispute with South Korea over a U.S. missile shield, and Abe last week announced plans to attend next month?s Winter Olympics in Pyeongchang.', 'QuickTake: China?s Territorial Disputes', 'China and Japan agreed to hold the summit ?as soon as possible,? Kono and his Chinese counterpart, Wang Yi, said in a statement released after a four-hour meeting Sunday.', 'Relations\xa0between China and Japan have been frosty since a 2012 crisis over disputed islands in the East China Sea reignited longstanding suspicion between the two World War II foes. Kono -- the first Japanese foreign minister to visit China since April 2016 -- said the two sides need to work together to deal with issues of global relevance, ?in particular the North Korea issue.?', '?It is important not only to discuss issues related to the two countries, but for Japan and China to stand side by side to deal with global issues,? Kono said.', 'Kenji Kanasugi, director-general of the Asian and Oceanian Affairs Bureau at Japan?s foreign ministry, will meet\xa0Kong Xuanyou, China?s\xa0special envoy for Korean affairs, on Monday in Beijing to discuss issues on the Korean peninsula, Japan?s foreign ministry said in a statement.', 'Kono and Wang exchanged ?very frank? views on the East China Sea\xa0and reaffirmed their commitments denuclearizing Korean Peninsula and the need to fully implement United Nation sanctions against North Korea, Maruyama said.', 'The two sides also discussed ways to ?improve the business environment? and cooperation in third countries between Japan and China, he said. China is Japan?s biggest trading partner, while Japan is China?s second-largest single-nation partner after the U.S. Trade between the two countries was worth some $302 billion in 2016, according to data compiled by Bloomberg.', 'The diplomatic thaw has progressed despite continued signs of tension between the two sides. Earlier this month, China urged Japan to stop ?stirring up trouble? after the country protested a nuclear Chinese submarine near the disputed islands.', 'Li, the Chinese premier, told Kono on Sunday that Japan needed to properly handle sensitive issues related to history and differences between the two sides, according to China National Radio. Wang, the foreign minister, similarly urged Japan to put words into actions when it comes to normalizing the relationship.', '?At present, China-Japan relations are at a crucial stage,? he said. ?There is positive progress, but many disturbances and obstacles remain.?', 'Asurveyconducted late last year just 23 percent of Chinese respondents and 6.7 percent of Japanese saw ties between the two countries as good.', '(A previous version of this story corrected date of last trilateral summit to say it was held in 2015.)', '', '', '©2018 Bloomberg L.P.', 'With assistance from Peter Martin, Zhang Dingmin, Andy Sharp']"
