Unnamed,Source,Category,Date,Author,Title,Tags,Subtitle,Content
0,bloombergquint,['politics'],04-04-2017 21:15,Alex Morales,May Leaves Door Open to Free Movement in Brexit Transition Deal,[],(Bloomberg) -- U.K. Prime Minister Theresa May left open the possibility that freedom of movement could be part of a transitional agreement with the European Union if divorce talks aren?t concluded within the two years allotted.,"['(Bloomberg) -- U.K. Prime Minister Theresa May left open the possibility that freedom of movement could be part of a transitional agreement with the European Union if divorce talks aren?t concluded within the two years allotted.', 'A temporary arrangement would take effect in March 2019, when the the U.K. is officially out of the bloc, and would hold until a permanent trade deal is struck between the two sides. There is a growing acknowledgement that the formal mechanism to quit the EU, which May triggered March 29, might not allow enough time to untangle many of the sticking points.', 'On a tripto the Middle East, May was asked specifically about whether EU citizens should still have a right to come to the U.K., and vice versa, during this interim period.', '?Once we?ve got the deal, once we?ve agreed what the new relationship will be for the future, it will be necessary for there to be a period of time when businesses and governments are adjusting systems and so forth,? May told reporters as she flew to Amman on Monday.', 'Everything you need to know about Brexit explained right here.', 'This bridge -- the U.K. call it an implementation period, the EU refers to it as a transitional arrangement -- could last any number of years depending on how negotiations develop. Both sides seem to want to put a time limit on it, with three yearsone recentlyfloated figure.', '', '', '']"
0,bloombergquint,['politics'],10/13/2017 8:25,Ian Wishart,Brexit Talks Deadlocked as Both Sides Prepare for Cliff Edge,[],"(Bloomberg) -- The European Union said talks hit an impasse over what the U.K. owes when it leaves, increasing the chances of a messy departure as time is running out to clinch a deal.","['(Bloomberg) -- The European Union said talks hit an impasse over what the U.K. owes when it leaves, increasing the chances of a messy departure as time is running out to clinch a deal.', 'The pound fell to the weakest in a month after chief EU negotiator Michel Barnier said there had been no discussions over the all-important bill that the U.K. has to agree it will pay before the EU will start trade talks.', 'Read more about Brexit?s costs and whether Britain will pay up', 'Barnier put the onus firmly on the U.K.?s squabbling government to find the political will to move the talks forward, while both sides raised the prospect of talks breaking down without an agreement -- throwing businesses into a chaotic legal limbo.', '?No deal will be a very bad deal, huh? And to be clear on our side we will be ready to face any eventualities and all eventualities,? Barnier, told reporters in Brussels on Thursday. After his words, the pound traded down by as much as 0.6 percent against the euro.', 'On the question of the financial settlement -- the most intractable of the three pressing issues -- Barnier said: ?We have reached a state of deadlock which is very disturbing for thousands of project promoters in Europe and it?s disturbing also for taxpayers.?', 'Barnier noted that Prime Minister Theresa May had pledged in her speech in Florence last month that the U.K. would continue to pay into the EU budget for two years after the split.', 'He signaled disappointment that this wasn?t followed up in the negotiations this week. But in return for those payments, May wants a two-year transition period to ease the anxiety for businesses.', 'But the U.K. understood his words as an elegant cry for help from the Frenchman to the 27 European leaders, according to a person familiar with the U.K. team?s negotiating position: a plea to them to loosen up his mandate so he can start talking about the future alongside the divorce terms.', 'If true, between now and the summit a week away, signs of movement may come from the rest of the European capitals. May?s government believes the ball is still in the EU?s court -- and it is now for the other leaders to decide if they want to unlock the talks.', 'Barnier held out hope that progress could be made at a summit in December, if the U.K. fleshes out more what May alluded to in Florence less than a month ago. That will be hard in a Conservative government constantly at war with itself on the direction of Brexit -- her own chancellor was mauled by euro-skeptics for his reluctance to plow money into non-deal contingency plans.', 'Starting trade talks in December leaves less than a year to get a deal on trade and the transition. Some businesses won?t wait around to see the outcome, with banks the first taking steps to go. Crashing out of the bloc would wreak havoc on the economy, affecting flights, financial markets and pharmaceuticals and slapping tariffs on all foreign trade.', 'The U.K. is still butting against the EU?s timetable, saying it can?t sort the divorce issues, such as the U.K.?s new EU land border that will bisect the island of Ireland --- until trade talks are under way.', 'With talks showing increasing brinkmanship, Brexit Secretary David Davis said: ""I make no secret of the fact that to provide certainty, we must talk about the future.?', 'The focus now turns to the summit next week of the EU?s 27 leaders. Initially trade talks were expected to start at that meeting, now the U.K. can hope for little more than encouraging words -- or chinks in the EU?s armor.', '', '', '']"
0,bloombergquint,['politics'],1/25/2018 16:02,Jennifer Epstein,Trump Says He's Weighing Path to Citizenship for `Dreamers',[],(Bloomberg) -- President Donald Trump said he?s open to giving young undocumented immigrants a path to citizenship in an immigration deal the White House will be negotiating with Congress.,"['(Bloomberg) -- President Donald Trump said he?s open to giving young undocumented immigrants a path to citizenship in an immigration deal the White House will be negotiating with Congress.', 'There would be a 10- to 12-year process for those now protected from deportation under the Deferred Action for Childhood Arrivals to get citizenship if they work and maintain a clean criminal record, Trump told reporters Wednesday at an impromptu appearance at a White House briefing.', '?We?re going to morph into it. It?s gonna happen at some point in the future, over a period of 10-12 years,? Trump said. ?I think it?s a nice thing to have the incentive of after a period of years being able to become a citizen.""', 'An administration official, who briefed reporters on condition of anonymity, later clarified that the path to citizenship is a discussion point rather than a planned policy proposal.', 'With negotiations on immigration legislation proceeding slowly, Trump said he might extend the March 5 date he?d originally set to end the Obama-era DACA program, which right now covers about 690,000 immigrants brought to the U.S. illegally as children, if Congress hasn?t acted by then. But he added that was not a guarantee. A district judge has blocked Trump?s decision to scrap DACA and the issue may end being resolved by the Supreme Court.', 'The group, known as dreamers, ?should not be concerned? about their fates, he said. ?We are going to solve the problem. It?s up to the Democrats but they should not be worried.""', 'Trump repeated his previously stated conditions for a immigration deal: curtailing family preferences in immigration, abolishing the visa lottery program, and building a border wall.The White House plans to release a ""legislative framework"" for an immigration plan on Monday that will address those concerns, press secretary Sarah Huckabee Sanders said in a statement earlier Wednesday.', 'Trump spoke shortly after a bipartisan group of senators met to work out a process for developing and then shepherding immigration legislation through the House and Senate, where there are deep divisions over how to address the issue. The three-day government shutdown that ended Monday helped jump-start the immigration talks.', 'Lawmakers are preparing for a likely floor debate on immigration if they can?t agree on a plan by Feb. 8, the next deadline when current government funding authority expires.', 'Second-ranking Senate Republican John Cornyn of Texas is working with No. 2 Senate Democrat Dick Durbin of Illinois on a compromise solution. Cornyn said Wednesday he thinks that group will provide a ""framework"" for a bill that could move through the Senate.', 'However, House Speaker Paul Ryan, a Wisconsin Republican, said his chamber wouldn?t be bound by any decisions made in the Senate. Any measure that moves through the House likely would have to have Trump?s firm backing.', 'Republican Senator Lindsey Graham of South Carolina said Trump?s statement in support of a path to citizenship for DACA recipients ?will allow us to solve a difficult problem? and help get an agreement on strong border security measures.', 'Cornyn said he wants a 10-year, $25 billion border security plan, with the money possibly set aside in a trust fund, not just authorized and paid for later.', '', '', '', '©2018 Bloomberg L.P.']"
