Unnamed,Source,Category,Date,Author,Title,Tags,Subtitle,Content
0,livemint,Politics,02-08-2018 11:15,Yunus Y. Lasania,"To pressurise centre, Pawan Kalyan calls for formation of JAC in Andhra Pradesh","['Pawan Kalyan', 'Andhra Pradesh', 'Jana Sena Party', 'TDP', 'BJP']",Jana Sena Party chief Pawan Kalyan calls upon all stakeholders to join hands and form a joint action committee to demand ?justice? for Andhra Pradesh,"['Hyderabad:Even as Telugu Desam Party (TDP) members of parliament (MPs) demand that the centre fulfil promises made to Andhra Pradesh after the bifurcation from Telangana in 2014, Jana Sena Party (JSP) chief Pawan Kalyan has called upon all stakeholders to join hands and form a joint action committee (JAC) to demand ?justice? for the state.', 'The actor-turned-politician, who campaigned for the TDP and Bhartiya Janata Party (BJP) during the 2014 state and parliament elections, said all promises made to AP by the centre were ?lies? and that he would pressure the centre to fulfil its promises.', '?Raising slogans in the parliament won?t help. In Telangana, all stakeholders (including political parties) came together and formed a JAC. The same needs to be done now,? he said at a press conference on Wednesday.', 'Kalyan was also critical of the Andhra Pradesh government led by N. Chandrababu Naidu. ?There are lapses on its side as well and in the process the people of AP are losing out,? he said. He suggested the JAC be formed with former Congress MP Undavalli Arun Kumar and the Lok Satta Party in AP.', '?We will also support the bandh call on Thursday, but the Jana Sena cadre should confine it only to peaceful protests. The purpose of the protest is to express people?s pain to the centre and the government,? Kalyan later posted on Twitter, with regard to a bandh call given by the left parties in AP on Thursday.', 'Although the JSP did not contest the 2014 elections, Kalyan is considered to be crucial for the TDP to secure votes from the Kapu community in AP (which he belongs). He is also seen as the person behind securing all the seats for the TDP in the assembly from the East and West Godavari districts in AP, which have a sizable Kapu population.', 'When asked if he will continue his alliance with the TDP or break it, Kalyan refused to comment. In January he announced the beginning of his political career and started his campaign with a three-day tour from Jagityal district in Telangana and later continued it to AP.']"
0,livemint,Politics,02-08-2018 12:48,howindialives.com,News in Numbers: RBI projects 5.1-5.6% CPI inflation in first half of 2018-19,"['RBI', 'Inflation', 'Price rise', 'BJP', 'Congress']","In other news, five of the seven national political parties (BJP and Congress are excluded here) have declared their income for 2016-17","['28 hours', 'What is it?The number of weeklyworking hoursthat 900,000 worker-members of IG Metall, a German labour union, can opt for up to two years, for a lower salary, before returning to the standard 35-hour week.', 'Why is it important?The pact covers 900,000 workers in the metals and electrical industries in a region where several top industrial groups of Germany are based, including Daimler and Bosch. More importantly, IG Metall agreements are seen as industry benchmarks in Germany, andsimilar pactscould be seen in other sectors also, giving a major victory to German workers for a better work-life balance.', 'Tell me more:According to the International Labour Organisation, in 2016, the mean working hours per week per employed person varied from32 hours(Netherlands) to 50 hours (Qatar).', '12 days', 'What is it?The number of days betweenWall Street Journalpublishing a story accusing Steve Wynn of a pattern of sexual misconduct over the years and himresigning as CEOand chairman of Wynn Resorts, late Tuesday.', 'Why is it important?The #MeToo movement has seen many women in the US come out about sexual harassment they faced, but those complaints and experiences centred around Hollywood and famous women actors. While 76-year-old Wynn is a public figure, and founder and CEO of a listed company whose 2017 revenues were $6.1 billion, his accusers are not famous. Hence, his resignation is being seen assignificant for gender relationsin the existing power constructs.', 'Tell me more:Trading in the Wynn Macau stock on the Hong Kong Stock Exchange was halted on Wednesday. Since theWSJstory broke, shares of flagshipWynn Resortsare down 12%.', 'Rs300 crore', 'What is it?The combinedincome declaredby five of the seven national political parties (Bharatiya Janata Party and Congress are excluded here) for 2016-17.', 'Why is it important?According to a report released on Wednesday by the Association for Democratic Reforms (ADR), theBahujan Samaj Party(BSP) had the highest income, of Rs173.58 crore, in 2016-17, a year in which Uttar Pradesh, the party?s main state of influence, went for elections. This illustrates how the income of political parties tends to spike in the lead up to elections. However, BSP spent only 30% of this amount during the year. Grants/donations/contributions formed 40% of the income of these five parties.', 'Tell me more:The two highest income declarers of the previous year,BJP and Congress, are yet to declare their incomes for 2016-17, and were overdue more than three months.', '6 months', 'What is it?The current duration for which India?s central bank has now held therepo rate?the key interest rate in the banking system?at 6%.', 'Why is it important?At the meeting of its Monetary Policy Committee (MPC) on Wednesday, itexpectedly choseto maintain status quo on interest rates. In its last few meetings, the government and industry were, at times, holding out for a cut. Such optimism was missing this time, with inflation on the rise, share markets in turmoil and the US signalling higher rates. The Reserve Bank of India (RBI) on Wednesday warned about inflation, projecting a band of 5.1-5.6% for the Consumer Price Index in the first half of 2018-19.', 'Tell me more:Of the six members in the MPC, five voted in favour of holding rates, while one member,Michael Patra, wanted a 0.25 percentage point increase.', '400', 'What is it?The number ofdismissals effectedby M.S. Dhoni in one-day internationals. He crossed the 400 mark on Wednesday when he stumped South Africa?s Aiden Markram off Kuldeep Yadav, in a match that India convincingly won.', 'Why is it important?Dhoni is only thefourth wicket-keeper, and the first Indian, to cross 400 dismissals in one-day internationals. Kumar Sangakkara leads with 482 dismissals, followed by Adam Gilchrist (472) and Mark Boucher (424). Among the four, Dhoni has the lowest average dismissals per innings, of 1.293.', 'Tell me more:It was telling that Dhoni?s 400th dismissal was a stumping. Heleads all keepersin stumpings (106 dismissals), a testimony to the greater reliance on spin bowlers by India compared to some other sides.', '', 'howindialives.com is a search engine for public data']"
0,livemint,Politics,02-08-2018 12:38,PTI,Sonia Gandhi says Modi government not in sync with reality,"['Sonia Gandhi', 'Modi government', 'BJP', 'violence against minorities', 'Congress']",Sonia Gandhi alleges the Narendra Modi government is orchestrating violence against minorities to polarise society for narrow political gains,"['New Delhi:Launching an all-out attack on the Bharatiya Janata Party (BJP) and the Modi government, Sonia Gandhi on Thursday said she would work with like-minded political parties to ensure its defeat in the next general elections.', 'Addressing the Congress Parliamentary Party, of which she is the chairperson, Gandhi alleged that the government was orchestrating violence against minorities to polarise society for narrow political gains. This would be seen in Karnataka too, which goes to the polls in a few months, she said.', 'Gandhi told party MPs to work with dedication, loyalty and enthusiasm with Rahul Gandhi to strengthen the party and said he was her boss too. ?We have elected a new Congress president and on your behalf and on my own, I wish him all the very best. He is now my boss too - let there be no doubt about that - and I know that all of you will work with him with the same dedication, loyalty and enthusiasm as you did with me.', '?I am confident that we will work cohesively under his leadership to revive our party?s fortunes. That process has begun,? she said.', 'Gandhi also dubbed the Modi government as one not in sync with reality. This, she said, was evident in the prime minister?s speech in the Lok Sabha on Wednesday.']"
0,livemint,Politics,02-08-2018 12:22,PTI,Congress protests in Rajya Sabha against PM Modi?s remark on Renuka Chowdhury,"['Congress', 'Narendra Modi', 'Renuka Chowdhury', 'Rajya Sabha', 'Modi Renuka Chowdhury']",Rajya Sabha proceedings adjourned till noon after Congress members create an uproar over PM Narendra Modi?s remarks against party MP Renuka Chowdhury,"['New Delhi:Rajya Sabha proceedings were adjourned till noon on Thursday after the Congress members created an uproar over Prime Minister Narendra Modi?s remarks against party MP Renuka Chowdhury.', 'No sooner had the House mourned the death of its former member Frida Topno and the listed papers were laid on the table, Congress members were on their feet protesting against Modi?s dig at Choudhury during his reply to the debate on Motion of Thanks on President?s address on Wednesday.', 'Chairman M. Venkaiah Naidu chided the members for their ?unbecoming? behaviour and asked them to resume their places. ?I have no option other than to adjourn the House,? he said, suspending the proceedings till 12pm .', 'On Wednesday, during the reply, Modi had questioned the Congress?s claim of being the originator of the biometric national ID Aadhaar when he said that the then home minister L.K. Advani had in 1998 spoken about an all-purpose national ID in Rajya Sabha. This led to Chowdhury bursting into loud laughter. Naidu disapproved of the behaviour but Modi asked him not to stop Chowdhury.', '?Sabhapati ji meri aapse vinti hai Renuka ji ko kuch mat kahiye. Ramayan serial ke baad aisi hansi sunne ka saubhagya aaj jaake mila hai(I request you not to say anything to Renuka ji. After the Ramayan serial, we got the privilege of hearing this kind of laughter only today),? he said, to the amusement of top Bharatiya Janata Party (BJP) leaders and other ministers sitting around him.', 'Chowdhury had protested the remarks but the chairman did not allow her comments to go on record.', 'On Thursday, the Congress tweeted: ?We condemn PM Modi?s derogatory remark in Parliament against former Union minister and RS MP Renuka Chowdhury.? ?We also urge the RS Speaker Shri Venkaiah Naidu to not act in a partisan manner and accord due respect to a fellow member of the house,? it said.']"
0,livemint,Politics,02-08-2018 11:50,Yunus Y. Lasania,Andhra Pradesh bandh today to protest against Union budget,"['Andhra Pradesh bandh', 'Union budget', 'Left parties', 'Protests', 'YSR Congress']",Left parties and other civil society organisations are protesting against the less-than-expected fund allocation to Andhra Pradesh in the Union budget,"['Hyderabad:Left parties and other civil society organisations have called a bandh in Andhra Pradesh on Thursday to protest against the ?injustice? and less-than-expected fund allocation to the state in the Union budget 2018.', 'The opposition YSR Congress Party and Congress have also agreed to support the call.', 'Communist Party of India (CPI) state assistant secretary Satyanarayana Murthy said that the centre did not fulfil any of the promises that were made in the Andhra Pradesh Reorganization Act at the time the state got bifurcated from Telangana in 2014. ?There was no support for Andhra Pradesh. The 12 educational institutions promised to the state haven?t seen light of the day yet,? he said.', 'Murthy, who is based in Vishakhapatnam, said his party is ensuring that the bandh call is successful and that all establishments stay shut for the day. ?Even otherwise, the Union budget did not even provide proper funds for other projects in the state,? he said.', 'Both Congress and YSRCP leaders from Andhra Pradesh said their parties are also fully participating in the bandh. On Wednesday, Jana Sena chief Pawan Kalyan also extended his support to the bandh, but asked his party workers to only protest peacefully and not cause inconvenience to the general public.', 'Kalyan, who campaigned for the ruling Telugu Desam Party (TDP) and Bhartiya Janata Party (BJP) alliance during the 2014 general and assembly elections, also called for all stakeholders to join hands and form a joint action committee (JAC) and demand ?justice? for the state. In a press conference on Wednesday evening, he criticized the Andhra Pradesh government and the centre with regard to the budget.', 'The issue of Andhra Pradesh receiving less-than-expected funding has soured relations between the TDP and the BJP, putting the alliance on shaky grounds. Andhra Pradesh chief minister N. Chandrababu Naidu said last month that he will withdraw from the National Democratic Alliance (NDA) fold if the BJP does not want the partnership. Naidu had called for an emergency parliamentary meeting last Sunday where it was decided that all TDP MPs will protest in parliament and demand more funds for Andhra Pradesh from the centre.']"
0,livemint,Politics,02-08-2018 11:28,PTI,"Shatabdi, Rajdhani, Duronto trains to have 4 CCTV cameras in every coach","['Shatabdi', 'Rajdhani', 'Duronto', 'Indian Railways', 'CCTV cameras']","All Rajdhani, Shatabdi and Duronto train coaches are to be fitted with CCTVs?one each on the (two) entry gates and two in the gallery (corridor), says railways official","['New Delhi:All coaches of the Shatabdi, Rajdhani and Duronto trains will soon have four CCTV cameras each to ensure passenger safety, a railways official said.', 'Twenty-three pairs of Rajdhani, 26 pairs of Shatabdi and 18 pairs of Duronto trains would have the facility, he said on Wednesday. ?All Rajdhani, Shatabdi and Duronto train coaches are to be fitted with CCTVs?one each on the (two) entry gates and two in the gallery (corridor),? Vishwesh Chaube, general manager, Northern Railway, said at a media briefing.', 'Around Rs3,000 crore was allocated in the 2018-19 Union budget to install CCTV cameras in more than 11,000 trains eventually, officials said. They added that the ministry was also looking at different options to fund the project, including market sources.', 'The project would eventually extend to cover all the premier and suburban services and the 8,500 stations in the railway network. Chaube, however, said the money for the project would come from the Nirbhaya fund.', 'He added that the Northern Railway had achieved a total originating earnings of Rs15,841 crore in 2017-18 (till January), compared to the Rs15,663 crore registered in the previous year. This year?s budget announcement has scaled up investments by almost three times to Rs1,48,528 crore in 2018-19 as against the Rs53,989 crore in 2013-14. The highest priority has been given to passenger safety with the total expenditure planned under this head amounting to Rs73,065 crore.']"
0,livemint,Politics,02-08-2018 14:01,AFP,Maldives chief justice threatened with death before arrest: lawyer,"['Maldives', 'Abdulla Saeed', 'Maldives chief justice', 'Mohamed Nasheed', 'Abdulla Yameen']","Maldives chief  justice  Abdulla Saeed received death threats before his arrest in a regime crackdown, his lawyer said ahead of a UN Security Council hearing on the island nation?s political crisis","['Malé, Maldives:The Maldives? top judge received death threats before his arrest in a regime crackdown, his lawyer said on Thursday ahead of a United Nations Security Council hearing on the island nation?s political crisis.', 'Chief Justice Abdulla Saeed was warned he would be ?cut into pieces? if he did not overturn a court order quashing convictions against high-profile political dissidents, his lawyer Hisaan Hussain said.', 'Saeed was arrested as President Abdulla Yameen declared a state of emergency in the honeymoon islands after refusing to obey the court order.', 'The top judge was accused of accepting bribes to impeach the regime leader, who has jailed most of his political opponents.', '?The Chief Justice was forcefully dragged on the floor from his chambers by uniformed security personnel in riot gear after he told them they were in contempt of court,? Hussain said. He did not say who issued the threats.', 'Saeed is among two top justices detained in a sweeping crackdown by Yameen, who has doubled down since the Supreme Court cleared his political rival Mohamed Nasheed, among other regime critics, of terrorism charges.', 'The remaining three judges restored the conviction on Tuesday ?in light of the concerns raised by the President?, after Yameen declared the state of emergency and accused the justices of trying to overthrow him.', 'The international community has censured the president for imposing special emergency provisions that allow the military to detain suspects for long periods without charge.', 'The UN has urged Yameen to lift the state of emergency, and will discuss the crisis gripping the Indian Ocean archipelago in a closed-door meeting at the Security Council on Thursday.', '?The Maldives have seen in recent years attacks on political opponents, on journalists, on civil society and human right defenders, and what is happening now is tantamount to an all-out assault on democracy,? UN rights chief Zeid Ra?ad Al Hussein said in a statement on Wednesday.']"
0,livemint,Politics,02-08-2018 14:21,AFP,"Khaleda Zia, Bangladesh ex-PM, jailed for 5-year in corruption case","['Khaleda Zia', 'Bangladesh', 'corruption case', 'Khaleda Zia jailed', 'Bangladesh Nationalist Party']",A Bangladesh court sentenced opposition leader Khaleda Zia to five years in jail today after convicting the two-time former premier of embezzling money meant for an orphanage,"['Dhaka:A Bangladesh judge convicted opposition leader Khaleda Zia of corruption and sentenced her to five years in jail on Thursday as police clashed with thousands of her supporters outside the court.', 'The court found the two-time former premier guilty of embezzling money meant for an orphanage, a charge she had consistently dismissed as politically motivated.', 'Zia, leader of the Bangladesh Nationalist Party (BNP), is expected to appeal against the verdict, but it may affect her ability to stand in a general election slated for December.', '?This is a false and staged case. No way we will accept this verdict,? BNP secretary general Fakhrul Islam Alamgir toldAFPafter the hearing.', 'Zia?s lawyer Khandkar Mahbub Hossain said the ruling was ?political vengeance? and would be overturned by a higher court.', 'Ahead of the hearing police fired tear gas at thousands of opposition activists who defied heavy security to escort the car taking Zia to the magistrates court.', 'The private television stationSomoysaid at least five police officers had been injured and two motorcycles torched during the clashes that broke out several kilometres (miles) from the court premises.', 'Authorities have for days been on high alert for protests in the tense city, where political demonstrations by Zia?s centre-right BNP and its Islamist allies in 2014 and 2015 left nearly 200 people dead.', 'Around 3,500 opposition activists and officials were arrested in a sweep by security forces ahead of the verdict according to BNP spokesman Rizvi Ahmed.', 'A senior officer toldAFPmore than 5,000 police had been deployed in Dhaka.', 'Zia, 72, is a former ally turned arch-foe of Bangladesh?s Prime Minister Sheikh Hasina.', 'Her party boycotted 2014 polls in which Hasina was re-elected but is expected to contest the upcoming general election.', 'Zia, who entered politics in the mid-1980s after her military dictator husband was assassinated in an abortive coup, also faces dozens of separate charges related to violence and corruption.', 'She has repeatedly said the charges against her are aimed at excluding her and her family from politics.', 'Her son Rahman lives in exile in London and was convicted of money-laundering in 2016.', 'Last month prosecutors sought the death penalty over his alleged role in a deadly 2004 grenade attack that injured Hasina.', 'Zia and her son were detained by an army-backed government in 2007 and spent a year and a half in detention pending trials for alleged corruption.', '?This is an attempt to use the court against me, in an effort to sideline me from politics and elections and to isolate me from the people,? she told a packed news conference on Wednesday.', 'Human Rights Watch on Thursday urged the government to stop what it called ?arbitrary arrests and detentions?.', '?The Bangladesh government?s claims to be open and democratic ring hollow as it cracks down on political dissent,? said the group?s Asia director Brad Adams.', '?The government has a responsibility to prevent and minimise violence, but it needs to do so in a way that respects basic rights, not flouts them.?', 'Many private schools declared a holiday on Thursday in anticipation of the verdict, while several ride-hailing services announced a day-long suspension of their operations.', 'Police have set up check-posts at key entry points of the city in an effort to prevent thousands of rural supporters of BNP and its Islamist allies from marching to the capital.', '?Dhaka is effectively cut off, people in panic,? read the front-page headline of the Bengali-language newspaper Prothom Alo.', '']"
0,livemint,Politics,02-08-2018 15:15,PTI,"BSP, JD(S) announce alliance for Karnataka, Lok Sabha elections","['BSP', 'Janata Dal Secular', 'BSP-JDS alliance', 'Karnataka polls', '2019 general elections']",The BSP and the Janata Dal (Secular) have announced that they are entering into an alliance to contest the Karnataka assembly and 2019 general elections together,"['New Delhi:The Bahujan Samaj Party (BSP) and the Janata Dal (Secular) on Thursday announced that they are entering into an alliance to contest the Karnataka assembly polls together.', 'The alliance would continue in the 2019 Lok Sabha elections as well, BSP leader Satish Chandra Misra and JD (S)?s Danish Ali said at a press conference. They said the two parties would contest the Karnataka assembly polls due sometime in April together.', 'The term of the 224-member Karnataka assembly ends in May.', 'The Bharatiya Janata Party (BJP) wants to wrest power from the Congress which rules the state now.']"
